author_name,review_title,review_text,author_rating,visit_date,overall_rating
NaijaBabe2016,DELICIOUS & TRULY AUTHENTIC JAMAICAN CUISINE! 👌🏽👏🏼👍🏽,"Jamski has become a must-visit location for me when in Lagos- (which is a rarity). Ever since I tried Jamski's sublime cuisine for the first time last year, I was totally hooked! Island Food- (most notably Jamaican Fare), is one of my favourite cuisines. And...it's worth mentioning that this particular type of food is hard to come by anywhere in Nigeria, so coming to Jamski is always a special treat for me. I met the amazingly delightful PAPA JAMSKI last year and his fabulous daughter PRINCESS JAMSKI. Their charm, friendliness, presence and extraordinary personality is 'the icing on the cake' at Jamski! This 'dynamic duo' are some of the loveliest people you will ever meet! 😍 They make the experience at Jamski all the more pleasurable and memorable! 🥰

My daughter had never tried Jamaican Food, so I decided to order some of their most famous and enduring classics. I'm familiar with Jamski's very varied menu, to which I gave a very detailed description in my last/first review of the restaurant. For this visit, we went for ESCOVITCH FISH (Rice, Peas, Plantain), a side of JERK CHICKEN and an OXTAIL MEAL (Rice, Peas, Plantain). For our drinks, we got one SORREL and one COCONUT WATER. We also ordered BEEF PATTY and CHICKEN PATTY, (2 each), for take-away. As usual, everything was simply delicious- packed with all those vibrant, tropical, spicy, Islandy flavours I love about Jamaican Food!😋 The Jerk Chicken was slightly dry and underseasoned. It didn't taste fresh, and it was like it hadn't been marinated for some time prior to grilling, so the seasoning(s) didn't penetrate the chicken. I found the Oxtail, Escovitch Fish, Rice & Peas and Patties to be absolutely sumptuous. My daughter thought the Escovitch Fish lacked flavor, but loved the vinegary pickled vegetables on top, and the hints of coconut in the Rice & Peas. She also thought the Sorrel (Zobo) drink was too pepperish. My Coconut Water tasted very ordinary.

So again, the experience at Jamski ends up being another 'slam dunk'- (at least as far as I'm concerned). It seems that in my eyes, Jamaican Cuisine can do no wrong; especially when you get to interact with hosts as exemplary as PAPA JAMSKI and PRINCESS JAMSKI. The folks here are simply wonderful! 👏🏼 It's always so nice to see these incredible people, and I'd like to say a big thank you to them for catering to us so well as usual, and for all their warmth and TLC. The prices at Jamski are very competitive. We payed under 30 thousand naira for our food, including an extra Chicken Meal for our Chauffeur. I'm also thrilled that my daughter got to sample Jamaica Cuisine. She was very impressed by it, and finally understand why I fuss so much about it! 😄 I look forward to hopefully visiting Jamski yet again, (the next time I visit Lagos); perhaps with a different family member! The food here is so authentic and impressive, so please endeavor to check out Jamski- Home Of The Jamaican Patty.......and so much more!!!More",45,August 2022,4.5
gbansomtine,Surprise  surprise !!!,"My crew and I went out for a meal @ this lovely restaurant  yesterday, the food was nice , like home cooking and the staff were very friendly. I definitely will  come back again , when in Lagos",50,February 2022,4.5
NaijaBabe2016,JAMAICAN CUISINE @ IT'S ABSOLUTE FINEST!!! 🥐 🍜 🥘 🍛🍹,"Jamaican Food is one of my favorite types of cuisine ever.  I knew about Jamski Restaurant, because my husband once brought me some yummy Jamaican Patties from them.  I hardly ever visit Lagos; so when I happened to do so, Jamski was most definitely on...my 'bucket-list' of places to visit.  First and foremost, I have to give an 'honorable mention' to PRINCESS.  I had difficulty locating Jamski, so I ended up calling the restaurant for directions.  Princess was of such tremendous help to me. Her seamless 'relatability and connectivity' is an irrefutable asset to any establishment!  She never hesitated to pick up my calls and was unwavering in her determination to get me to Jamski! 👍🏽 Princess is a total Angel, 👼🏽 and I truly appreciate her assistance.

When I did eventually find Jamski, it was such an adorable gem of a place; almost a shack-like eatery.  Jamski is a lively, high-spirited environment, what with all the vivid and radiant imagery depicted throughout.  Green, yellow and black- (the colours of the Jamaican flag) were dutifully and liberally used all over Jamski.  The islandy, tropical decor of Jamski came in the form of stunning murals and oil murals in naturalistic outdoor settings, which adorned the interior, as well as the exterior.  This captured an upbeat, festive Carribean vibe. It was all so, so legit and authentic! 😁  I particularly loved the bold images the bold images of everybody's favorite 'Son of Jamaica' BOB MARLEY!  One was outside and one was inside, (refer to pictures posted).  Just catching a glimpse of the image of this global cultural, legendary musical icon, always puts me in a great mood!  I consider this cornerstone of Jamaican Pop Culture, Pioneer of Reggae Music, Heroic Advocate of Pan-Africanism to be one of the coolest people that ever lived! 😎 🤞🏽

Inside Jamski Restaurant, you had pictures/portraits of star athletes and Olympic Gold Medalists hanging on the wall, and a bold image of  Usain Bolt striking his trademark 'lighting bolt' or 'to di world' pose.  A gigantic map of Jamaica was an interesting visual treat to perceive.  There were 2 parts to Jamski Restaurant; one seemed to be a bit more casual- (located by the entrance), and the interior part, a bit more cozy and intimate.  The National Anthem of Jamaica was on full display, and Jamski's placemats were of the Jamaica flag.  The words 'One Love' also made a notable 'cameo' on a high wall.  I also adored how the ""J"" in Jamski's title had on a Tam (Rastacap)- the crocheted, colored cap typically associated with the Rastafari lifestyle! All these heart-warming Jamaican accoutrements and memorabilia lent an uplifting, cool ambiance to Jamski.  It's worth mentioning that I ran into the owner of Jamski. His name was PAPA JAMSKI. This delightful gentleman was absolutely lovely!  He was charming, funny, jovial, cordial, accommodating, warm-hearted, and super pleasant!  I enjoyed chatting with him, and he made me feel very welcome.  PRINCESS was so lovely as well.  She was so professional, friendly and hospitable.  What a fantastic family! 😍

The menu at Jamski Restaurant is out-of-this-world amazing!  The hard copy menu itself is an attractive, colorful, glossy affair with a picture of every single food item on the menu. Very visually descriptive!  This makes it easy for customers who aren't too familiar with Jamaican Cuisine to make their selections.  There were Entrees, A La Carte and Combo meals available.  Jamski's Entrees were mostly served with Rice, Peas & Fried Plantains.  Entrees included items like Seafood Rundun (RunDown), Escoveitch Fish, Ackee & Salt, Brown Stew, Jerk Roasted Fish, Curry Chicken/Pork/Goat, Salt Fish with Broad Beans/Cabbage, Brown Stew Chicken, Roast Beef, Steamed Fish, Jerk Pork, Roast Beef, my all time favorite- Brown Stew Oxtail and Jerk Chicken of course.  For the entrees that aren't served with Rice, Peas & Plantain, you get Steamed Vegetables, Boiled Green Banana & Bolied Yam. 

For the A La Carte Menu, items included Curry Vegetables & Beans Delight, Curry Snails, Curry Prawns, Curry Goat Wrap, Chicken/Fish Soup, Jamski BBQ Wings, Jamski Chicken Wrap,Jamski One Pot, Jamski Fried Rice, Jamski Chicken Wings, Red Peas Soup, Prawns & Chicken Stir-Fry, Roast Beef, Seafood Rundown, Pumpkin Soup, Popcorn Chicken, Jamski Alfredo Pasta, Goat Soup (spicy mannish wata), plus the usual 'classics' like Jerk Pork, Roasted Fish, Roasted Curry Oxtail, Curry Jerk Chicken, Curry Goat, Escoveitch Fish, Brown Stew Chicken and Ackee Salt. The Combo Meals at Jamski are Beef Patty & Coco Bread, Callalo Loaf with Sweet Potatoes Wedges, Popcorn Chicken & Tallawah Bites, Meat Loaf with Sweet Potato Wedges, Jerk Chicken & Sweet Potato Wedges, Jerk Chicken Loaf, Salt Fish Loaf & Pieces of Jerk Chicken, Cheese Patties & Coco Bread, Callaloo Loaf, Jerk Chicken & Coleslaw, Jerk BBQ Wings, Festival (sweetened fried dough) & Sweet Potato Wedges, Jerk Chicken, Festival with Coleslaw, Meat Loaf with Jerk Chicken, Jerk Pork, Festival with Coleslaw, Brown Stew Oxtail and Brown Stew Chicken, Festival, Fried Ripe Plantain & Coleslaw.  Side Dishes include Salt Fish Fritters, Steamed Veggies, Festival, Sweet Potato Wedges, Mac & Cheese and Plantains. 

They had a colorful fridgeful of home-made alcoholic and non-alcoholic drinks.  This variety of 'elixirs' were mostly laced with one of Jamaica's most well-known exploits- Rum! Of course, Rum Punch, as well as other cocktail-like offerings in plastic bottles were available.  Mixed Fruit, Pina Colada, Lemon/Ginger, Sorrel and other non-alcoholic mix-ups were also on offer.  There was also a shelf stocked full of house-made jerk sauces and marinades.  I ordered the Jerk Chicken and Brown Stew Oxtail Entrees, plus a Mixed Fruit Mocktail to go, as I was in s hurry.  Just as I expected, everything tasted incredible; cooked  with Princess's love, heart and soul! 😋 The chicken was spicy and flavorful, and the oxtail was smooth and melts-in-your-mouth velvety!  It tasted truly authentic, and brought back so many fun memories of my University days in Southern Florida, where I grew to love this enduring Caribbean cuisine.  Wish I got to have the Jamaican Patty, but there just wasn't enough time to grill them. 

So in conclusion, I cannot say enough nice and positive things about Jamski.  This place is a resplendent and wholesome joint!  I don't know why the song by Jimmy Cliff, 'Wonderful World, Beautiful People' kept reverberating in my head for some reason! 🤔 I hope this isn't an offensive cliche or inappropriate stereotype; however, these are the words that seemed to 'rotate' in my head and mind in regards to PAPA JAMSKI and PRINCESS who are just that-.....Wonderful People....! in their 'Wonderful World'! 😄  It was fascinating to me to see Papa Jamski sitting down to write a new menu for the restaurant.  I thought to myself, 'what else could he possibly add to this vast, diverse and expansive menu?' 'what more delectable Island treats could he additionally include?'.  Since I definitely plan on returning to Jamski, by the special grace of Almighty God, it would be interesting to see what additions he'll make!  Wish him the best of luck there. 👍🏽  I look forward to dining in next time.  My overall experience at Jamski was fantabulous; from the delicious food, to the warm ambiance to my jolly interactions.  The only frank criticism I would impart on Jamski is that the fried plantain was cut too thin.  It seemed more like soft plantain chips, so I would kindly urge them to slice their plantains a little more thickly please.  I want to take this opportunity to say a big thank you to PAPA JAMSKI and PRINCESS 'JAMSKI', (as I fondly named her!). 🤗  Their down-to-earth candour, friendly demeanor and pure professionalism is unparalleled and they should be extremely proud of their impressive establishment!  I loved coming here, and Iook forward to returning in the not-too-distant future to sample as much as their awesome options as possible. YEEEEEAAAAAAHHHHH MAN!!! 👌🏽🙅🏾‍♀️🤞🏽  Jamski Restaurant is your one stop shop for fantastic Jamaican Cuisine in Lagos, so I highly, highly, highly recommended it! ONE LOVE!!! 👊🏽 ♥️👍🏽More",45,April 2021,4.5
eCeasar,"Nice environment, delicious Jamaican meals just fabulous","A sweet serene environment with wonderful staffs, trust me you wouldn't wanna go back if you come to this amazing restaurant",45,September 2020,4.5
ASHIRU O,Great visit,Serene environment with very friendly staff. Felt like I had been going there for years. Great food.,40,April 2019,4.5
Y6571FYandyc,It's As Laid Back as Jamaica!!,"This is not fine dining. It's a few tables with Jamaican placemats, murals of Bob Marley on the wall and no two glasses the same!! The service is not the quickest and the food won't necessarily arrive all at the same time.

But you know...what? It doesn't matter (unless you're an obsessive compulsive). It's Jamaican!! You will get a warm welcome from Emmanual and his wife knows how to turn out very tasty Jamaican food. Most of my friends are fans of their signature patties - me less so. But I have tried most of the menu over a period of months. The Brown Stew Oxtail (like all the brown stew dishes) is meaty and thick with a sticky barbecue sauce. The Jerk Chicken is great but my favourite is the Jamski One Pot where you get a little bit of everything and its served with rice and peas and some plantain.

You can bet that the background music will be reggae (what else would you expect). And I can recommend the Jamaican Rum Punch (which is what it packs!) or for non-alcohol drinkers a Banana punch.

If you looking for fine dining or regimented service delivery this may not be for you. If you want a fun, chilled out evening, some good food and the chance to relax I highly recommend Jamski.More",50,April 2019,4.5
neilyp2015,Delicious,"I have been eating at Jamski ever since I discovered them. The food is really delicious and I have never been dissapointed. The patties are equisite, rice and peas so beautifully seasoned and the jerk sauce great..rum ounch is powerful !",50,September 2018,4.5
Johnny-be-Good17,My first time eating Jamaican food,"And it was wonderful! From the outside it looked like a bar but the food was very good. I hat meat pie as a starter and then grilled pork with jerk sauce, rice and fried plantain. Delicious! 
It is a Jamaican family that runs the...restaurant and on the inside they have some Bob Marley graffiti on the walls. Service was also quite good.More",50,September 2018,4.5
Michael Chima E,Best Jamaican Restaurant in Lagos City,"Simplicity is the beauty of Jamski Jamaican restaurant on Victoria Island in Lagos, Africa's largest megacity. 
The food is world class and the hygienic environment is the best attraction for me. 
The business lunch with the DECENTplatform's Ambassador for Africa remains unforgettable, because we enjoyed...the food and drinks with reggae music playing without noise.More",50,June 2018,4.5
Ose P,"Delicious, authentic Jamaican food","Jamski brings the taste of Jamaica to Lagos, with its mouth-watering selection of meals, patties and drinks made by Jamaican chefs. I had the pot roast, three different patties (on two visits) and tried my cousin's jerk chicken - I loved every bite. Its warm,...welcoming owner (Emmanuel) and staff, together with its tropics/Reggae-inspired decor and iconography adds the perfect finishing touch to the chilled-out, island-life experience. Whether you want to hang out with friends and family or take a break from the stress of Lagos, this lovely establishment will satisfy your needs and your taste buds.More",40,July 2018,4.5
AndyTipling,Excellent Jamaican Food,"Jamski is exactly what Lagos needs - Jamaicans cooking authentic Jamaican food.
The jerk chicken is fantastic, as is the jerk wings. The rum punch must be sampled and the service is very friendly.",50,July 2018,4.5
Rilwan B,A lovely restaurant.,"A nice restaurant with authentic Jamaican food. It was recommended to me by a Jamaican friend of mine so I knew it had to be good. Well, I was right. The food was really nice and I had a rum punch after the meal, which...went straight to my head. Lol.More",40,April 2018,4.5
dunetpeek,Sitting in or delivered- Great food,"The food is tasty and authentically spiced. The service is friendly, the portions generous but not wasteful.I have been here on different occasions and had home deliveries and the food is consistently excellent.",40,March 2018,4.5
Ephi,"Lovely Little Place, Great Food.","I have visited Jamski on multiple occassions and they have always lived up to expectations.
The restaurant has a cosy atmosphere, the staff are very friendly, and the food is great.
It is a great place to visit with friends if you want to try...or if you enjoy Jamaican food.More",50,April 2018,4.5
gaziedecker,Not had better food than this in Lagos! :),Had roast jerk fish with rice and peas (& fried ripe plantains) on two occasions... I can still savour the taste.Took a while to come but was worth the wait. Customer service is very pleasant... 'Mr Jamski' is a very affable character and means business.,50,December 2017,4.5
ShallyWaly,"Good food, good ambiance and friendly people","If you are looking for a truly Jamaican restaurant in Lagos, Jamski is the place where you will be hosted by the most friendly JAMAICANS who will make you feel like family. 

Out of all the Jamaican restaurants I've tried in Lagos (and I've tried...More",45,May 2016,4.5
Chuchu E,Authentic Jamaican cuisine,"Thanks so much for stopping by,  we appreciate your patronage. We are currently trying out new dishes so please stop by and let us know what you think!",50,October 2016,4.5
