author_name,review_title,review_text,author_rating,visit_date,overall_rating
Olusola B,Consistent through the years,"As usual, the food was very flavourful. Our waiter, Kehinde was very attentive. Was there for a birthday celebration",40,July 2023,4.0
Michael R,Terrible,They had a very terrible service. The staffs were very rude and nonchalant. The food also tasted so bad.,40,January 2023,4.0
NaijaBabe2016,Disappointing Sushi! 🍣👎🏽,"This is my second visit to Ocean Basket- (the V.I Akin Adesola branch). Was with my daughter this time around, so decided to try it again because she loves Seafood, and Ocean Basket is your one-stop-shop for great Seafood in Lagos. I won't get into...any details about the restaurant/menu, as I wrote an extensive review about it 5 months ago. It was an overall pleasant experience, with yummy Seafood and a nice ambiance. I wanted to try the Sushi at Ocean Basket on my maiden visit, but was told at mid-day that it wouldn't be available till after 3p.m, so I had to settle for their regular Seafood options.

This time around, Sushi was available, (thank heavens)! 🤲🏽 Not being too hungry, I ordered just 2 Sushi(s)- the PANKO SALMON FUTOMAKI and the PANKO PRAWN FLOWER GUNKANS, plus CRUMBED PRAWN TAILS (Served with Herb Mayonnaise) as my Starter. My daughter got the LEMON GARLIC MUSSELS or MUSSELS IN LEMON GARLIC SAUCE and CREAMY SEAFOOD PASTA. For her drink, she got a Mocktail called OCEAN BASKET SPECIAL. We were presented with 3 complimentary freshly baked Bread Rolls, served with 3 'mismatched' Sauces/Dips. The last time around, these Bread Rolls weren't fresh, but on this visit, they were hot, soft and fluffy! 😋

Both my Sushi(s) were a big letdown! First of all, the rice used wasn't the right kind, and just about every ingredient within the Sushi was tasteless and underseasoned. For the Flower Gunkans, I thought the actual Sushi would be wrapped in a sheet of Smoked Salmon. Yet, it was enveloped in a murky, pale, overly thick slice of pickled ginger! YUCK! 😫 It was too thick and pungent to be eaten, so I ended up unwrapping the ginger and discarding it entirely. The Futomaki Panko Salmon was decent, but perhaps because it was deep fried. Nevertheless, it lacked flavor. My Crumbed Prawn Tails were good, so crunchy, fleshy and fried perfectly. 

My daughter loved, loved, loved her Creamy Seafood Pasta. She said it's one of the best Pasta dishes she's ever had, and that they were super generous with the Seafood in it. For over 10 thousand naira....they better be! 😄 She also enjoyed her Ocean Basket Special Mocktail, but as for the Lemon Garlic Mussels, it was a different story. Though she said the sauce was delicious, the Mussels weren't cleaned properly, so the 'waste product' on them was still attached to the flesh. How gross! 🤮 Not knowing much about this type of shellfish, (as I don't like it)- I took her word for it. 

So this second experience at Ocean Basket ends up being a 'mixed bag'......a medicore mixed bag at best! Service is okay, albeit a bit slow. We had to urge them to speed it up a bit as we were in a hurry. Ocean Basket is still a place a would visit again, but I will most definitely avoid their Sushi. It is crystal clear that SUSHI IS NOT THEIR STRENGTH, so I'd politely urge customers visiting Ocean Basket to kindly avoid the Sushi here and go for the various types of Seafood on offer. Sending their employees to Sushi School won't hurt! 🍣 🍱 🏢

I rated Ocean Basket highly the first time I reviewed them, but this time around, it's going to have to be an average. The only thing that 'salvaged' the experience was the Fresh Bread, Crumbed Prawn Tails, the Lemon Garlic Sauce that accompanied the Mussels, and the Creamy Seafood Pasta of course. They should please endeavor to improve upon their Sushi, clean out the poop from their Mussels and speed up the service a tad bit. Regardless of the 'hiccups' this time around, Ocean Basket is still a wholesome, decent Seafood Joint that serves impressive Seafood, and I'd highly recommend it! 🍤 🧆 🦐 🐟 🦀 🐙 🦞More",40,August 2022,4.0
NaijaBabe2016,Impressive Seafood! 🍤 🦀 🐟 🦐,"I've been wanting to eat at Ocean Basket restaurant since I caught a glimpse of it while on a brief visit to Lagos last year. See I love, love, love me some seafood! 🦐🐟 🦀 😋 Besides, 'jewels of the sea & ocean' are few...and far between in a country like Nigeria; except if you happen to be in a port city like as Lagos. If I'm not mistaken, Ocean Basket is a South African chain of restaurants- with multiple branches in Africa, a few in Europe and one in the Middle East. I visited one of 3 branches in Lagos- (the Victoria Island one), and the restaurant was expansive, simple, bright and trendy. It was spread over 2 floors, plus a small outdoor/balcony area. Unfortunately they had a water leakage problem from the ceiling of the second floor on the day I visited, so I was seated in sort of a private room area upstairs. I had to bolt out of there fast because there was a French speaking family with small children that were super loud without consideration for anybody. Seriously, they seemed to be engaged in a shouting match! 🙉 I simply couldn't bear to sit there, so I was subsequently ushered downstairs. These folks were causing one hell of a commotion!!! 😫

Ocean Basket's menu is plentiful, without being too overwhelming. They had Starters & Meze, Salads, Platters (for one and to share), Fish, Prawns, Calamari, A Mediterranean Dish (Fritto Misto), Combos, Seafood Favorites, Ocean Basket Specials, Top Ups (sides), Sushi (plus Sushi Platters), Desserts (including Liquid Desserts) Mocktail Carafes, Beers, Ciders, Cold Coolers, Coffees/Teas and Cold Drinks. I wanted to order a Platter For One and Flower Gunkans Sushi , but was told that Sushi wouldn't be available till after 3p.m. I visited around noon. How disappointing that was, as their Sushi looked good from the pictures on the menu! 🍣 😋 Instead, I went for the NEPTUNE MEZE PLATTER (hake goujons, firecracker squid, calamari, crumbed prawn tails, battered zucchini, tomato, cucumber with 1,000 island, herb mayo and zesty mayo) from the Starters & Meze section. I also ordered an additional FAMOUS FISH & FISH (200gs of the all time favorite hake) cause I was famished. This meal would serve as my breakfast, lunch and dinner, as I was set to travel later that day. For my drink, I got the OCEAN BASKET SPECIAL, one of the mocktails on offer. For dessert, I ordered a CUSTARD TART (Pastéis De Nata)- a Portuguese Custard Tartlet. 

Overall, I have to say that I really enjoyed both my Neptune Meze Platter and the Fish & Chips. Both dishes were fried to crispy, golden perfection and presented impeccably; (refer to my posted pictures). The mocktail was very good too, as was the Custard Tart. However, the 'Pasteis De Nata' seemed to have fallen apart by the time it reached my table, so it looked a bit 'deconstructed'. Besides, it didn't taste fresh. I was served a complimentary bread basket with 3 weird dips, and 'unfresh' bread that had been over-warmed to the point of becoming as hard as a rock! Wish they had just passed on this. Service at Ocean Basket is excellent, from the friendly and polite demeanor of all the staff, to the Manager's warm reception. There was someone named WALE, (either the waiter who served me, or the Manager), can't quite seem to remember. I'd like to thank him for his kindness. The food was promptly delivered, and just about everything was on point. The ambiance of Ocean Basket is 'cool, calm & collected', and everything seems clean, orderly and well maintained.

 I was slightly let down by the fact that they couldn't 'tame' the boisterously loud family in the enclosed seating area I had initially sat down at. I wasn't the only guest who asked to leave that particular area. They were at least 2 sets of customers that came downstairs complaining about the ruckus they were causing! 😫 When I lamented about the noise, all they said was that they couldn't tell the family to keep it down because there was a language barrier, since they only spoke French! This is unacceptable, and came across as a weak, pathetic excuse not to keep rowdy customers in line. They need to take all their customer's 'feelings' into consideration, and not just one set of 'Francophone Loud-Mouths'! So all in all, I enjoyed my experience at Ocean Basket. This indeed is the 'Mediterranean Home of Seafood'- (just like it says under the title). The seafood is delicious, and I really look forward to returning and sampling many other dishes, especially their Sushi. It's your 'go-to-place' for fabulous Seafood in Lagos, and I highly, highly recommend it!!! 👏🏽👍🏽👏🏽👍🏽More",40,April 2022,4.0
chalenebraun,Lovely Saturday lunch with friends!,"We were in Lagos for the weekend and our local suggested we visit Victoria Island and Lekki, Ocean Basket can’t recommended and it didn’t disappoint. We shared an appetizer platter full of calamari, prawns and fish & chips. It was delicious. We chose to share...another large platter for entree with pretty much the same items. The grilled queen prawns were beautiful and fresh. Highly recommend. Wale, our server was attentive and helpful!More",40,March 2022,4.0
111onyekao,Wedding Anniversary,"Fantastic meal. Fantastic customer service. Thank you Victor for your service. I promise to come back, Good job!!!",40,February 2022,4.0
margarete823,Birthday hangout,"Is expensive though  but a fantastic place and fabulous service from my professional waiters , Mr Victor  super..",10,January 2022,4.0
senayan2021,Nathalie,"Ocean Basket is an amazing place to have brunch and discuss Business. Beautiful ambiance
The waiters too are exceptional. I enjoyed my time here",30,January 2022,4.0
m0y0s0rel,Delicious meal!,"We enjoyed the meal and atmosphere.  Very accommodating for kids.  We were served by Victor who was very patient while attending to to us, especially the kids request.  We will definitely visit again.",40,December 2021,4.0
164divinef,Hangouts,"The meal was nice served by Victor My Waiter and would love to be back, Victor was professional on his waiting job thanks to him.",50,December 2021,4.0
nkemsoi,Review,The ambience was fantastic and Victor was helpful and very polite. Great service! Value for money definitely.,50,December 2021,4.0
O6490VQkatieo,Dinner Date,Great Service. I’ll definitely recommend this place for anyone looking for a place to have their dates. My waiter service was from Victor. Nice guy.,50,November 2021,4.0
charleswN5687PZ,Revised visit,"I will say this a nice restaurant and the best place you can have seafood, I also got a fabulous service that's brought down my mind and feel home again. All this was done by a young waiter called Victor, he is best. Always ask...of him to sit your table.More",50,November 2021,4.0
popeourfriend,Awesome place to be,Had the platter for one with a Greek salad and  I was stuffed. They could do better on the rice but every other thing was awesome.  kudos to Chris  a great host..,50,October 2021,4.0
Ekababy,Surprise family Review,"I am very impressed..the service and the food very good...the staff pleasant. One thing that swept me off was the Professionalism of Victor ,he knows his game well...he was told by my Mystery Surpriser not to mention or give me a clue of who he/...she is...I cajoled ,made all for Visitor to reveal who the person is..He did not.

I will give this place thumbs up,the environment clean and staff ready to help with any request.
Victor a hug from me.

The best of this was when the staff came to celebrate my daughter ..singing the happy birthday...More",50,October 2021,4.0
898princessn,Hangout,It was my first visit here and victor did fabulously well. The restaurant is indeed the number in Lagos. I’m so coming back again.,40,September 2021,4.0
JusticeJoyce,Good Service. Clean place. Overcooked Shrimp,"Service via Mr. Chris was superb. 
The pink lemonade cooler isn't blended ice but refreshing and tasted akin to a good Kool-Aid. 
They provide warmed rolls upon settling in a la the States or a steakhouse. 
I like the three (3) sauces including garlic oil,...More",40,August 2021,4.0
oluwatomisino620,Hangout,Food was amazing. You need to stop by. Victor was at our beck and call. Thank you visitor for the amazing service.,40,August 2021,4.0
37nancyy,family hangout,We loved the food and costumer service by our super waiter victor. We promise to come back next time and I recommend him to service next time.,40,July 2021,4.0
victor e,Take away order..,Best seafood plug and their servers are very kind I was attended to by Victor.. Will come back next time with friends and family.,40,April 2021,4.0
ruthgH8411QK,Sunday hangout,"Victor, was a good server,
Nd I love their food,😋😋😋😋
I will definitely come back, nd I will like him to serve me next time I come around.",50,July 2021,4.0
993amaraa,Dinner alone,Victor is an amazing waiter!!!! He was so good and the food is lovely. It was my birthday and Victor and co sang an amazing birthday song for me. I had a blast!!!!!!!!!!!!!,30,July 2021,4.0
rexsavage,Sunday hangout,"Really enjoyed the meal😩😩
D desert was so lovely
Promise to come back again next tym
Loved d rice it tastes realy really Good
Served by Victor",50,June 2021,4.0
Anne O,The kids loved it,"The children had a great time. They had their first try at Sushi and the customer service was very good. The sea food was good. I will rate the food 3 out of 5 and the service 5 out of 5, thanks to our waiter...More",50,June 2021,4.0
Angie1114,Miss,"The staff are cordial, food was yummy, ambience is cool, nice menu and the waiter Eniola was super! Thank you  Eniola",50,May 2021,4.0
tochio2021,Friends hangout,Interesting experience with waiter Victor. We promise to come back soon. It was fun and I and my friends had an awesome experience.,50,May 2021,4.0
vivianaO5323TC,My birthday breakfast,Wonderful breakfast service is so wonderful with the best waiter Victor. I just love this place can't wait to come back.,50,May 2021,4.0
joerge234,Very good Seafood!,"We was a couple of times already there and enjoyed always the food. Nice, easy going place. The fish was always very delicious. They have a nice terrace upstairs, relaxing at evening times. We go there almost weekly.",50,April 2021,4.0
991pamelao,Friends and family,Food is lovely. And waiters are polite. Lol too polite. Lovely experience. Will visit again. And will ask for victor. He’s my favorite waiter.,40,April 2021,4.0
Goldborn20,Hangout with my friend,"Victor was so amazing 🥰
The service here was nice, the food was cool and the environment is serene❣️",40,April 2021,4.0
Jet41876171106,Lovely place but the music will chase you away,Always enjoyed their food .. I stopped going because of the incessant load music ... eveni in the glasses in area cut meal short to abandon ...,40,March 2021,4.0
akinjoleo,My ocean basket experience,"I had a wonderful experience and Victor my waiter was so nice and professional at the same time. 
It was my first time having sea food and I didn’t know what to expect 
With my visit to OB I can say I’d definitely like to...More",40,March 2021,4.0
193ezinnec,Family hangout,service was top notch and my waiter.Mr.Victor made the visit worthwhile. Especially with the birthday fireworks,40,March 2021,4.0
akuheh,Val and Anniversary Grub!,"Victor deserves a raise, if not a managerial position! The food? Best in 9ja! Can't say enough about this delicious restaurant!!!",40,February 2021,4.0
PolyPride,Don't Bother Going,"I went to Ocean Basket because it was listed as a top ten restaurant in Lagos. It was highly disappointing. The service was absolutely terrible. My waiter, Victor completely stood around talking to the bartenders for 15 minutes after I completed my starter. I asked...More",40,January 2021,4.0
olakunlet2020,Dr,"Food was lovely, staff friendly. Overall, great service 

Victor was our waiter and he was friendly and prompt",40,November 2020,4.0
Osayi O,Enjoyed my time,"Service rendered was great, lovely atmosphere. Great food too! The staff were ever ready to offer service, food came in good time. Will surely visit again.",50,September 2020,4.0
Wisdom001,Really love the service,"The packaging and service is top notch!
Looking forward to coming here again🙂
When I come to Lagos I always endeavour to have a meal here before stepping out",40,July 2020,4.0
zephpaul,Exquisite,"In my own opinion I think this a place to be. From the entrance to the lobby to the rooms, there is a touch of excellence. Keep it up and keep open for improvements.",50,October 2019,4.0
Motecz,Party,"If you want chops, snacks, trust u won't wanna settle for less, you deserve more and better come here and feel this place",20,May 2020,4.0
idokostevens,Great seafood place,First time visit and I really fell in love.  A friend brought me here and I had the best seafood eating experience ever.  I certainly will return.  The service quality was top rank.,50,March 2020,4.0
nwaelij,Good,"I love their packing space.
Their dishes are great, whoever prepares them definitely knows what they're doing",50,March 2020,4.0
AnnieLagos,Anita celebrates,Good food with great ambience. Had a great time with family and friends. Restaurant also has good parking. Great selection of seafood. #lagoslife,50,February 2020,4.0
TheLuckyTraveller14,Best Restaurant in town,"Great fresh & tasty food (fish), friendly and fast service, clean place. Fair price. Best Restaurant in Town",40,February 2020,4.0
iamzy_gote,My lunch,"The first day I ate there I felt that is the best restaurant in Lagos, it is a nice place for dinner",40,February 2020,4.0
segunopeke,Lunch at Ocean basket,Lunch was quite interesting at the ocean basket. Good ambience and good food. Food was good and fresh and tasted really nice. Service was okay and waiters were quite friendly.,40,November 2019,4.0
JunaidM50,Nice Afternoon Hangout,"Its a great place to hangout for a lunch. We did a business lunch where the service was good. They took care of the order, the waiters even explained the orders well to some of our colleagues. Overall it was a good experience.",40,April 2019,4.0
Real O,Ocean Basket,"Amazing staff , great food . Lovely atmosphere.
Would definitely recommend and can’t wait to go back .",40,October 2019,4.0
orluuchi,A customer,"The staff were very accommodating, friendly and nice...they offered to take us pictures and always ready to offer help .. I enjoyed my stay and would be returning",40,October 2019,4.0
margaretolele,Fantastic Seafood and Engaging Staff,"Was invited to Oceanbasket by a former colleague. I had visited Oceanbasket before, but not on Akin Adesola. The grilled option and queen sized prawns were my options and they were great. The seafood soup was also classic. I have seen visited the restaurant three...More",40,August 2019,4.0
Andrei07,Delicious food and amazing service,I’ve read about ocean basket in Victoria island on tripadvisor and watched some food vlogs on YouTube and this place does not disappoint. Food is of a very good quality  but the service is second to none . Emmanuel took care of us for our...More,40,September 2019,4.0
Jonathan Peter C,Had a wonderful time,"Heard alot About the seafood so I decided to go dere with my friends.... Honesty I was impressed with  the atmosphere and friendly staffs... Really enjoyed our meal and the service was on point,cool music to go with the experience... The manager came to check...More",50,August 2019,4.0
FolaO,Beautifully prepared and presented sea food,Amazing food. My friends and I loved everything about this restaurant. It was so well done. And there was such a variety. Would return there in a heartbeat.,50,July 2019,4.0
Olumide D,Oceans Basket,Great service from Victor.... GREAT AMBIENCE...food is great. Money well spent. I am bring the whole family next time,50,August 2019,4.0
walext07,Great service,Cool and serene environment.. Enjoyed the night out with my friends.. Would definitely revisit again soon.,50,August 2019,4.0
AdunOg,Lunch with an old friend,"I was catching up with an old friend. We chose Ocean Basket because our last meeting many years ago was actually at the same restaurant. The restaurant did not disappoint......the environment was spotless with surprisingly clean air. (On previous visits, I used to be bothered...More",50,July 2019,4.0
Kenosky,I would recommend the Ocean Basket Sunrise cocktail carafe,"Ocean Basket offers a serene environment for friends and family to relax. For me, it was a solo trip but I'm sure that next time I'm at the Ikeja City Mall, I shall definitely be here with my family. I had the Ocean Basket Surprise...More",50,July 2019,4.0
Francisebuehi,The new Ocean basket is far better,The new Ocean basket is better. Food was very tasty and service was very good. Waiter was courteous.,50,June 2019,4.0
Leizl R,Ocean Basket is Great...,I love your foods and also the milkshake its very delicious. My sister and I loved  serviced it is very approaching and your seafoods are amazing it's always fresh. 👍👍👍👍👍,50,June 2019,4.0
yinkus2016,GREAT PLACE FOR SEA FOOD,I like their very rich menu of sea food. The location is easily accessible and is on a very popular street in high brow Victoria Island in Lagos.,50,February 2019,4.0
332temitopea,Visit,"Went with a friend for lunch, nice music, beautiful sea foods. Ambience was okay. Had a nice time, enjoyed the scenery.",40,July 2018,4.0
Liglossmaffia,Best Seafood In Lagos,"Ocean Basket is one of my favourite restaurant in Lagos. Asides, value for money, the beer is always cold.",40,April 2019,4.0
BOSSLADY205,Good food,Good fish. Clean environment. Friendly staff. Great lunch spot. Price was pretty good and plenty of FOOD.,40,April 2019,4.0
Purrples,Seafood is a delightful experience at Ocean Basket,"Every time I visit Ocean Basket, I leave satisfied. Though prices are kinda steep, the food excites my palate. I even made my now husband take me there for our first date! I like!",40,November 2018,4.0
SamAnis2002,Over Expensive,"Nothing special , does not deserve this prices,the food were very normal , one of the hall was equipped for a party or church program and the noise was terrible.",40,March 2019,4.0
1girl_1passport,Seafood delight,"I have been here a few times now since moving to Lagos and I really enjoy it.

The menu has a lot to offer and the garlic sauce is so good. The food is pretty consistent on most of my visits. Only this last time...More",40,September 2018,4.0
ladek56,Great experience,"I was to take my fiance on a dinner and do a surprise proposal until she suggested Ocean Basket. I Google and found their address and off we go. We arrived to a pleasant welcome by the guards and oh when we walked in,great ambiance....More",50,March 2019,4.0
varaidz0d,Not Great,"Went through to get some take away dinner, I ordered the prawn special, the prawns were not too good, I suspect they may have been a bit old was also surprised I was charged for the take away containers for both my main meal and...More",50,March 2019,4.0
gatiri4life,Dinner.,"They have sea food and have been consistent over years of being in existence. Their garlic sauce is delicious, their food is tasty and delicious. Love ocean basket.",40,March 2019,4.0
Y6571FYandyc,Does What It Says 'On The Tin'!!,"I like Ocean Basket because of all the things that it isn't!! 

It's not pretentious, it's not overpriced, it's not an unpleasant setting, it's not uncomfortable and it's not difficult to get parked.

The menu is entirely fish (with some Sushi) so no surprise there....More",30,March 2019,4.0
JulesLove,Absolutely delicious seafood!,"I love seafood which made this restaurant a must to visit! We were not let down by our high expectations and had such a lovely dinner experience out on the terrace! There was a wide selection on the menu and something to suit everyone's taste,...More",40,January 2019,4.0
Jazzkuffy,Oceans Delicacies,It was a family dinner and decided for a change to explore the oceans bed delicacies. Quite impressive. If you are a seafood lover this is the place for you. The service was world class. There was something different for everybody. Nice place for family...More,50,September 2018,4.0
Yasser_A_A_A,Delecious Seafood,"It wasnt my first time to eat in this chain, but it was my first time to try it in Nigeria
The place is clean and cozy, the staff are friendly, the service was really fast
the varieties of seafood options are really great 
the...More",30,January 2019,4.0
G5961YWdavida,Family Dinner worth every bit,Took my family out for a dinner at Ocean Basket and we were not disappointed. It was a very wonderful time with the superb view at the terrace. Waiters were very respectful and very helpful. Will always visit again when chanced.,50,January 2019,4.0
omohunola,Seafood haven,"Went with a group of friends and ordered a full deck platter! Not so much of a seafood lover but I really enjoyed the prawns and grilled fish. The price was fair (17,850NGN) for the platter. I had the Ocean basket special which tasted lovely....More",40,January 2019,4.0
Onyinye C,Nice seafood,"My children love it and that's saying something because they are rather picky. If sushi is your thing, don't bother because their sushi bar is defunct.

Nice servers, food comes quickly and there is quite a wide array to chose from. 

Inside seating is fine...More",40,September 2018,4.0
Nathaniel A,Yummy seasfood options.,One of the best seafood restaurant in VI. The ambiance is great. There isn't a lift of wheelchair access to the sitting/balcony upstairs.,40,December 2018,4.0
