author_name,review_title,review_text,author_rating,visit_date,overall_rating
liverpool1023,Well worth a visit,"This is a good option on VI. This is a largish, newish restaurant set on two floors with a terrace. The seafood menu is extensive with plenty of platters for sharing. I went with the linefish and chips which was okay, my colleague was very...More",40,December 2018,4.0
Francis N,Just a cozy environment,The place is a cost place. Stayed outside at the balcony on the first floor with the family and ordered baskets of mixed sea food. The service was lovely and the food quite tasteful. Highly recommended under the moonlight and good weather.,40,January 2018,4.0
eng_moh_mansour,Great seafood meal at Lagos,"I was looking for seafood meal at Logos as it is located at coast of ocean and fish should be amazing
It was advised by one friend who tries it one day before so we decided to go and it was most special meal in...More",40,September 2018,4.0
_abisheart,really fresh and tasty seafood,"shared a seafood platter with fish, shrimps, mussels and calamari with chips.  was delicious and fresh . They were absolutely covered in butter sauce so probably would advise for sauce to be separate if you are watching calories.... great garlic, chili and mayo side sauces...More",40,November 2018,4.0
KarinJesuis,I am in heaven,"A visit to Lagos always open the opportunity to find luxury and pampering. I found Ocean Basket this time.

Being from Cape Town the bar was set high 😎

I am please to report, Lagos is on par🌟

I had my favorites: calamari, fish and...More",50,October 2018,4.0
dewittb2017,"Clean, fresh food and good service","Pleasantly surprised to find this ( South ) African gem in VI. Service was fantastic, meals perfectly prepared and made for a succesful business meeting. Well done on your consistency Ocean Basket, and to the Nigerian Management and Staff. May you grow even further",40,October 2018,4.0
gaziedecker,Always 5/5 for me,"Great food, excellent customer service... always!!! I have visited both Ikeja and Victoria Island branches and they are both 5 out of 5.",50,October 2018,4.0
johne999a,Pretty consistent with other countries,"Not bad, service was good, attention and friendly, food quality pretty good, value OK and overall a good experience.",40,August 2018,4.0
Todd J,Awesome customer service and food.,"Romantic setting on the top level sitting outside.  Great customer service and food.  I had sole, which was very delicious.  We had appetizers which were also quite good.",40,July 2018,4.0
vokolo,Hoped for better,Good location both the earlier and the new. No improvement in food quality. Excessively oily. The same errors in delivery. Fried instead of grilled,50,April 2018,4.0
Folarin B,Fantastic Seafood place,"Great place, airy and uncluttered deco. Food quite good. Seafood is seafood here. A bit pricey, but you get to pay for what is good.",40,March 2018,4.0
TimmoW16,Fish fish fish,Why else go to an Ocean Basket. The food is pretty much consistent. The first time I have eaten at the new location in VI as was pleasantly surprised with my meal previously. A better location for visibility and the food was good. I hope...More,50,July 2018,4.0
Elina S,Better than expected!,"Having visited so many Ocean Baskets in South Africa (it is a South African) franchise, I must say that I was positively surprised about this one! Food was good, we had a shared plate of grilled seafood and I must say that it was good!...More",40,July 2018,4.0
IstanbulDutchie,Hot spot for fish 🎣,"Ocean Basket, 

On Victoria Island there is this restaurant with the name Ocean Basket.  The most friendly service i had experienced in many weeks. The meals are presented in a card with photos just to keep it simple. The food served come close to the...More",40,July 2018,4.0
Adaiah S,Excellent place for seafood,"I thoroughly enjoy seafood here.Food is good, service is excellent. The people make you feel special. Reminds me of Portugal",40,May 2018,4.0
MarcusW6,Long live the sea,"Nice place, good seafood, friendly manager and the price is ok.
We ordered the ‘feesh & chips’. Friendly service. What more do you want?",40,July 2018,4.0
serenaa,Good food and ambience,"Visited for dinner on the night Nigeria was playing Croatia in the 2018 World Cup. The restaurant was not busy. Our server was Kola. He made helpful suggestions . We had the family platter and I think the deluxe platter. There were 6 of us,...More",40,June 2018,4.0
Rii H,Always a good choice,Ocean Basket never lets you down. Prawns and Calamari are my favourites and by choosing combo platters you will get everything!,40,June 2018,4.0
frankdS1287UC,Disappointed about food quality,"We went to test the Ocean Basket.
Best thing experienced was the location on the Terrasse.

Food was maximum average, if not below.
Fries not crusty, hardly salted and some not fried properly.

My Salmon , served with stir-fried veggies, was ordered „medium“ and came...More",50,June 2018,4.0
TukeMorgan,Affordable Seafood Restaurant in Lagos,"It is a bit of a shame that we don't have many Seafood restaurants in Lagos as it is a coastal city. There was coral reef before but it has packed up, I'm glad Ocean basket has lasted in Lagos for a number of years,...More",50,June 2017,4.0
ejio4c,Bellow Expectation,"Alright I went to the website and saw mouth watering looking meals. And I decided I was gonna go same day.  Let me make this review short. Getting there, the food was not nice we ordered  a platter  so we got almost everything on the...More",50,December 2017,4.0
ceotiffygroup,Top Restaurant For Sea Food,"Sea food served at Ocean Basket is top-notched.
There are varieties to chose from.
It’s one of the best restaurant I hang out with my family.",40,November 2017,4.0
CSRam,Luncheon at New Location Ocean Basket,"We were three people , the new location is good . lot of fishes were not available, so we ended up taking Fish and Chips and Spicy Chicken with garlic bread. The sauces they provide is good, Service is ok. I think earlier their portions...More",40,March 2018,4.0
solas471,"Fresh sea food, nice ambiance","This was a pleasant eating experience. The staff were friendly and attentive. The place seemed clean (restroom included). The seafood was quite fresh and fairly reasonably priced and came in large portions. And there was adequate space for parking. Upstairs, one could get a view...More",20,February 2018,4.0
473maryamj,Fish-tastic experience,Oceans basket is definately the best seafood restaurant in Lagos. The seafood is sooo fresh like it just came out of the sea. Everything i had was cooked to perfection. The staff are extremely nice and professional. The ambience is great.. they have both indoor...More,40,April 2018,4.0
Olumide K,Nice seafood restaurant,Ocean basket is a great restaurant if you are a seafood lover. Great Restaurant and great staffs. Highly recommended.,30,July 2017,4.0
Chris H,Uninspiring,A quick lunch for 3. the staff were friendly and attentive but they had several dishes unavailable. Service was slow and the food was meh. we sat upstairs and the bench seats were broken,50,February 2018,4.0
Freja A,Give it a try,"The place looks like a fast food place, not where you would go for a couple dinner, but for friends who like sea food it’s very nice. We shared one of the platters  and were very happy. The food is well worth the price tag.",40,October 2017,4.0
James E,What a great time and great food,"My wife and I took our son to the restaurant for a Saturday night dinner.  The service was absolutely wonderful. Our entire wait staff was attentive and knowledgable about every item on the menu.  In fact, the manager came to the table to make sure...More",40,February 2018,4.0
Onome O,Great Seafood in Lagos,"Ocean Basket has great seafood variety and really friendly staff.
On my very first visit, I particularly enjoyed the Salmon with a stir-fry. The service was prompt I think I got great value for money as well. 
My friends ordered went with other options, and...More",40,February 2018,4.0
Bem-Lagos,6th Feb 2018- Good Food,"We had some very good salmon at Ocean Basket. This was the best and the waiter ""Jonathan"" had a very good idea about the menu. His service was fantastic.",40,February 2018,4.0
Ada-Bih I,Amazing Service & Food,"As we sat, we were attended to quickly. Our waiter, Jonathan had a warm smile and was nothing less but a courteous host. He was quick to explain the menu and the day's specials. The food was delicious, I haven't had such a good meal...More",40,January 2018,4.0
Moneyshot23,Great Atmosphere & Quality Food,"I was at Ocean basket a few days back and I hand a very pleasant experience. The staff were well dressed, polite and knowledgeable. The waiter's recommendations were spot on and my wife and I both enjoyed it. We both agreed our next date night...More",40,December 2017,4.0
Samuel B,Great Food. Great Service!,"Ocean basket is one of the best seafood restaurants in this part of the world.
Great Food. Great Service. World class ambiance and atmosphere!",50,November 2017,4.0
Apapadim,Food and people,I have visited the restaurant a few times in the past and my impressions were moderate so I did not go back for a long time. Recently it changed location and today we decided with two friends to try again. The new location is very...More,40,December 2017,4.0
Mafolayomi,Dinner Take Away,"Bought a platter for 2 from the restaurant. Food was nice but very pricey for what you get. Recommended if you are not price sensitive. 
The service was good, the staff were polite and warm.",40,November 2017,4.0
Leo B,The one to miss,I known ocean basket for a couple of years from south africa and been to some in Europe. Concept all the same its an fast food fish restaurant which normaly should have the same standarts where ever you go. However this one should change their...More,50,August 2017,4.0
Manzanilla85,Great seafood in a lovely place,"This was my second visit to OB and again - the restaurant did not disappoint! The food was fresh, nicely served and arrived fast! My friend and I had a seafood platter for 2 with a small village salad. What I like most about the...More",50,November 2017,4.0
tbs4real,Very average in service,"At Ocean basket, every free accompanying item is rationed. Bread, paper napkins, servers, even cutleries.
Pls i think i got the idea of a fish basket more than ocean.",50,July 2017,4.0
seunidowu,The Calamari,I had their Calamari and I absolutely loved it! Their platters are awesome and their meals are affordable.,20,December 2016,4.0
tarakiga,Great service and fantastic staff,An interesting experience as it was recommended by a friend and I wasn't disappointed. The kingklip fillet was awesome.,40,October 2017,4.0
Keishey00,Great for seafood lovers,"So I really liked it here and have given it a 5 star! I thought the service was warm, friendly
And they made recommendations when
I asked. I thought the Taste was great and the portions plentiful. Ithe prices were reasonable (but I
Live in...More",20,October 2017,4.0
Abipharm,As good as it is in South Africa 👍🏼,"Ocean basket quality as I have known it in SA was well replicated in Victoria Island, Lagos. The Platter for 1 is as good as it gets. They have changed location though to Akin Adesola.",50,October 2017,4.0
Valdis A,Ocean Basket as it is,"Nice resto but location is the subject to spend some time to find it.
Portions, table serving and quality of the foods are good. 
Tablecloth made special to be interesting while waiting for your order.
Price is also OK
Service is not fast, but friendly....More",40,July 2017,4.0
damola a,"Fresh, tasty and inexpensive","This is about a good a value as you can get for the seafood component.  Fresh, inexpensive, great portions and quite tasty.  I had the grilled seafood platter and the variety and quality was above expectation.  The service is okay but the location and the...More",40,April 2017,4.0
Kevin S,lagos,"sometimes portions are to small especially the mussels, apart from that its very good and I visited several times",40,March 2017,4.0
683hammadb,Good but Expensive,"Food was good but prices are steep.
Recommend if you are a sea food enthusiast.
Staff is courteous.
Enjoyed terrace.",40,July 2017,4.0
876steve2016,Enjoyed the platter,Enjoyed the platter. All freshly prepared and cooked and served with a smile. Outside has nice ambience when the weather is fine,40,June 2017,4.0
Geraldattila,Good seafood,Food is tasty. Think should offer more variety for seafood category..Currently limited. Food is pricey too. Service is desperate...not cool. All in all a great place for lunch or dinner.,40,April 2017,4.0
Bosslady6,Staff seem to size up customers before attending to them,Maybe it's me but it always seemed to me that the staff were never very eager to attend to customers...unless they were light-skinned. Food was good. I've stopped going there though. There are a million other places in Lagos to have a good meal.,40,June 2016,4.0
Oge O,Ocean Basket,"Great meal! Hot and freshly prepared. Courteous and friendly staff. I love the settings. For great and tasty sea foods, visit Ocean basket!",40,April 2017,4.0
bhumie,Seafood,"For seafood lovers, I would recommend Ocean Basket. For a group dining, It's more economical to order as a group. The sea food could either be fried or grilled.
Very help staff. We had my Mum's birthday lunch there and the staff all sing for...More",40,June 2016,4.0
ositao2016,Sea food and good wine,"I frequent Ocean Basket anytime am in Lagos VI, and usual after church late afternoon lunch or early diner is the family delight and occasional meetings. In Lagos there is not a better choice for pure sea food place - it's a family delight",40,March 2017,4.0
KingOpe,Made my day,Wonderful experience from the food to the staff to the environment... Overall superb experience. It was my birthday and I was surprised by members of staff... Everyone is hands oi deck even at busy hours,30,April 2017,4.0
funlove,Seafood paradise!,"We had lunch here and it was an unforgettable experience.
Our seafood platter consisted of prawns, calamari, grilled fish (surprisingly tasty, well seasoned and not boring), chips and fried rice.

The service was unparalleled, our waiter couldn't do enough for us and very kindly packed...More",30,April 2017,4.0
Rumbi304026,Tasty Food,Good attention to detail.  The only downside for me was the bathrooms are downstairs.  For me less drinks because upstairs has the best views,50,January 2017,4.0
137erica,Seafood Restaurant,"Nice quiet restaurant also very appropriate for business meetings. Wide array of grilled and panfried fish, prawns and calamari. I just love how they serve the meal, which comes in cooking pans!
Staff is just great.
They also serve excellent coffee.",50,March 2017,4.0
Kryssie10,AWFUL Customer Service.,"I've given Ocean Basket 1 star because the food isn't bad, it's pretty tasty. HOWEVER, the abysmal customer service makes the food entirely forgettable.

I visited this particular location and was surprised to see how friendly the staff all seemed. The manager especially has a...More",50,March 2017,4.0
SiberianSB,Really good staff,"No idea how they do it. For a three years since we coming there, restaurant has the friendliest and most helpful staff in Lagos. Good food with a very good prices too!",40,March 2017,4.0
godsonu,Nice food...pricy,"The idea of this place is great. The food options are rich, varied and interesting in combinations. 

The food is good. 

The ambience is not necessarily so great, but, hey, this is Lagos, right?

The price? Always burns a hole in your pocket...and you'll feel...More",40,February 2017,4.0
Kingsley Ugo. M,Best for Seafood in Lagos...,"Very lovely place & one to visit if you are a seafood lover.. They have everything you want, Lovely atmosphere, every one smiling and the welcome is second to none.. Very lovely place to relax with family..",40,December 2016,4.0
leomuller237,Not worthwhile,I know ocean baskets from my stay in South Africa and had good memories about it. Well the one in Lagos lost. The music was so laud I thought I'm in a club. The portion much smaller compair to a normal OC and the service...More,40,February 2017,4.0
cedarme,"Good food, great service","Even before our order was taken, I was struck by the very warm welcome we received as soon as we stepped in. We were quickly ushered to our seats and, with an engaging smile, Blessing informed us that she would be taking care of us....More",40,February 2017,4.0
Tia011,Good with potential,This is a very refreshing place to eat when you want a break from local cuisine. It is not a proper sea food restaurant in that I'm not convinced the fish is not frozen. The first time we visited the ikeja branch the food was...More,40,February 2017,4.0
Dizzle28,A good spot for unlimited seafood choices,"Years ago (2013,) I went to an Ocean Basket in Johannesburg and didn't quite enjoy it. So I was somewhat skeptical about eating at this spot when I met with some friends for dinner. My doubts were immediately erased once I got my platter for...More",40,December 2016,4.0
AndrewAONG,"Great Food, Great Service and Ambience",This is the best seafood place I have seen in Lagos. Tucked inside the Ikeja mall. The environment is appropriate for a business meet. Lot of food choices. Will definitely visit again,50,January 2017,4.0
tomio2016,"Good food, Great drins, Wonderful atmosphere","My partner and i tend to Restaurant hop a lot, so this was one of our ""hopping"" spots. 
We had passed it by a lot of times but decided to give it a shot and we didn't regret it. 
It was very nice, lovely ambience,...More",10,November 2016,4.0
outdoorCocoon,"Great drinks, wonderful staff.","Unfortunately, tI me, the best thing about ocean basket are the staff. Super enthusiastic and quite well trained.

The drinks are fab but to me (and I think it's just me), the food is average. If I wanted to eat out, Ocean basket wouldn't be...More",40,December 2016,4.0
Pierreech,Fair Restaurant,Visited Ocean Baskets location at Ikeja mall for a date with my spouse. The outlets ambience was amazing with a bit of music. Staff were pleasant though not too coordinated. Ordered two shakes in between my meal but and the second one came in a...More,40,December 2016,4.0
Uzo U,One of the best restaurant I have ever enjoyed,excellent and tasty sea food for a very reasonable price. I was truly so satisfied from what I ate that I could not believe it. I came here on the night of my birthday with my Fiancé and my cousin and we ordered about three...More,50,November 2016,4.0
Tayo A,Heaven,The Sauce and the fish is a dream wedding in my mouth. great ambience perfect food and good budget am glad they are i n lagos used to look forward to it in Dubai,50,November 2016,4.0
Lez M,Quality was a let down,"We had the Platter for two.  We don't eat Mussels so ask for a substitute, but not sure what was given if anything.  The fish was great and the shrimp were good.  The calamari was just going over the the rubbery side.  The Calamari heads...More",40,November 2016,4.0
obayeni,Dinner,Watching your diet or want to eat healthy go to ocean basket.Price is reasonable and environment particularly outside upstairs is very good.,30,October 2016,4.0
Zariyah M,Best food ever,"We had good service, huge amounts of food, and not too pricy.  I'm not much of a seafood person, but I could eat here very often!",40,February 2016,4.0
Intrepidtravellers_8,Outstanding seafood platter and great service,"I absolutely loved Ocean Basket. We were greeted warmly by everybody and people were so helpful with seating us and our baby. 
My absolute favourite was the fish on our seafood platter - and the sauce was delicious. Our sardines were also very good. Everything...More",40,November 2016,4.0
Leosquests,"Lovely ambience, good service, great food.","I got hosted to a friend's birthday brunch and the look of the restaurant was really nice andabit upscale.
It looked clean and I looked forward to a lovely meal and a really nice time with my friends,and they totally delivered.
They were very generous...More",40,October 2016,4.0
mjacob007,Not the ocean basket standards one would expect,"Identical menu to what one would find in south african outlets, however food is nowhere  near what one would expect. Lack of fresh fish may also be a contributory fact. platters came with sole fish and we wanted a swap, but was told no. Waitress...More",40,November 2016,4.0
Abimbola A,Lunch,"Seafood restaurant with peculiar style of presentation and services as ocean basket at the Dubai airport.

Good for children , informal dining style and environment.

Not a bad choice at all.",40,October 2016,4.0
ian a,superb seafood restaurant worth a visit.,"nice surroundings, great food and attentive staff, this was a pleasant experience and lived up to the previous reviews.",50,October 2016,4.0
KenCooper1953,Great seafood,"Great seafood menu
Combo deals
Fresh 
Friendly efficient staff
Relaxed casual dining
Safe parking
Convenient location",40,June 2016,4.0
BRU_traveller83,Pay cash,"First off, the food is goof but the service isn't. They try to upsell your order. The starter was cold, the main course fish was OK but not more.
Upon entering I asked if thr credit card machine was working, because I didn't have enough...More",40,October 2016,4.0
Dave G,Good seafood in Lagos,"I visited this restaurant with friends recently on a Friday evening. The place is well laid out with a nice outside area where we sat until it started to rain. The food was very good, particularly the prawns. Not too expensive and the staff were...More",30,September 2016,4.0
Michael E,Average seafood,I wish I could say more than just that I love the ambiance and the surrounding. Not the place to go if you are starving...The food takes forever to arrive. But the turnoff is the underlying extra service charges that racks ups the bill to...More,30,September 2016,4.0
Jerry277,Adventure random night,So we set out with no plan for the evening looking for food. We dashed in here and we were not disappointed. It tasted like foodgasm in the mouth😜🤘🏾,50,September 2016,4.0
cmunos,Solid seafood option,I always try to stop by here when in Lagos. Solid and decently priced seafood options in VI. Most places in VI are ridculoulsy priced but this place is competitive. If you are going in a group of more than 2 you should try the...More,40,March 2016,4.0
AnnieLagos,Good restaurant with great attitude,Ocean Basket was a good experience for our party of three. The response time was quick and efficient. The quality of food was also good.,20,August 2016,4.0
Wuraola O,Good for sea food,This is one of the good restaurants for sea food. Nice ambience as well and accessible. Drinks were cold for all the times i have been there.,50,April 2016,4.0
V1723CWpeterh,Worth The Visit,"I mentioned to my colleagues that I had yearning for good old British fish and chips so they said they had a cure for that and took me to Oceans Basket.

I was not disappointed. I had the basic fish and chips and it was...More",30,July 2016,4.0
adey_naija,Great Food,"If you want to eat very well made fresh seafood then i will recommend Ocean basket in Victoria Island. The one in Ikeja is nice but usually too full.

It is an excellent family hang out location and the service is very welcoming and accomodating....More",40,February 2016,4.0
AntWaller,"Good food, great value","Went with work colleagues in the evening. Nice quality food and very good prices, especially by Lagos standards. The service was good too. Would definitely go again.",40,August 2016,4.0
Hardegun,Wunderbares Essen,Seafood at its best..I have visited this restaurant  severally with friends and I enjoyed every single time.,40,October 2015,4.0
emadedor,Seafood at its best,"Great value for money especially when you order a family package. Food taste good. Great ambience. Not very kids friendly as there is no play area. There is a restaurant on the Island and one on the mainland. My opinion, visit the one on the...More",40,July 2016,4.0
Triple-CMilo,Awesome Family Lunch,"My family decided to have lunch out, so our party of four including an infant decided Ocean Basket was the place.

Parking: Parking is free, but the space within the premises is limited. I don't know how that would play out during peak time.

There...More",40,August 2016,4.0
LiciaMerry,Nice place,"The food is good, the portions are a bit small for the prices charged.
Service is also good.
Will visit again.",40,July 2016,4.0
Onlyoneodini,Good seafood,it is always a nice experience at ocean basket. The food is well done and tasty. A nice place for outings too cos the ambience is good.,40,October 2015,4.0
Piedrarip,"Fresh seafood, attentive service and overpriced food","Since we entered the restaurant one thing was clear. Waitress are well trained, always smiling and attentive, unlike many other restaurants in Nigeria. Ocean basket is a concept which work as a franchise.

We ordered one of their platters recommended by staff. It came with...More",50,July 2016,4.0
MissyeWorldwide,Always  amazing ......,"I was introduced to this awesome place a few years ago. 

Everytime I visit  I make it an effort to pop in.

If you are a sea food lover, this is your joint. 

Food is plentiful and fresh...

The service is good  my server today...More",50,July 2016,4.0
Bart_Boy_ID,Great seafood resto,"The food is great.. You can found seafood in good menu here.. We can share the menu together. 
Prawn is the best! You should try it soon..",50,July 2016,4.0
Carolineogba,My  friend and I,I enjoy my self at ocean basket is the best restaurant in the world is a  place where you can go and enjoy your day friendly staff good service,30,July 2016,4.0
