author_name,review_title,review_text,author_rating,visit_date,overall_rating
NaijaBabe2016,An Okay Experience.,"Sherlaton Restaurant is a place I've known about for many years, so you could say 'it's reputation precedes it'!😆 I first heard about Sherlaton when I used to visit Lagos as a young lady in the early and mid 90s. I've never had the pleasure...of dining here. 4 out of my 4 daughters adore Indian Food, and I was with 2 of them on this visit to Lagos, so it was the perfect opportunity for my maiden visit to Sherlaton Finest Indian Cuisine. It's located in the Cumberland Luxury Hotel, inside a part called Nirvana Lotus Hall. Access to the restaurant is via a short stairway, onto a first floor. The location is a good one- on Adeola Odeku Street/Ahmadu Bello Way- a very central area of Victoria Island. 

The restaurant is expansive, with vibrant Indian accents and decorative artifacts. The decor/furniture looked a bit outdated and old-fashioned, yet orderly and well maintained. Toilets were squeaky clean. I know Sherlaton has been open for a very long time, but I had no idea that they've been operational since 1976! 😲 How remarkable! Our waiter, (didn't catch his name), brought us their first ever menu in a picture frame. Please refer to the posted photo of it. How cool is that!?!? 😎 What an awesome memento/piece of history/snapshot in time. The menu back then was a lot more modest. 😄 Meanwhile, on Sherlaton's current menu, Monday is Dosa Day, but Indian, Nigerian and Continental Chinese Dishes are still served on this day. They also serve Breakfast- (from 6:30 a.m to 10:30 a.m) daily. Service was impressive. Didn't find any fault as far as any of the staff was concerned. Food came out in a short amount of time.

Sherlaton Restaurant has an extensive menu that includes SOUPS, NIGERIAN CUISINE, INDIAN VEGETARIAN STARTERS, INDIAN NON-VEGETARIAN STARTERS, VEGETARIAN MAIN COURSE, CHEF'S SPECIAL INDIAN THALI (Vegetarian & Non-Vegetarian), RICE, INDIAN BREADS, CONTINENTAL VEGETARIAN STARTERS, NON-VEGETARIAN MAIN COURSE, CHINESE VEGETARIAN, CHINESE NON-VEGETARIAN, RICE & NOODLES, SANDWICHES (Plain/Grilled), ACCOMPANIMENTS, DRINKS, DESSERTS, COCKTAILS, SHOTS, MOCKTAILS, SOFT DRINKS, JUICES and plenty of ALCOHOLIC BEVERAGES. 

We were not very hungry, having had a rich buffet breakfast at a hotel not too long ago, so we ordered MUTTON SAMOSA, CHICKEN TIKKA ROLLS, CHICKEN SPRING ROLLS as our Starters, and CHICKEN TIKKA MASALA for our Main Course, then a BUTTER NAAN and CHEESE NAAN for our Bread(s). We got the VIRGIN MOJITO for our Drinks. Everything was delicious and tasted very authentic. The pastry for the Mutton Samosas was too dry and a bit on the hard side, but the filling was rich and packed with meaty goodness. 

The Chicken Spring Rolls were yummy, but I thought the pastry would be like the regular thin spring roll pastry, not the oily pakora kind. It tasted like deep fried pancakes. The Cheese Naan wasn't nice because it was too oily. That grease overwhelmed the bread and gave the cheese a weird, plasticky consistency. The Butter Naan on the other hand was soft, buttery and flaky, but in all honesty- I've had better. The Virgin Mojito Mocktail was just okay, slightly overpowered by the plentiful mint in it. Our favourite dish was the Chicken Tikka Rolls! They were juicy, spicy, well seasoned and packed with tons of flavour. 

We enjoyed the food at Sherlaton Restaurant, and I can definitely see myself coming back here to sample many more items from their copious menu. Prices were very reasonable- especially for a city as expensive as Lagos, so kudos to Sherlaton Restaurant for keeping it 'economical'.👍🏽The food is very decent, even though I must say that I expected a little more from an eatery that's been in business for over 47 years. It was disappointing that they screwed up Naan Bread, which for an Indian Restaurant is not acceptable as far as I'm concerned. This is single-handedly the reason why I couldn't give them a 'very good' rating. Had there been a 'good' rating on TripAdvisor, I'd have gone for that, so it's gonna have to be an average from me for Sherlaton Finest Indian Cuisine. However, I must say that given the fact that they've been open for such a long time, they have to be doing something right, so who the hell cares about what little ol' me has to say about them!!! 😂 Therefore, CONGRATULATIONS to Sherlaton Restaurant for this amazing accomplishment! 👏🏼 🥳 An overall decent experience for us, so I'd go ahead and recommend them, albeit- not 'highly'.More",40,August 2023,4.0
ooobabatunde,Still a hidden gem,This has now become our regular go to restaurant.  I think it's because they have been doing this for so long in Nigeria they make it look easy...the owner is always on hand to walk round the restaurant and greet guests. Food and drink quality...remains very good.More,45,July 2023,4.0
Tourist50769374673,Dinner,"Amazing Indian food, lots of variety in food, bar available, buffet breakfast in Morning, they don’t accept international credit & debit cards this is a disappointment.",35,June 2023,4.0
GuyoftheGlobe,A hidden gem,"I located this Victoria Island restaurant behind a grocery store and it was truly a hidden gem. Know for its Indian food (as good as anywhere in the world) as well as Chinese, Nigerian and continental cuisine. Clean and well staffed, you won’t be disappointed.",40,November 2022,4.0
K4885FZjanap,Good value,"Food was good value,extremeley big portions,but mediocre in taste.
Table cloths stained,tables was dirty",30,July 2022,4.0
Chipungu,Lack of Spice,The place is clean and the staff are friendly. The food is not spicy like in a typical Indian restaurant. I complained about it and they took my food and made it hot by using a microwave when my complaint was that the food wasn't...as spicy. The staff are relaxed about covid protocols and don't wear masks.More,30,February 2022,4.0
KFL911,Fantastic Indian !,"Fantastic Indian.  One of the best I’ve visited, that being worldwide.  Their food is very authentic, excellent variety of choices.",40,April 2021,4.0
joerge234,One of my favorite Indian,"One of my favorite Indian  restaurants in VI. Very fair prices. Good, thoughtful and friendly service. Food is delicious. A little bit hidden behind the hotel & supermarket.",50,April 2021,4.0
eCeasar,Tasty Indian menu with nice staffs,"Being in doubt over how i can get tasty Indian meals, not until I came across this amazing restaurant",40,September 2020,4.0
Motecz,Family dinner,"In doubt over getting an Indian meal over here, common here is a place you need to be, you know what come and fell the beauty",30,May 2020,4.0
Iota-E-S,"Authentic, tasty  and extensive Indian menu  at an affordable rate.","The food is tasty  and extensive Indian menu  at an affordable rate.

I daresay their Naan is one of the best available.

A 3 course is circa 20  USD, 

Restaurant is quite large and can seat close to 50- 70 guests

Staff very polite, and...my greatest concern is that the decor/furniture, table cloth is seemingly dated ,More",30,November 2019,4.0
BLFoodiez,Worst service with horrible attitude,"Avoid at all costs, never encountered such horrible attitude. Ordered online requesting confirmation of order, but hang up phone call without a single effort of trying!!!! One can only imagine how much they put on the food.",50,February 2020,4.0
vinayb,Avoid,"Got an upset tummy after my very first meal here. Need I say more.
Indian expats seem to prefer it for homely food. Don't know why?",40,November 2019,4.0
Hookedongoodness,Best Indian food in Lagos,"Oh how happy we were to find this little hidden away gem of a place, they are currently building new premises above the old restaurant but boy the food was outstanding, Best Butter Chicken ever, we went 4 times in the period of our stay...and everytime the food was spot on, and if you have ever been to Lagos you would know that that is an achievement on its own. I 100% recommended that you must go have a meal there, it's looks a bit chaotic outside due to the upgrade but wow, Tikka chicken rolls, steamed rice, chicken kebabs, nan breads, Korma chicken, authentic chicken curry. Each dish divine
Fantastic staff 
If you in Lagos try find this place it is worth the visitMore",40,October 2019,4.0
JPVirdi,Good Food - Not So Good Ambience,"Food tastes good, but don't like the ambience at all.   ...feel like a rundown place. A wide variety of Indian dishes on the menu.",30,August 2019,4.0
RajeshPillai20,Tasty Food in Town,Excellent Tasty Indian Food in Victoria Island. Variety of food is great. 24hrs and ample parking place. Platters are great and Kulfis... Been to this restaurant literally twice a week with small and big group (Friends) and not been disappointed with the services. Staffs attitude...More,40,June 2019,4.0
Sreeresh P,A popular Indian restaurant in Lagos,This one of the most popular Indian restaurants in Lagos. The food is of good quality and price is reasonable. Choose this place for its food not for the ambience.,45,March 2019,4.0
apvakta,Good food,"Good food, lots of options, great portions and decent prices. However the ambiance and decor is very business like. Service is average.",35,May 2019,4.0
tamsinf2015,Really good meal,"The restaurant looks unpreposessing but the service was really good, and so was the meal! Well worth a visit.",40,March 2019,4.0
gcxotf,Food10-Ambience0,"Had dinner with few friends. This place is one of my favorite restaurant in Lagos. 
Food quality good,  price reasonable,  service so so,  ambience poor. 
But will definitely repeat",30,February 2019,4.0
ooobabatunde,Again and Again,"Yes so another review. They get the food right all the time, the owner that sweet gentle old man is always there to check and he still manages to ask you if everything is alright! 

Granted the ambience isn't much but you know what I...More",50,November 2018,4.0
244rameshd,Great Indian food,One of the best Indian restaurant in Lagos. Great Indian food and friendly management. Service could have been a bit quicker and more efficient though. Don't miss the varieties of  Dosa every Monday !!!,40,October 2018,4.0
chandr_b2017,Excellent food on Victoria Island. Had our whole crew coming back for more,"We were a large group in Lagos for business. Sherlaton had members of our group returning night after night for their amazing food. They are reasonably priced with a large variety of food. 
Even the vegan members of our group were able to eat great...More",40,September 2018,4.0
sunilm375,Weekly visits,"Best place home away home food in different country here. Same taste as like in India. Great staff, Chefs n management. If you are looking for best Indian food in lagos this is the one.",40,July 2018,4.0
makheejagaurav,Decent Indian Restaurent,"The interior is not wow but they serve a good food. Prices are also less as compare to other Indian restaurents in VI.
Staff is very caring and helping. I usually go to this hotel with my friends and clients.",40,August 2018,4.0
ooobabatunde,Still the best,"Sherlaton continues to impress. Fantastic Indian food and warm family setting. The owner is always on hand to greet you. On this visit we had complimentary ice cream at the end of our meal. Kids were so full we had to take food home.

If...More",40,August 2018,4.0
KabirT19,"Wow Indian sizzlers,,,","This place is good , that I’ve been three times under one month , each time we go we order different starter it’s comes In a sizzler . Eat dish is seasoned with its own Indian spices and herbs which come out smelling savory and...More",40,July 2018,4.0
contactcjb,This is the main 'go to' Indian restaurant in Lagos.,"The format is no frills, great food - lots of it - and good service.  Big screen TV is you must ! Waiters and all staff are genuinely pleasant and attentive.  Prices are well within any ones budget and extensive menu for the most discerning...More",50,July 2018,4.0
gcxotf,Monday's dosa,Went with a group of friends for sodas. Pretty decent quality different fillings something different to the normal Indian menu. Again atmosphere not the best but quality and price does compensate. Worth a try.,40,June 2018,4.0
Todd J,Outstanding Indian food!,"Some of the best Indian food we've ever had, and we've traveled to India and lived in Nepal!   We either eat in or have it delivered to our house.  The food is spicey and always delicious!",40,December 2017,4.0
vskhyderabad,dinner,"consistent quality food every time one visits. 
managers give good attention and suggestions for individual palates.",40,March 2018,4.0
Valdis A,Check your bills!,"Small, crowded and noisy place but with good most authentic Indian food in the city.
And same problem all the time - check your bills. First of all the price in the menu not include 20% of TAXes, and after all the bills written by...More",45,March 2018,4.0
LagosKathy,Great food.,"A really good menu, that includes continental, Chinese, and of course, Indian food.
Really reasonable prices, which makes it more attractive. Decor isn't the best, but we were there for a business lunch, and we were all very satisfied.",35,March 2018,4.0
Dazzagordi,It's not the most attractive resteraunt but the food & prices are superb,"Seeing that we were in Lagos for 9 nights, we decided to eat here twice. The food is superb! Everyone loved their meals. I had the lamb samosas, the broccoli and cheese samoosas, the chicken korma and the prawn masala. All were fantastic!",40,January 2018,4.0
Sumitngp278,Average place average food,"I was expecting better. Don’t care about the old rustic decor bcos it looked like a place which will serve good food. However, want what I was expecting. Maybe we went on 1st jan when most restaurants were closed and this one was packed. However...More",30,December 2017,4.0
奕品 蔡,Indian food always good !,"I just arrived lagos since Aug , im quite new here , before I been to india two times , I tried many kind of food in india , each dishes very charming! Needless to say, when I come here , I would like to...More",40,November 2017,4.0
Passenger60543244896,Good food,"Food is good, service is very impersonal, careless and clearly unprofessional. Decor of the restaurant is some horrid overwhelmingly red old 1980s style cheap look with a string of cheap christmas lights on the wall. Looks all round dirty. On the positive side, the food...More",30,November 2017,4.0
benheredonethat,Looks like a dive but the food tastes like the real deal!,This place is a gem hidden away in the back alleys of Lagos; literally behind a small random nondescript hotel.But the food was special and plenty of booze for the post work happy hour with colleagues. I found the prices to be a little on...More,40,August 2017,4.0
Hussein1586,Do not bother trying this place. Friendly advice.,"Very crowded place.
Noise was too much.
A spider was running on the ceiling.
Food was more than one hour late, and was far below expectations. 
Do not visit tjia place, imstead go to spice route, it is very close by.",40,October 2017,4.0
_abisheart,some of the best indian food in terms of quality and price,"It's tucked away behind the newcastle hotel on adeola odeku in victoria island  , in the same compound. parking can be an issue as the car park  serves several entities in the same compound
At first glance the restaurant itself looks very canteen like, a...More",30,September 2017,4.0
Manoj C,Great food,I think this place has some of the nicest Indian food in lagos served fresh and hot. The bar is quite decent. Overall value for money. Just wish the ambiance was a little better.,50,June 2017,4.0
TinaSommer,Authentic India in Lagos,"Absolutely amazing Indian food. The menu offers a vide selection of traditional food, so there is something for everyone. 
Not only is the food quality in top, but it's also very affordable. I'll for sure be back when i'm returning to Lagos",30,May 2017,4.0
REMI J,Cheap but consistently of a high quality,"The Sherlaton on Adeola Odeku hasn't changed a jot in ten years. The literally mom and pop ownership personally supervise ingredients and occasionally, the cooking. The result is quick consistent high quality simplicity. 

Indian food and a limited local Nigerian fare, is delivered competently, time...More",50,December 2016,4.0
DrJKC,Perfecto,"This is a good place to visit if you are looking for a different ASIAN food experience not just in terms of the food, but even in the decor and environment if you appreciate those sort of things.",10,February 2017,4.0
Temitope B,Perfect for Indian food,"I have been stuck with their Indian food for over 10 years now. 

They give you an impressive taste of India. 

Good food, good people and they are very price competitive when you have a group or want to throw a party there. 

Oh yes,...More",40,February 2017,4.0
gcxotf,Bargain,"Decent food, decent portions, acceptable staff but unacceptable environment. Although it may be the best value for money but somehow depressing the dining hall.",40,April 2017,4.0
CSRam,Casual dining at Sherlaton,"It's a value for money Indian, Chinese and Continental restaurant, they have variety of food and drinks.draught beer is very good, most of food served is good, like their pakodas, bajias,mutton Rogan Josh(no Rogan but the taste is good), like their potatoes in white sauce.",45,March 2017,4.0
VCMO,Excellent Food!,The food is awesome! I especially liked the pepper fish whose name is a little misleading since its grilled fish more suitable as a starter and didn't have too much pepper. The butter chicken was also really good. Service is ok and they do help...More,35,March 2017,4.0
irishboy4,Early Monday dinner,"On a Monday night they serve dosa, I lived in India for seven years prior to moving to Nigeria, dosa was my favorite food and remains so. I ordered masala dosa. It was probably twice the size of a street dosa, like wise the masala...More",40,February 2017,4.0
Britonh,Omg,"Epic food, always packed, best tip get there when doors open. The food is sublime, come out of there totally stuffed to the eyeballs and well worth it.",30,April 2016,4.0
469marisav,Consistently good Indian,"Sherlaton serves consistently good Indian food. They also have Chinese and Continental on offer. It's a typical Lagos Indian restaurant with a very basic layout and decor, but a great vibe and good prices. A hustling and bustling eat to enjoy solo, as a couple,...More",30,December 2016,4.0
ASHU275,Good Indian Food - Bad Ambiance,Restaurant provides some good Indian delicacies. However place is not well kept. Air-conditioning also does not works well. Limited drink options.,40,January 2017,4.0
buddyofall,Treat for people looking for Indian Food in Lagos,"An above average restaurant offering Indian cuisine at a prime location in Victoria Island.
Food is fine however not authentic but a treat for people looking for Indian food.",40,April 2016,4.0
martinsA390KL,"Food tasty, atmosphere awful","The restaurant is inside a dark, windowless ""hall"". Not very pleasing, a little noisy. The food and service leaves nothing to complain.",40,November 2016,4.0
oseni_debola,Authentic Indian Restaurant,"I have tried Chinese, Japanese and a mix of it all. Trip Advisor search recommended this for me and it was great. The atmosphere was good, except that there was a lot of chatter from people dinning there. I had fish curry and the chicken...More",50,January 2017,4.0
brijeshboza,Indian food,Has a good variety of Indian food. Food quality is reasonable good. Has a full fledge bar . Good for dinners.,40,March 2016,4.0
Ken055,Sherlaton Review,"good food.  not expensive.  staff is not pushy and generally speaking, somewhat slow.  atmosphere is simple.",40,January 2017,4.0
Shiva R,Poor attitude,"In general the restaurant has poor attitude towards the customers. They give what is available, they don't care what the customer asked for. There is no consistency in taste and preparation. Once they even mixed chicken in mutton Biriyani as they didn't have enough mutton...More",30,January 2017,4.0
dormal,authentic,"It is a great food at good price.
It is not a ¨luxury¨ restaurant but great ambience.
Ask the owner for recommendations.",30,August 2016,4.0
KITTAPPA,Indian restaurant in Lagos,"our  favourite choice of food, from vegetarian, you just cant miss it this restaurant. food is amazing,really best Indian food experience in Lagos, worth for the money 
Hotel interior required retrofit",40,December 2016,4.0
maglantech,Bets Indian food Vever !!!,"My favorite choice of food, from meat ,chicken, vegetarian,
you just cant miss it this restaurant. 
food is amazing, a bit spicy if you are sensitive, but its really best food experience in Lagos, my shrine !!!",40,December 2016,4.0
BryanF4,Work Past First Appearances,So the décor needs a birthday. Or two. Work past your initial reaction and get ready for the best Indian food in Lagos. Make sure you check your order by having the busy wait staff read it back to you and then relax. I was...More,45,November 2016,4.0
Keresa,Best tomato soup in town,I tried tomato soup and just amazing extremely tasty you will love it order with beef tandorn as well goes with soup very well,35,November 2016,4.0
mdasaoluw,Affordable and Good Value for money in a very expensive part of Lagos!,"have been to the Sherlaton many times over the past 12 years! 

it is a plesant surprise to find extremely reasonably priced food with good portion sizes in the middle of VI, which is normally known for stupidly exorbitant prices!

I have never been let...More",40,February 2016,4.0
Ocukomadu,Just a breakfast with a colleague,"Tool sometime that know that a treasure was hidden right beside my former office on Adesola Odeku, VI. This place is almost hidden and is easy to miss. The parking is super tight and not  very convenient and the ambience of the entrance area is...More",30,December 2015,4.0
Kemolala,"4am, post night out hunger pangs!","Literally I only go here when I'm a little tipsy and you need food from 1am- 5am.

not the best indian food ever but great for the purpose it serves",50,April 2016,4.0
mjacob007,Tasty food and outstanding value for money,"I would rate sherlaton as the best indian food restaurant in lagos. Ambiance is poor, it looks like a canteen. large portions, great value for money. very good spread of dishes. service is so so. They also do home delivery at no additional cost. biriyani,...More",40,October 2016,4.0
Valdis A,Good food Poor Ambience,"The very best traditional Indian food in Lagos!
Very tasty and original... 
...but all ambience around giving you a bad impression.
Been here many times in last 3 years and no changes.
The quality of furniture, tablecloth, plates, cutlery and the way how they serve,...More",50,July 2016,4.0
TaofickO,Great for Indian cuisine.,"Sherlaton is one of the oldest restaurants in lagos although not still at the same location. It's know for its unique Indian cuisine. I'm not a huge fan of Indian cuisine but enjoyed their meal and would go again. 
The ambiance is not so great...More",40,September 2016,4.0
cashwash,Eating on a budget with quality foods,"Of all Indian restaurants, this place is the sure winner. not so much space due to its customer demand, but really the food and the prize are so at range. The quality is very good. The management are friendly and customer-oriented.",40,March 2016,4.0
hossyahuoma,India food,"For those that  eat India food is good,when i tested a bit of it, is really good but the Restaurant is cool for those that can afford it, not for every one",30,August 2016,4.0
KenCooper1953,My best in Lagos,"Relaxed casual dining with great  Indian food 
authentic range of Indian food
Friendly staff and good service
Value for money",40,August 2016,4.0
Srikanta P,Party Place,"Nice location. Nice food. DJ, Dance, Party and Meetings, everything is fantastic. Have been visiting since last 6 years. Never tired till date.",30,October 2015,4.0
G.v. T,Business Lunch Experience,The atmosphere was warm an homely. The buffet covers wide range of menu of various nationalities. It's Service Per Excellence. !!!!!!!!!.,30,July 2016,4.0
Ianfung,NOT BAD TASTE BUT CAN NOT RECOMMEND TO FOREIGN VISITORS,Cooking is fine and so is the portion. Service is also quick but totally packed on a late Sunday evening ( people waiting at 8:45pm ). House red ( French table wine ) was served at room temperature ( undrinkable ) and the white rice...More,50,September 2016,4.0
HelloJohnny007,"Quality Food, Generous Portions and Value","There are so many good choices on the menu that you won't get bored. I have dine there and ordered delivery on many occasions and never been disappointed. Chicken Tikka Masala, Prawn Vindaloo, Chicken Jalfrezi and Lamb Madras have been a regular staple on many...More",40,October 2015,4.0
Srawan,Value for Money,Good to have some excellent Indian Vegeterian food with good atmosphere to with family. Even the takeaways are reasonable.,45,May 2016,4.0
mstphy,"Great food, great price","The Sherlaton, also referred to as the Cumberland (hotel) offers some great food at great prices.  You'll find expats and Nigerians, here, including lots of Indians, which is a good sign for an Indian restaurant, I think :)  There's lots to choose from on the...More",35,August 2016,4.0
Adhinarto,Value for Money,"Always Look forward to Monday Dosa menu. Kids love cheese naan, the best they probably ever had. Good food but atmosphere need to change a bit though.",40,August 2016,4.0
digitallevi,Excellent Indian Food,"Loved the indian food in this place. The kebab served on sizzlers, the naans were nice and fresh. The place was also reasonably priced.",30,June 2016,4.0
