author_name,review_title,review_text,author_rating,visit_date,overall_rating
ashu9262,Eating Indian in Lagos,"I have been here with my friend from Nageria. It was recommended to me due to my vegetarian option and stay (in Victoria Island), it was my first visit to Lagos and I was worried if I get any good vegetarian food. The restaurant doesn't...More",50,June 2016,4.0
876steve2016,Best Indian in Lagos,The atmosphere is good décor sparse but this is made up with the smiling faces of the waiting staff.  The aromatics from the food waft into your nose from the moment you arrie,40,July 2016,4.0
sss_mach7,Genuine Indian Taste,This place offers actual Indian taste which is pocket friendly. Paneer (cottage cheese) could be much better. Gulab jamuns (gold balls in sugar syrup) are a must try.,40,May 2016,4.0
PaulD898,Outstanding quality for a great price,"This is a regular favorite. Home (hotel) delivery of some super tasty food for very reasonable prices. 

Jalfrezi, tikka masala, various naan options - it's all good. Monday is for dosa specials. Even breakfast buffet!",50,July 2016,4.0
strawberryfield2016,Happy tummy for a reasonable money,"This restaurant is one of my favourite in Victoria Island, they have wide selections in the menu, superb food taste for a reasonable price and big serving. The managers are so customer-oriented.Though the place needs refurbishing, it looks so old and congested.",50,March 2016,4.0
Blessing A,"Looks Good, Taste Better","My friends and i loved loved and loved every moment, delicious, yummy and sumptuous dishes, it is a beautiful place to be.",50,August 2015,4.0
Ankush G,Authentic Indian Food,"The ambience is not great but the quality of food will compensate for that sure.. I think best Indian restaurant in Lagos. And value for money..

Also they have two separate lounges for special occassions (birthday/anniversary celebration)",50,June 2016,4.0
evelyn e,Indian and Nigerian Food,"affordable restaurant. home cooking, great Indian food and recently some Nigerian  dishes.located in victoria island . easy access for those who work on the island. I love the Chicken tendori.",40,January 2016,4.0
Ibadanboy,Indian,The Sherlaton restaurant serves Indian food. The ambiance could be much much better but the food is good,50,March 2016,4.0
SHAK_AKRAM,Home away from home,Authentic Indian cuisine. Their menu has a lot of variety and the prices are very reasonable. Must try their breakfast of parathas & eggs. Décor needs improvement though,50,May 2016,4.0
EdinburghIain,Great indian food,"Never mind the ambiance the food is excellent , best Indian restaurant in Lagos, ask for Rajesh he will recommend something that suits your taste.",40,May 2016,4.0
giteshyagnik,Never to visit,Extreme poor service. Dirty ambiance and bad attitude of staff gives unpleasant taste. Never to visit again. They also treat different nationality in a different way. Indians are badly treated. Unfair invoicing is more often.,45,November 2015,4.0
scottishhobo,Great food,I been here several times and the food is always good and the service is also good. The food is good value for money. Maybe the decor needs a revamp but that would be my only negative comment,35,April 2016,4.0
E7837YPricharda,Bog standard Indian Restaurant,The decor and ambience was of a low quality . The restaurant is tucked at the back of some buildings and the service level is quite low but I can't say the food was too bad. We certainly enjoyed the meal and will be back.,40,April 2016,4.0
Mustang1955,Outstanding food,"Each time I go to Lagis, I visit the Sherlaton.  From the outside this is not the most appealing place, and even inside it looks like it could do with decorating but the food produced here is some of the very best Indian food one...More",30,March 2016,4.0
hhm501,tasty food at a reasonable price,"Sherlaton is a good place to 'pop' in for a tasty meal at a reasonable price. Staff can be very good or too busy to remember extra orders - so try and get the complete order in first time! 
Food is good but the decor...More",50,February 2016,4.0
mail2shade,FOOD FOR CHANGE,Its a decent location with no safety issue. food is excellent and even a european can also easily manage the food because he will get continental food too.Even safe to have dinner. Its typically an indian restarant where many european also enjoy the food.,20,March 2016,4.0
Marg M,Pretty good Indian food,"We ATE here several times. The food is tasty and authentic. Sometimes a bit too much salt. The waitstaff were attentive. Parking can be an issue. They have crammed a grocery store, hotel, night club, restaurant and salon in a very tight space.  Always seems...More",40,August 2015,4.0
knkwa,Superb Service,"The best place to take your guest to, for dinner. Good customer care relationship. From taking order to delivery, the service is the best. We enjoyed our stay and I am sure you will like it when you visit Sherlaton Indian Restaurant.",30,February 2016,4.0
Muhammad A,Best place in town for a taste of India home away from home!,"Good Food, Friendly service... Very bad & depressing ambiance, kind of cluttered. So if you are going for an experience i would avoid it, if its just for the love of food then i would recommend trying it out.",50,March 2016,4.0
Lorretta A,Mrs lorretta,"So nice ,enough space,well spiced food,assorted meats,all are nice from different delicacies,with big treatment.",30,September 2015,4.0
Badgersniff,Super food but be warned...,I am a regular business visitor to Lagos and a trip to the Sherlaton once or twice during my stay is a must. The reason is simple in that the quality and quantity of the food is first class and also good value for money...More,50,March 2016,4.0
ks_prov,The best Indian food I have tasted in my life!),Cool place to spend Friday night with friends! Food is delicious and fresh! Big portions u can take home in big boxes),30,January 2016,4.0
GT1912,Good food!!!,Stayed in the Cumberland Hotel and the restaurant was quite close. The food was good and mostly Indian. I had dinner there for the seven days i stayed in the hotel. Breakfast dont seem to have good options.,50,February 2016,4.0
mandyfyfe,Great food at great prices!,"This is, up till now the best Indian food I've had in Lagos, great menu and excellent prices.  The service is also very good and you know your onto a winner when you see the restaurant full of Indian nationals. 

The decor is def not...More",40,February 2016,4.0
trekker2019,Got a takeaway,"We ordered takeaway here. Had the madras chicken and butter naan breads, delicious and definitely more affordable than hotel restaurants. Would definitely eat there again.",40,February 2016,4.0
Jon W,Great food and good value,"A local favourite for some of the best curry in VI at a reasonable price. The inside of the restaurant may be a little tired, but this doesn't distract from a great meal. Good for take - away too.",45,January 2016,4.0
RonaldStilting,Reasonable with a bad surprise at the end,"I went there because of some fairly positive reviews. So I knew the ambiance wouldn't be impressive, which I can only confirm. The restaurant is located behind a hotel and I had to go through the hotel to get there (maybe there is an easier...More",35,January 2016,4.0
mohammedm2015,The best Indian food in Lagos...,"This has been my hidden gem for a few years now. Not the most fancy resturant based on appearance but once those plates start coming out...you could literally be any where  fancy in the world! 

It is located literally a walking distance from the Federal...More",40,January 2016,4.0
Ifeoluwa F,Authentic Indian cuisine in the Lagos commercial district,"My favorite dish here is the butter chicken with butter naan. They do it right but then they do most things right. I order straight to my office most times, not exactly the prettiest restaurant in lagos; the food however does it for me ......More",30,September 2015,4.0
SubodhB,Average,An average joint for Indian food with ok ambiance. Not good for business dinners. Ok for occasional visits. Tried thali but was not impressed.,40,December 2015,4.0
Hassan k,Awesome place,"Food was amazing and hot but be advised they serve large portions,i love the special indian rice with mutton, i will definately go back there",50,December 2015,4.0
AdioB,Indian food restaurant and bar,"Not much on decor, but the restaurant is air conditioned and looks like a place where a lot of Indians meet. It is located at the back of Sherlaton hotel, in a separate building, so you may wish to drive in. Food was tastey and...More",30,December 2015,4.0
anshu7474,"Excellent food, but bad service....","Food is good and tasty, but service is pathetic. They also server Indian and other cuisines. I have tried Indian and Nigerian.",50,January 2015,4.0
LyInfante,Indian Cuisine at its best!,"My entire my family and I are big foodies. We all love Indian food and Sherlaton has always been the No. 1 choice for us when it comes to Indian cuisine.  Service is fast, staff are friendly, price is reasonable, servings are fair and you...More",40,November 2015,4.0
Jassminka_tv,The best Indian food,"The best Indian food in Lagos, really good, my advice... don't miss it. They will make it easy for you on a couple,  group or business to give you the area,  attention and good service  !!",30,November 2014,4.0
Sasikumarta,Real tasty Indian Foods specially Gulab jamun,Mouth watering Gulab jamun my favorite. Good tasty indian food especially north Indian.Good for Vegetarians too,40,September 2015,4.0
KapilV611,"Delicious Indian Food (one of the best in Lagos), Reasonably priced , a very average ambience","One of the oldest Indian restaurant which is heavily booked on even some of the weekdays just because of good indian food quality .....
Its interiors and decor are very old ... its ambience is no where close to a fine dining restaurant , however...More",30,August 2015,4.0
dips22783,Fantastic food,"This restaurant is not very fancy, but it serves amazing indian food. In fact the food was better than an average indian restaurant.The manager/head chef is a gem and takes good care.",40,July 2015,4.0
TDRoux,Good food!,Although this place is far from fancy - its clean and the food is affordable and very very tasty.  I dont enjoy burny things but this Indian food is tasty and delicious.  Compared to other Indian food places in Lagos I would put this one...More,50,September 2015,4.0
RMQ8,The Food and Price is great,"The Food and the Price is great, the portion a large - maybe the presentation is not over the top and the chicken dish could be a bit more spicy. Service as per Lagos standard not more and not less. Atmosphere a bit, how to...More",40,September 2015,4.0
LingfieldGambler,Good Value,"Ate here on a Friday evening.  We hadn't booked so had to wait 10 minutes for a table as restaurant was very busy.

Food was good.  Portions are generous.  Service satisfactory. Lively atmosphere.  Good value for VI.  Enjoyed.",45,September 2015,4.0
karmal962,Some of the best authentic Indian cuisine,"I love going to Sherlaton, it is a good place for friends, families, business and the atmosphere is alive and humming.  The restaurant is always full and the food always fresh and piping hot.  There is a huge selection to choose from and the prices...More",35,November 2014,4.0
CSRam,Choice for Indian Food,"The restaurant is a good choice for regular eat outs like a irani chai shop in Mumbai, the masala tea is very good, the pakodas are also good, overall the snacks are good. The food is also ok but sometimes they all tend to taste...More",40,August 2015,4.0
FredericWidell,Great food ...,This place is tucked away behind a less impressive hotel with a small and messy parking lot. As you enter you sort step into a cellar. It's normally a very busy place with slow service. It's an old and dingy place in dire need of...More,30,July 2015,4.0
KSSkanth,Some Great Indian food to taste at Lagos,The Restaurant a good choice of Veg and NVeg Indian food items. Taste of food serverd is near to India for few of the dishes and snacks served like Samosas and Onion Bhajia or Pakoras are good. Masala Pappad orderd was not upto the mark...More,50,July 2015,4.0
Segaria226,Great Indian food,"Had a really good time here on my first visit last Thursday evening. It reminds me of some of my favorite Indian restaurants in London. Nothing special to look at but good quality food and fantastic friendly welcome. 

The grilled green chicken tikka was fabulous...More",40,July 2015,4.0
djpri,Not worthy of the prices!,"At one point of time, this used to be the go to option for good Indian Cuisine. It had a great ambience, excellent seating space, and excellent chefs. Those were the days of the past. The restaurant has undergone changes all to its detriment, right...More",40,June 2015,4.0
mstphy,Good Indian Food at Good Prices,"The food is tasty.  The prices are good.  It's popular with expats, Indian expats and Nigerians.  The service is friendly, but often errors with orders, so check your bill.  You can also order take out with delivery.  The Indian store next to it, is worth...More",40,January 2015,4.0
M R,Great food great value interior a little tired,Like a great indian resturant in Birmingham amazing food great service good menu good value (for Lagos) but in serious need of some investment in decor.,30,June 2015,4.0
Simon G,Consistently deliver Quality and Service,"The Sherlaton remains the most authentic Indian restaurant year after year, no frills, just great food served by friendly waiters. 

The place never lets us down!",40,June 2015,4.0
Irinajo,Great Indian food,Sherlaton has been around for a while and the food is great. The prices are fantastic for a Victoria Island restaurant (which normally is cut throat). The service is friendly but slow. They make up for it by being thoughtful with helping you make your...More,50,June 2015,4.0
mjacob007,"large portions of tasty food, mediocre ambience","yummy food, good sized portions, great variety. poor setting and ambience. we got our order in 20 mins. moderately priced. restaurant does not impress, but food is impressive.",20,June 2015,4.0
Becky0222,Best Value and best Indian food in Lagos!,This place has the best food for the best price! The quality and quantity of food have been very good every time we come to this restaurant! It's a down-to-earth place.,50,May 2015,4.0
visiteur720,good indian restaurant but not a great experience,"The food quality is good, yes. The service is far from good. Noisy, expensive. Not a great experience overall.",40,May 2015,4.0
ramh2014,Favourite since 30 Years,"The very first night on the day i landed in lagos for the first time in 1986, i went to Sherlaton restaurant which at that time was a standalone restaurant on Awolowo road. Since over 30 years it has maintained its reputation as the best...More",40,January 2015,4.0
Kasanga,NO Ambiance BUT Great Food & Reasonable Price,"The place is very simple and has absolutely no ambiance whatsoever. The service is adequate but friendly. However, what's absolutely divine about this place is the food. They have a wide range from selections and you certainly can find something that meets your dietary requirement....More",45,March 2015,4.0
secheresse,Hidden treasure,"First you have to find the place, When you finally have the right location, you must control yourself not to run away and when you have passed the entrance door on the back courtyard, you understand that you are in a real indian restaurant with...More",35,November 2014,4.0
Duckula,Good tasting food at a reasonable price,"This restaurant is located behind a run down hotel.  It is an Indian restaurant run by Indians with some local waiters.  The food is very tasty, though not as spicy as most Europeans or locals would expect.  The food comes quickly and well presented, and...More",40,July 2014,4.0
Marc K,Sherlaton Restaurant behind Cumberland Hotel,"Best Indian Food in town. Bit scruffy on the inside and sometimes food is received in wrong order, but all part oif the fun.",30,April 2014,4.0
KMHABISHOP,Magnificent Indian - But Try Different Things,"Sherlaton is an old favorite, the best Indian food in Lagos, and some of the best Indian food I have had on five continents.  Note, I said best Indian food - you don't go to Sherlaton for the ambiance, decor or service  - you go...More",40,December 2014,4.0
L13m,Best lamb legs.,I can't recall the name of the food but it was the best lamb leg in town. The leg well marinated with spice. It was large portion that I wished I could finish it all. I didn't try other foods. Price is good. The best...More,50,November 2014,4.0
Mr_Jaco,Excellent value for money,"Although first appearances doesn't appeal to you, this is a typical case of don't judge a book by its cover.  The décor is old and much need of attention.  A table is quickly cleared and organized for you and your party.  The waitron is assigned...More",40,July 2014,4.0
Ravi D,Sherlaton - an old time favourite thats seen better days,At one time the food at Sherlaton was exceptional and great value for money. Nowadays i would rate it as a poor second to Spice Bar for Indian food. The atmosphere is non-existent. The only good thing is that it is one of the best...More,30,October 2014,4.0
pandabear_11,Very enjoyable!,"A group of 7 of us went for dinner, it was really very nice. Quick service, food was extremely tasty and the price was reasonable. We shared the lamb leg, black Dahl and some veggie dishes, as well as garlic roti and a mixed entree....More",40,November 2014,4.0
Oyibo2014,Excellent Food,"Great Indian food, well prepared, good range of menu.  Do takeaway as well, delivering to most areas of the islands.  Restaurant is quite quiet, but go with a group and you'll have a good meal!",50,October 2014,4.0
M R,High quality and well prepared Indian Food In Lagos,"From a food perspective every dish was well prepared and above all authentic and tasty, not overpowered by chilli but a perfect blend and balance of flavours.  The Menu is comprehensive but not overly complex, and as well as the traditional favourites there is enough...More",40,November 2014,4.0
globetravell,"Excellent FOOD, Excellent SERVICE","Thought the restaurent looks outdated from ourside and there is not much of ambience, I visit this restaurent most frequently then the other restaurents in the city. If you dont care much for the ambience, this is the place to go. Food is 100% indian...More",50,November 2014,4.0
mercuised,Good food,"Good Indian food with plenty of options to choose from. Indian breakfast buffet is really nice if you stay nearby. 

Ambience could have been better.",30,September 2014,4.0
74SteveO,Open 24/7 Great Curry,"2 restaraunts 1 in Newcastle Hotel Ikeja & 1 in Victoria island
Both serve great curries VI open 24/7
Friendly service reasonably priced great food
Worth a visit",40,September 2014,4.0
AngelEunice,"Don't go there for the ambience, go there for the food.","The food here is great. This is my favourite Indian restaurant by far. I have been here several times and I will always keep coming here. If you're looking to eat good Indian food, then make your way to Sherlaton restaurant. But if you're one...More",40,June 2014,4.0
AvnerNa,The best Indian restaurant in Africa and India too!!!,"number one!!!

I am crazy about Indian food!
i eat in New Delhi, in Mumbai, even in the famous Indian restaurant in Abuja and in the all Indians places in Lagos and this is the best!!!

quality! quantity! price! and service!!!

i am recommending you...More",45,November 2014,4.0
Ewood2014,Great value,"One of the best restaurants in Lagos in terms of food quality, quantity, price and service. The restaurant can seem a little run down but it is frequented by a hard core of regulars. 
Always helpful and willing to adjust if raw materials available. Vegetable...More",35,September 2014,4.0
GRT7V,Big portions!,"Busy restaraunt open all day, every day so I am told. Veg Samosa to start, very tasty. Mutton Madras for me which was good, there was a big pot of it. My friend had a tasty tandoori fish curry. We had one portion of plain...More",40,September 2014,4.0
Akshyat B,Good food. Monday night South Indian is top..,Can look a little run down and old and seems like a typical bar/restaurant in a small town in India. But they have a fully stocked bar and delicious food. The dosa special on Monday night is a great idea if you are here. Food...More,30,August 2014,4.0
vaibhavtyagi015,Living up to the standard,"Good place to have your stay in Nigeria, maintaing there international standard . Indians normally visit there for meetings and parties",40,August 2013,4.0
KobusLou,Sherlaton Indian Restaurant,restaurant has converted me to a lover of of Indian cuisine. The food is simply delicious. All in all a lovely evening and would thoroughly recommend.,50,July 2014,4.0
641RBS,good indian,"good experience friendly staffs nice menu....\
keep the same standard for competative price ........",40,May 2014,4.0
Vijaypsingh81,Nice Restaurant for Indian food Lovers,"Nice and good place for indian food lovers.I personally enjoy their sunday buffet, which has many options in good budget.",40,November 2013,4.0
ijeh,Yummy food!,THI  restaurant has converted me to a lover of of Indian cuisine. The food is simply delicious. I've never had cheese Nan as yummy as I had here. The ambience  is a 3/5 and yes pleas wipe your cutlery before using it. The waiters and...More,50,February 2014,4.0
shlomoh2018,Always good value for money,"I visit the Sherlaton whenever I am in Lagos for several years now and its great to know that they keep the same high standard, good service at competative prices.",40,February 2014,4.0
TimmoW16,Little India,Great Indian food at a very reasonable price. Good portions and great tastes. Lacking in decor but the food makes up for it. A must try in Lagos.,50,April 2014,4.0
srinivas v,Mini India in Lagos,"Food Authentic and the palce is wonderful. Forget Calories and just gorge on their Chicken and Mutton dishes. We had a chat with the Chef there and requested him for Khemma pao , this was made in 10 minutes and was served piping hot and...More",40,February 2014,4.0
ZeeGoes,Great food + sketchy,"For tasty indian food in Lagos, this is a must! The food comes in large portion, so we always take a doggy bag afterwards. The ambiance is very so so, make sure to wipe plates and cups clean before using them. They use the plates...More",40,January 2014,4.0
faisal021187,A piece of India in Nigeria,"Awesome food, excellent quality, good service and comfortable atmosphere, all make this restaurant one of the ""must eat"" place while you are in Lagos.",40,June 2013,4.0
TitiDokubo,Wonderful,"Never knew of this place till my friend's bridal party and we had to lodge at Cumberland Hotel. Sherlaton shares the same space as the hotel and i went in there with a couple of friends. Though I wasn't so hungry, i tried all that...More",40,January 2014,4.0
melocalperson,An original,"I first went to the Sherlaton when it opened in the mid eighties. It was not only good, it was the only Indian restaurant in town! Went back again in August this year and there is a lot more competition but the Sherlaton holds its...More",45,August 2013,4.0
Probia,Good but not exceptional,"The Sherlaton is excellently located for those living, visiting or working in the Victoria Island VI) and Ikoyi areas. The staff is friendly, some of the items (not too many, I'm afraid) and all are at least above average to average. The spice level can...More",35,September 2013,4.0
yiluo,Cheese Naan for the win,"Only been here twice and I've been impressed both times. The Cheese naan and the chicken curry are my absolute favorites. Service is a tad slow and could be more efficient. The ambiance is good enough and when properly decorated, you do feel like you...More",40,September 2013,4.0
MgdaleneI,Excellent meal,"I first came here with a group of friends from the Samaritan feet headed by Manny. After hard work of distributing shoes, toothpaste and toothbrushes in schools and orphanages, coming here was very refreshing. 
The meal was very good. You can eat eat and eat...More",30,June 2013,4.0
Afty,Great hole in the wall,"Appearances can surely be deceptive...the place looks like an old barn where someone would be turning over used cars. However, the food is spot on, and for Lagos standards, the pricing is quite good as well.

The grills and curries were both well prepared, and...More",40,September 2013,4.0
amitpi,Taste of India in Lagos,"This is one of the good hotels  in the prime Victoria Island area.The decor and ambience is  good.It offers 24x7 service.Service is good.Portions are adeaquate.The taste of India food served is simply awesome.It is a good place to unwind and spend time on weekends.
One...More",40,August 2013,4.0
Bauck,Best Indian restaurant in Lagos,"From the outside, this place does not look all that appealing, but appearances can deceive.

Sherlaton is one of the oldest restaurants in Lagos, and is open 24/7, so if you need some night food, look no further!

The meals are nicely sized, and probably...More",30,July 2013,4.0
IanG893,A great meal,"Had a meal here as I was staying in the hotel.
Great food, very good service and well worth a visit.",40,May 2013,4.0
buddyofall,Average food,Average Indian food however good if you missed Indian food in this part of the world. Staff is helpful & available.,40,November 2012,4.0
mrjohnWales,cool curry,"should not even try cold and disappointed Service was not attentive, left for long periods waiting for drinks would give it a miss next time",40,July 2013,4.0
DavidB784,Properly Indian...,"When you walk into the restaurant you may have doubts, but it is quickly forgotten as the ambiance is as if you are in India - nothing over the top and feels like a place you would find local Indians eating - and the food...More",40,May 2013,4.0
