author_name,review_title,review_text,author_rating,visit_date,overall_rating
Femorata,Spicy Asian Cuisine,"It is a nice place located in the heart of Lagos, in an imposing white building. The food is great if you are a lover of Asian and Indian cuisine but beware of the hot spices and the plenty added garlic. Prices are moderate, fair...More",50,,4.0
C130Captain,Excellent Indian Food but very simple and bad location,The food is excellent but it may be a real mission to get there due to the horrific traffic in Ikeja. It is a very simple place with no gadgets in a run down hotel but the food is undoubtedly the best Indian food in...More,50,September 2012,4.0
Mabiadex,Don't Go there!,"Very dirty, crowed and their food was not great. The staff weren't friendly and it was generally a bad experience.",30,,4.0
Jonathan H,Great food and excellent value,"Excellent authentic Indian food at great (for Lagos) prices. Decor somewhat shabby and service can be patchy, but worth a visit.",40,February 2013,4.0
Nicholas K,A bit of India in Africa,"The food is fantastic, innexpensive but tasty.  My wife and I miss the food when we are back home in South Africa!",45,December 2012,4.0
Dave A,curry nite,"can't fault the food...everything fishy or seafood based was spot on,..flavouring excellent...pricing very pleasant for lagos....",35,December 2012,4.0
Reniestar,Unexpectedly surprised,"Shabby on the outside, attentive staff and delicious food on the inside.

You can call ahead, or just go in. Best of all, they are open 24/7.

Some of my favorites are the mutton biryani, black pepper fish, creamed spinach and tandoori chicken.",40,June 2012,4.0
ALP777,A local favourite,"A popular local Indian Restaurant .....a little shabby on first look, but good food, fair prices and the owners are around.",30,July 2012,4.0
SourabhGaggar,Average dinner...but friendly staff,"I have tried Sherlaton for dinner..since it was very near to my stayed hotel(federal palace)....The hotel is at back side of building down to Cumberland hotel..location is quite good..
The furnishing in restaurant looks very old & need to be maintain..so dark in restaurant with...More",40,November 2012,4.0
devarpan c,All Nighter Indian Food,After coming out of Pats Bar or any of the innumerable watering holes of Victoria Island in Lagos. If you feel the curry pangs then definitely head out to Sherlaton. The place is definitely not going to win any awards for ambience or hygiene. But...More,40,October 2012,4.0
KapilV611,Good food,"One of the most frequent places visited by Indians, very old, ambience doesnt exist, however what is get is good indian food probably at most reasonable prices in Lagos and a small Niravan LOunge playing the music you want. One of the chosen place for...More",50,November 2012,4.0
SandyAsokoro,Good late night/early morning joint,"After pulling and all-nighter on the dance floor  and not quite ready for bed yet, the Sherlaton (which is opened 24/7) is the perfect place to have a quick bite before going home. Samosa, chicken curry and nan bread is always a winner.",40,,4.0
pjhap,Tasty,"Tasty Indian food, so long as you don't mind the ambiance of a canteen. Slightly hidden away, but most know where it is. They also cater off site.",40,March 2012,4.0
OlesyaLaty,Great Food,The place itself looks rather shabby but please do not let this first impression to influence you. Stay and try. Food is just the best in Lagos. I stayed in Lagos for 2 weeks and we went to Sherlaton almost every evening. Big plus also...More,30,May 2012,4.0
Nigel R,Best Indian in Lagos - authentic and great value grub,"Not easy to find if you've never been before it's behind the Cumberland Hotel, at the end of Adeola Odeku.  The Cumberland hotel looks drab, and you have to go down a dark alley at the side of the hotel until you get to the...More",30,September 2012,4.0
Oenophilia,Still got it,"A Lagos classic - still imho the best curry in Lagos.  Punctual, generous portions, and so much nicer on the inside than it looks on the outside.",40,October 2012,4.0
drumlemen,MOST CONSISTENT INDIAN FOOD IN LAGOS,"Have visited this restaurant over a period of 12 years and the consistency of the food served has remained very good. My only criticism is that the plates the food is served on are not warmed and therefore the food gets cold quite quick, also,...More",30,October 2012,4.0
Y6571FYandyc,Best Indian Food in Lagos,I have visited the Sherlaton on four occasions recently. The manager and his team are welcoming and attentive. The food is consistently high quality and I have introduced two Nigerian friends to Indian cuisine here - they both became immediate fans of the Chicken Malai...More,40,,4.0
NHtravel86,Never disappoints,Best Indian in Lagos. Food consistently good and well worth the trip. Only drawback is that the Vindaloo is not hot,40,September 2012,4.0
hunk_i_am,awesome food,"stayed for 3 months here.
came alive to India because of this restaurant only!!
Food quality is appreciable here.
although service is bit poor... but is bearable if u are getting good quality food to eat!!",45,July 2012,4.0
ronkeke,authentic indian food in Lagos,"the restaurant is hidden behind but has great food though the ambience is not so great so i would recommend delivery service or take-away.
the food is wonderful and you can tell because Indians away from home are there enjoying the home experience- proof of...More",35,June 2012,4.0
CJPSanRamon,"Good Food, Best Prices in Lagos!","Although Indian is not my favorite of cuisines this restaurant has won me over.  Although the ambience is middle of the road (more like a pub atmosphere than a restaurant) the food is pretty good even for me.

The prices are incredible (by Lagos standards)...More",40,August 2012,4.0
ravenmortal,Classic!,Perhaps still the best Indian food in Lagos? Definitely a good place for the late night hunger pangs.,30,June 2012,4.0
Simon G,A classic old Favourite,"The Sherlaton is by far the best Indian restaurant in Lagos and never fails to satisfy with its consistent food quality and friendly service. Mr Rajesh the house manager is an absolute professional and knows all of his guests by name.

This restaurant will not...More",50,July 2012,4.0
princesasOfiaG,"Dosha Mondays, Yummy","this place is probably by far the best indian in VI-IKOYI, the place is out dated, and very dark, needs to be renovated.  however, the service is usually very attentive... mondays is their speciality of DOSHA.. it will not disappoint.. location not the best, but...More",40,April 2012,4.0
James H,Good Service,"I like the mix platter, green fish with lot of sauce",40,June 2012,4.0
Dennis S,below average for Lagos,"I've just been for an Indian meal here (they serve a variety of food types including Chinese) because of the encouraging reviews of this restaurant. I must confess that I found the mutton dish to be tough, and not sure about the chicken in the...More",40,June 2012,4.0
butzi_s,Excellent Indian food at great prices,"Looks a bit shabby from outside (and inside...), but the food is amazing...
Excellent value for money too!",30,March 2012,4.0
MarkH482,Economical options for eating out,"Food and cost was great, appearance of seating area as well as service not ggod at all",50,February 2012,4.0
udaypilani,Half decent Indian food,"Sherlaton is terrible when it comes to ambiance. Really marvel how they manage to have a license, however in lagos anything goes. The food is a saving grace. Decent food and reasonable prices.",40,May 2012,4.0
Afamiiii,Great food reasonably price,"Reasonably price for Victoria Island that is. If you like Indian cuisine, this is a great place to go.",50,December 2011,4.0
MUCTraveller,Excellent food at good prices,"Very good Indian food, lot of choices, high quality, but shabby outside of restaurant",20,April 2012,4.0
reginafug,Good Indian Food - but the place needs some serious remodeling!,"We have visited this restaurant three times.  We've enjoyed the food, and it is fair to say they are very consistent with the quality.

The spices are just right, the naan are a bit small, and expensive. The raita is watery. But, the tandoori dishes...More",50,February 2012,4.0
grahamstubbings,Very good Indian food,Went here with a colleague and was pleasantly surprised. We over ordered not realising how big the portions would be especially the starters which were enormous. My paneer tikka and mutton rogan josh were excellent and in the general the food was nicely spiced. Excellent...More,40,April 2012,4.0
cchopra,Nice Indian food,"Read great reviews on Internet. Many reviews mentioned it is on Awolowo Road, but it is actually at Adeola Odeku St, 234011, Nigeria +234 1 760 1873 () . So get the location right.
All good things to say about this Indian restaurant. Great Indian...More",45,March 2012,4.0
Andrew v,A pleasure to have eaten there,This is an experience to visit a place of this professional level,35,February 2012,4.0
Kristiann G,Fantastic Just the Way It Is!,"Delicious bargain Indian food, available 24-hours. What's not to like? Turn a blind eye to the greasy tablecloths, maybe.",40,November 2011,4.0
Joe H,Great Curries!,Excellent food and reasonable price - best in town!,30,,4.0
Marquefood,Great for a quick bite,"Good cheap Indian food. You're not going to this place for ambiance, just for good cheap Indian food.",40,January 2012,4.0
SunriserLOS,Excellent Food,"Very poor decor and very dirty toilets, which makes me think how clean is the kitchen.. But food is great and prices are very reasonable! Very convinient spot as per location, and service is ok. As I say the only dobt is the cleanleness of...More",50,January 2012,4.0
kayOderemi,Great Ciusine,"Was there way back with my an India supplier for where I used to work as an Import Manager.  The guy was crazy about the cuisine and customer service.  For me, I loved the Chapati and Chicken Tika.  Great taste.  Never being back there since...More",50,,4.0
lagoSmart,lagoSmart,Renamed to Cumberland/ Nirvana. Nice food. A little congested in space.,50,,4.0
LagosExpat2010,Great food at a reasonable price,"Great food at a reasonable price, decent service, and great location.",50,,4.0
isaac24,Taste of India,The restaurant serves typically North Indian food. The curries are authentic and tasty. Service is good and the waiters have some knowledge of the food. Would recommend if you are looking for some Indian food in Lagos.,30,November 2011,4.0
Jennifer A,Incredible Indian food,The Sherlaton sets the standard for Indian food in Lagos. The food is great as well as the service. We have had them cater and they do a fantastic job with the food and service at catered events as well.,50,September 2011,4.0
DaBeNa,Best Indian food ever - restaurant quite shabby,"For years I thought I don't like Indian food - till I got to Lagos.
This place has great food and great prices, but the restaurant is a bit of a dump, sorry to say.
Don't miss the Samosa chat and the cheese naan.
And...More",30,November 2011,4.0
ArynAjalaTravel,Its Spicy,"Nice, like the Chicken masala and the enviroment. I have been there just once but it was fine.",30,,4.0
Colo_mentality,Great food but take away!,I recently noticed some construction activities in the restaurant but it seems they only upgraded the external. WHY!! The internal decor is nothing for a restaurant in Victoria Island. But the foood. OMG!. The food makes the visit worth it. Be adventurous and try more...More,50,December 2011,4.0
Stevozen,Best Indian food outside India!,The Sherlaton is simply the best Indian restaurant outside India. There are stacks of lively Indian folk in the place plus the usual ex pat crew and locals looking for value food in Lagos. Rajesh and his team provide great food and atmosphere.go for the...More,40,December 2011,4.0
jdstewart79,Best Indian food in Lagos,"Right, let’s start with the bad: not easy to find if you've never been before. Behind the Cumberland Hotel, at the end of Adeola Odeku; the hotel looks drab, and you wonder where you are going down this dark alley at the side... but have...More",45,November 2011,4.0
udaypilani,Good Indian Food,Bad ambience but good food at reasonable prices. Try the tandoori chicken and the indian thali,35,September 2011,4.0
Mohaned E,Must try ? Nahee ;),"Well, nothing much to mention about it, however if you like indian food but dont care much about the quality then this is a good option for you.. 
I used to like it, until one day I ordered a lamp leg for delivery, but what...More",40,,4.0
philhollowayinuk,"Best Indian in Lagos, cheapest too.","If you  like Indian, then you have to eat here. The food is full of flavour, there is a huge variety, good portions and I've always had an excellent meal here. 
The restaurant ambiance is a bit dingy, service is OK by Lagos standards but...More",30,September 2011,4.0
Africa_Travels,"Great food, fantastic value","Finding good food that is also value for money is a real challenge on the islands of Lagos. Since being introduced to Sherlaton a few months back, I keep coming back as it must be one of the best deals in town.
It is a...More",50,June 2011,4.0
NinadPune,Very tasty Indian food,"It is in VI. at the start of ODEOLA ODEKU street. It is part of KUMBERLAND HOTEL. 
Very good food -quality & quantity. 
For single person Veg - no veg thali (Thali contains vegitable, roti, rice, dal, papad etc. sufficient for 1 person) is good...More",50,,4.0
