author_name,review_title,review_text,author_rating,visit_date,overall_rating
603ranjeets,Memorable experience,It was a pleasant experience for us at shiro we made a reservation for Teppanyaki which is a live kitchen experience only available at shiro lagos. The chef was very well experienced showed us some magic tricks and made the experience amazing. You should definitely...More,50,November 2021,4.5
635melah,Excellent service from staffs.,"Hi JusticeJoyce,   

Thank you so much for taking the time out to share your oh so detailed feedback with us and your constant and positive review. We are glad you enjoyed your overall experience and we look forward to welcoming you back in the near...More",50,November 2021,4.5
443fridays,Shiro is second to none.,"November 2021 visit was encouraged with an update to their website showing Menu ""Batch 3"" being posted. 
They posted all four (4) menus for brunch inadvertently but no worries... A quick email clarified which week would be hosted and I booked that moment. 

Upon arrival,...More",40,November 2021,4.5
283aruns,Great place to spend time with friends,"Hi JusticeJoyce,   

Thank you so much for taking the time out to share your oh so detailed feedback with us and your constant and positive review. We are glad you enjoyed your overall experience and we look forward to welcoming you back in the near...More",30,November 2021,4.5
Antonydecilva,Excellent service,"Food excellent, drinks excellent. The only thing off putting was the front desk attendant who promptly let us know the minimum spend was Naira 20,000. She needs training in handling customers. Nevertheless I will visit again for the excellent sushi.More",50,October 2021,4.5
Culture656020,Mahtani Chicken is one of the signature dish they serve .Also i feel they serve the best sushi & maki mono in the city .,"Hi MChipalos,   

Thank you so much for taking the time out to share your feedback with us. We are glad you enjoyed your overall experience and we look forward to welcoming you back in the near future. We appreciate your valuable feedback and have shared...More",50,November 2021,4.5
Krishna T,Favorite place.,"Menu online has ""BATCH"" Number so follow that to know what's being served, but call to confirm or don't be surprised when that's not the menu they are following for brunch. 

October 17, 2021 was an intentional visit because I wanted beef in basil as...More",50,October 2021,4.5
JusticeJoyce,Expat's 1st Impression,"Impressed with the offering, but not the lack of replinishing. 

August 2021 - I learned they offer AYCE brunch and it includes a drink option so I opted in. 

As a non drinker and first time drinker - this is a smart place to start...More",45,August 2021,4.5
Z4716XFcynthias,Service is second to none,"Hi JusticeJoyce,   

Thank you so much for taking the time out to share your feedback with us. We are glad you enjoyed your overall experience and we look forward to welcoming you back in the near future. We appreciate your valuable feedback and have shared...More",45,October 2021,4.5
495tundet,Shiro offers value for your money,"My friends and I wanted to spend sometime since it was a public holiday, then my bestie suggested Shiro restaurant. 
The staffs in that restaurant are one of a kind, I’ll say they are well trained. Their menu knowledge is superb.
Even the food I...More",45,September 2021,4.5
austind513,Awesome place,"Hi Z4716XFcynthias,   

Thank you so much for taking the time out to share your feedback with us. We are glad you enjoyed your overall experience and we look forward to welcoming you back in the near future. We appreciate your valuable feedback and have shared...More",40,September 2021,4.5
Sundaysetty,Favourite,"Some of my friends already visited some restaurants to taste their food and drinks, but the moment we visited shiro for a gets together. I can proudly say Shiro is far ahead of so many bar and restaurants out there.
Every of the drinks we...More",40,September 2021,4.5
Pierreech,Top Notch,"Hi 495tundet,   

Thank you so much for taking the time out to share your feedback with us. We are glad you enjoyed your overall experience and we look forward to welcoming you back in the near future. We appreciate your valuable feedback and have shared...More",50,February 2021,4.5
David M,Overrated,"I will give this restaurant more than five stars. They are just superb in everything.
Their food is out of this world. I tried the Katsu Chicken Gua Bao which was very nice. Even their sushi, appetisers etc.

Their staff were customer friendly with good...More",50,August 2021,4.5
Zealstill,Incredible,"Hi austind513,   

Thank you so much for taking the time out to share your feedback with us. We are glad you enjoyed your overall experience and we look forward to welcoming you back in the near future. We appreciate your valuable feedback and have shared...More",50,August 2021,4.5
84mathewd,Nothing tastes better,"This place is always my favourite place to have dinner.
Amazing staff, service is one of the reason why I'm always here. 
Thank you for the hospitality.More",50,August 2021,4.5
uwuigbusun,Bad smoke extractor,"HiSundaysetty,   

Thank you so much for taking the time out to share your feedback with us. We are glad you enjoyed your overall experience and we look forward to welcoming you back in the near future. We appreciate your valuable feedback and have shared the...More",40,June 2021,4.5
752maryannk,Best experience.,"Visited Shiro with friends for the first time and had a delightful evening. Sat within the indoor area for lunch and it was an amazing experience.

The decor,ambience and layout of the indoor area was welcoming and cozy, instagrammable as they say. The service and...More",20,June 2021,4.5
Dhiren P,Unlimited Sushi and Dimsum,"Hi Pierreech,   

Thank you so much for taking the time out to share your feedback with us. We are glad you enjoyed your overall experience and we look forward to welcoming you back in the near future. We appreciate your valuable feedback and have shared...More",50,June 2021,4.5
Ayokunle07,Satisfactory experience,"I’ve eaten at Shiro many times, but sadly their standards are in general decline. The service is inconsistent and orders are not correctly taken.

It used to be nice to sit outside and eat, but the resident Shiro DJ turns his music up to compete...More",50,May 2021,4.5
themsot,Good experience,"Hi  David M,   

We are sad to hear about your recent visit and feedback on the food which I will take back to our chef, if you could reach out to us and share the dishes you had and found inconsistent we would be in...More",10,May 2021,4.5
sorinchanh,Good service,I was at Shiro Lagos with my wife for an absolutely delicious meal. We are in the bar area which initially I had reservations about but soon realises it wasn’t an issue as we enjoyed having a great meal by the Bar with some of...More,50,May 2021,4.5
nanshims,Birthday,"Good vibes..!! Excellent services..
Good food..😋😋😋
Awesome crowd..
Will love to visit again with family..",45,May 2021,4.5
Prettyhoram,Lunch deal.,"Hi nanshims,   

Thank you for taking the time out to share your feedback with us, we are glad you enjoyed your overall experience and we look forward to welcoming you back in the near future.   

Warm Regards,  
Shiro Management",45,May 2021,4.5
Solan h,Best place,"Best lunch,Sushi Dimsum with sangria. Had a best lunch after so long. Superb ambience and very good service.",45,May 2021,4.5
PiOkafor,WARNING when visiting this lovely restaurant,"Hi Prettyhoram,   

Thank you for taking the time out to share your feedback with us, we are glad you enjoyed your overall experience and we look forward to welcoming you back in the near future.   

Warm Regards,  
Shiro Management",40,March 2021,4.5
Yyassssss,Awesome place,"Best place to hangout with friends and family.
The food was really good and so the service .
One of the best experience so far in Lagos.
Thank you Shiro for the great experience.",50,May 2021,4.5
itsmoniquetraveller,Worth visiting Shiro with my friends on Brunch.,"Hi Solan h,   

Thank you for taking the time out to share your feedback with us, we are glad you enjoyed your overall experience and we look forward to welcoming you back in the near future.   

Warm Regards,  
Shiro Management",50,April 2021,4.5
Diliptamang,Nice service,"On Friday the 5th of March 2021, some friends and I went to Shiro Lagos Restaurant at Landmark Centre Oniru for dinner. We went in four cars. For the benefit of those that do not know Landmark Centre, Landmark is a high end establishment that...More",50,April 2021,4.5
Edemdavid,Amazing staff,"HiPiOkafor,    

Thank you for taking the time out to share your feedback with us, we are glad you enjoyed your overall experience and we look forward to welcoming you back in the near future.   

Please note we have escalated and assisted as best we can...More",40,March 2021,4.5
y0dinb,Fantastic place,"Had a wonderful experience...With everything from food to comfort of place and the service I received,.I would highly recommend😊",50,March 2021,4.5
Raymondmond,Fall in Love with this place,"Hi Yyassssss,   

Thank you for taking the time out to share your feedback with us, we are glad you enjoyed your overall experience and we look forward to welcoming you back in the near future.   

Warm Regards,  
Shiro Management",50,March 2021,4.5
Nelsontomdri,Shiro restored my love life.,"The place is huge and so beautiful. Great Sunday brunch with all you can eat food and drinks. This is my third time visit to Shiro and it has always been implacable. 
The food and place is something one should experience.

Big shout out to...More",50,February 2021,4.5
Solankiiii,Awesome experience,"Hi itsmoniquetraveller,   

Thank you for taking the time out to share your feedback with us, we are glad you enjoyed your overall experience and we look forward to welcoming you back in the near future.  

 Warm Regards,  
Shiro Management",50,February 2021,4.5
Talat20202,Awesome Goodies,"Very nice restaurant with a good service! It was great food variations,  sushi,sashimi, teppanyaki,dimsums .
Superb service, good food.
Thank  you Shiro for the great experience.",50,January 2021,4.5
Okaforanthonyf,Great visit,"Hi Diliptamang,   

Thank you for taking the time out to share your feedback with us, we are glad you enjoyed your overall experience and we look forward to welcoming you back in the near future.   

Warm Regards,  
Shiro Management",50,January 2021,4.5
Enohse,Best place,"The place is very nice and clean. The ambience is excellent. Great staff, the staff behavior is really good. They have an amazing staff.
The food is really good yet to explore the rest of the food.
I will be back soon with my friends.",50,December 2020,4.5
Onogwu,The best!,"Extremely polite, courteous and we'll rounded professional. One of the most professional friendly restaurant I had been. Have been gone the extra mile to make sure all our request were met with our expectation.
Highly recommended! Everything is nice and clean.More",45,December 2020,4.5
Oyikan,Superb,"Hi,

Thank you for taking the time out to share your feedback with us. We are glad you enjoyed your overall experience and we look forward to welcoming you back in the near future. We appreciate your valuable feedback and have shared the same with...More",45,December 2020,4.5
Tony009977,Stunning ambience.,"The ambience here was super cool and welcoming. Excellent service , refreshing cocktails, amazing food. One of the best pan Asian restaurant in Lagos.
Overall a really nice experience.More",45,November 2020,4.5
AKUBUIRO,Best Experience!,"Hi,

Thank you for taking the time out to share your feedback with us. We are glad you enjoyed your overall experience and we look forward to welcoming you back in the near future. We appreciate your valuable feedback and have shared the same with...More",40,November 2020,4.5
Emmanull,Cocktail,"Great ambience, lovely staff. The food here is to die for. Its my first time seeing such a beautiful place. Service is quite fast. The food was just next level.
One of my favourite place in Lagos definitely.More",50,November 2020,4.5
Aishaamoha,Good experience,"Hi,

Thank you for taking the time out to share your feedback with us. We are glad you enjoyed your overall experience and we look forward to welcoming you back in the near future. We appreciate your valuable feedback and have shared the same with...More",50,November 2020,4.5
hannah_dee10,Shiro,"Best restuarant in Nigeria. Everything was perfect. reception was great,the waiters are the most polite i have seen in lagos, and the Sushi! ouhhh it was AMAZING. Beautiful and classy restuarant. Y'all need to visit here.Trust meMore",50,November 2020,4.5
Eemmanuell,Great experience.,"Hi,

Thank you for taking the time out to share your feedback with us. We are glad you enjoyed your overall experience and we look forward to welcoming you back in the near future. We appreciate your valuable feedback and have shared the same with...More",50,October 2020,4.5
Johnustin,Love about everything.,"The best cocktail restaurant in lagos.loved it.
Visited alone for dinner ,this is my 3 times never disappointed.More",50,October 2020,4.5
Departure34404175436,Worth the time and ambience.,"Hi,

Thank you for taking the time out to share your feedback with us. We are glad you enjoyed your overall experience and we look forward to welcoming you back in the near future. We appreciate your valuable feedback and have shared the same with...More",50,October 2020,4.5
195salius,Perfect place.,Went there for my birthday and it was awesome starting from ambience to till service was just awesome. It was one of the best experience. Love to be back soon.More,50,September 2020,4.5
ogbonnak2020,*Ambience*,"Hi,

Thank you for taking the time out to share your feedback with us. We are glad you enjoyed your overall experience and we look forward to welcoming you back in the near future. We appreciate your valuable feedback and have shared the same with...More",50,September 2020,4.5
Felixx1988,Miss the Sunday Brunch.,"Dope restaurant, nice ambiance. Good customer service. The waiter was polite and nice. The sushi was amazingMore",50,September 2020,4.5
Larrymannn,Best place for date.,"Hi,

Thank you for taking the time out to share your feedback with us. We are glad you enjoyed your overall experience and we look forward to welcoming you back in the near future. We appreciate your valuable feedback and have shared the same with...More",50,September 2020,4.5
392unnik,amazing experience,"Staff are great. All the staff are kind and ready to satisfy the request.
They know how to provide excellent service.
Highly recommend SHIRO for their 
spectacular ambience and their refreshing  cocktail.
It's really a must to try to dine in here and you won't...More",50,September 2020,4.5
Zealstill,Wonderful experience.,"This is our 2nd visit to Shiro. Never disappointed choosing Shiro for special occasions. Always had a good experience from service to till food.Will be back again soon.
Thank you Shiro for your hospitality.More",45,September 2020,4.5
Kevin L,Quick sushi stop!,"Hi ,

Thank you for taking the time out to share your feedback with us. We are glad you enjoyed your overall experience and we look forward to welcoming you back in the near future. We appreciate your valuable feedback and have shared the same...More",45,September 2020,4.5
Clarase1989,One of the best places in Lagos.,"I was craving some sushi today and decided to stop by Shiro for some quick sushi. I ordered the Chicken Suya Maki and Dyna Maki. Both were super delicious and tasty. If you like spicy food, I definitely recommend trying out the suya maki options.More",45,September 2020,4.5
eCeasar,Amazing restaurant,"Hi ,

Thank you for taking the time out to share your feedback with us. We are glad you enjoyed your overall experience and we look forward to welcoming you back in the near future. We appreciate your valuable feedback and have shared the same...More",40,September 2020,4.5
Georgesunday,🤩🤩,"Amazing place,breathtaking decor,polite staff and mouth watering Pan Asian dishes. This place simply covers it all, be it a quiet family dinner or special celebrations.More",50,August 2020,4.5
mayw943,We loved our first time here,"Hi ,

Thank you for taking the time out to share your feedback with us. We are glad you enjoyed your overall experience and we look forward to welcoming you back in the near future. We appreciate your valuable feedback and have shared the same...More",50,January 2020,4.5
nwaelij,Amazing,"From the look of things, this is an amazing restaurant I mean world class, the sushi there is fantastic absolutely delicious 😋More",50,March 2020,4.5
Amittim,Best ambience.,"Hi ,

Thank you for taking the time out to share your feedback with us. We are glad you enjoyed your overall experience and we look forward to welcoming you back in the near future. We appreciate your valuable feedback and have shared the same...More",50,March 2020,4.5
Sorinchan,Great lunch to remember.,"Visited shiro after many months of the lockdown, indeed I've missed this world-class delicacies. Shiro has never disappointed me. 
Shiro,has been my second home...
It's Shiro or nothing for me.More",50,March 2020,4.5
Anthonyadolf,Wow experience.,"Hi George Sunday,

Thank you for taking the time out to share your feedback with us. We are glad you enjoyed your overall experience and we look forward to welcoming you back in the near future. We appreciate your valuable feedback and have shared the...More",40,March 2020,4.5
olugbengahos,Coolest spot,"We got to try the delicacies for the first time,  we were expecting so much, our expectations weren't cut short.  Worth our moneyMore",40,December 2019,4.5
kikiroli,Yummy meals,"Hi,

Thank you for taking the time out to share your feedback with us. We are glad you enjoyed your overall experience and we look forward to welcoming you back in the near future. We appreciate your valuable feedback and have shared the same with...More",50,November 2019,4.5
ChikaLadybug,One of the best restaurants in Lagos!!,"The service was absolutely amazing, so welcoming with that homely atmosphere.

My friends took me there & they made me try the shrimps.

It was really good!More",50,March 2020,4.5
Rasopam,Great Service.,"Hi,

Thank you for taking the time out to share your feedback with us. We are glad you enjoyed your overall experience and we look forward to welcoming you back in the near future. We appreciate your valuable feedback and have shared the same with...More",50,February 2020,4.5
PreetyHoram,Worth it!,"One of the best ambience in Lagos. 
Great service and the food is awesome. Specially the outside view is amazing . Will definitely be back again.More",40,February 2020,4.5
Semmihoram,Fabulous!!,"The decor is the first thing that strikes you here. The high ceiling is mesmerising.
Excellent ambience with good food and beautiful outdoor patio to enjoy a great meal and cocktails.More",45,February 2020,4.5
Tourer_S1987,Favourite place.,"Hi,

Thank you for taking the time out to share your feedback with us. We are glad you enjoyed your overall experience and we look forward to welcoming you back in the near future. We appreciate your valuable feedback and have shared the same with...More",45,February 2020,4.5
7669Christopher,Amazing cocktail.,"Had a quick lunch here.Amazing place, attentive staff, beautiful view and superb vibe and music.All the time favourite place.More",45,January 2020,4.5
iamzy_gote,That's weird,"Hi,

Thank you for taking the time out to share your feedback with us. We are glad you enjoyed your overall experience and we look forward to welcoming you back in the near future. We appreciate your valuable feedback and have shared the same with...More",40,February 2020,4.5
EEzikiel,Most happening place in Lagos.,One of the best cocktail I had tried in Lagos. Must try their secret garden it was so refreshing and the best cocktail. Also the ambience ad the food is great.More,50,January 2020,4.5
448candices,Asian Fusion,"Hi,

Thank you for taking the time out to share your feedback with us. We are glad you enjoyed your overall experience and we look forward to welcoming you back in the near future. We appreciate your valuable feedback and have shared the same with...More",50,September 2019,4.5
333Yetunde,Amazing place,"I love to travel to all Europe countries, because they are awesome and I love some Africans also ....More",50,January 2020,4.5
Mercyshi,Tasty Asian food.,"Hi,  

Thank you for taking the time out to share your feedback with us. We are glad you enjoyed your overall experience and we look forward to welcoming you back in the near future. We appreciate your valuable feedback and have shared the same with...More",50,January 2020,4.5
Hazel6sh,Enjoyed the Sunday brunch!,"Great experience! Ambience and the food live up to the expectations.
Every dish was beautifully presented and deliciously divine. Experience such value for money.More",50,January 2020,4.5
Clarase1989,Perfect date.,"Hi,

Thank you for taking the time out to share your feedback with us. We are glad you enjoyed your overall experience and we look forward to welcoming you back in the near future. We appreciate your valuable feedback and have shared the same with...More",40,January 2020,4.5
Francischi1998,Awesome place.,"Quite pricey, beautiful decor. Not quite Asian food, Asian with a Nigeria twist. Worth a try when you’re in the city.More",50,January 2020,4.5
Tolulope F,Service was slow,"Hi,   

Thank you for taking the time out to share your feedback with us. We are glad you enjoyed your overall experience, We appreciate your valuable feedback and have shared the same with our team, we look forward to welcoming you back in the near...More",50,January 2020,4.5
Abraham113,Perfect!,"Amazing place to chill with friends. With lip smacking sushi. Worth visiting for their marvelous food ,service and atmosphere.More",50,January 2020,4.5
Wole O,Shiro is ok...,"Hi,   

Thank you for taking the time out to share your feedback with us. We are glad you enjoyed your overall experience, We appreciate your valuable feedback and have shared the same with our team, we look forward to welcoming you back in the near...More",50,December 2019,4.5
tolui397,Good meal,"Every time we came to shiro we always had a good experience. Its a beautiful place for sea food lovers.
Delicious food and a really nice place.More",50,December 2019,4.5
ramh2014,First visit,"Invited by a friend. The ambience and service was fantastic. Could not believe we were dining in Lagos. Food was very good and presentation excellent. They have a chinese and Japanese section
 We dined at the chinese table. Surely worth coming back.More",45,October 2019,4.5
Deniellmrk,Amazing ambience,"Hi ,  

Thank you for taking the time out to share your feedback with us. We are glad you enjoyed your overall experience , We appreciate your valuable feedback and have shared the same with our team , we look forward to welcoming you back...More",45,December 2019,4.5
Ceciliaakaa,Cool place.,"I loved being within shiro, the ambience is gorgeous and the food was a delight.
Also an excellent choice for team gathering. Nice place to spend time with friends.Must try their Sunday brunch. Was there last Sunday, very good varieties of food and cocktails.
Can't...More",45,December 2019,4.5
Go57154077292,Luxurious Restaurant,"Hi ,  

Thank you for taking the time out to share your feedback with us. We are glad you enjoyed your overall experience , We appreciate your valuable feedback and have shared the same with our team , we look forward to welcoming you back...More",40,December 2019,4.5
AuldSoul,The best place by far in Lagos!,"Cool place to chill. Excellent personalized service. Great food and cocktails.
Brelliant setup and energy.
A must visit for everyone interested in Asian food and beverages.More",40,December 2019,4.5
Thomaskunle,Best place .,"Hi ,

Thank you for taking the time out to share your feedback with us. We are glad you enjoyed your overall experience , We appreciate your valuable feedback and have shared the same with our team , we look forward to welcoming you back...More",50,December 2019,4.5
Matthew8991,Good restaurant.,"Beautiful classy ambience. Great service. Great place to enjoy music dance and drinks.
Definitely be back soon .More",50,December 2019,4.5
ratokhana,All time favourite place.,"Hi ,

Thank you for taking the time out to share your feedback with us. We are glad you enjoyed your overall experience , We appreciate your valuable feedback and have shared the same with our team , we look forward to welcoming you back...More",50,November 2019,4.5
Jeremiahtu,Fabulous!,It is the best place in Lagos for Japanese food. The other is bonsai but I like this because of the ambience and the outdoor sitting which gets better by the evening. The place is absolutely of international standard.More,50,November 2019,4.5
JaySethia,"wonderful decor, great food, one of the best restaurant in Lagos currently.","Hi ,   

Thank you for taking the time out to share your feedback with us. We are glad you enjoyed your overall experience , We appreciate your valuable feedback and have shared the same with our team , we look forward to welcoming you back...More",50,November 2019,4.5
Osman T,"Great food, great decor","Best place for brunch' date night or just to hangout with friends. 
Loved just the way it looks and service is great. 
Shiro is love.❤❤More",50,February 2019,4.5
FrankKs1981,A lunch to remember.,"Hi ,   

Thank you for taking the time out to share your feedback with us. We are glad you enjoyed your overall experience , We appreciate your valuable feedback and have shared the same with our team , we look forward to welcoming you back...More",50,November 2019,4.5
