author_name,review_title,review_text,author_rating,visit_date,overall_rating,restaurant_name
Kofon-Ekanem,Perfecto!,"Hi Joan,   

Thank you for visiting Shiro Lagos and for taking the time to write about your recent experience with us. We hope you enjoyed your overall experience. We look forward to serving you again, soon.

In regards to the $ 1400 we have a...More",40,Nov-18,4.5,Shiro Restaurant
Compass49335136022,Best restaurant,"One of the best restaurant in lagos. I was there with my friends yesterday and we enjoyed about the service,the food and the ambience.  The staff were very courteous, polite. And the place are amazing.More",50,Oct-18,4.5,Shiro Restaurant
GrandTour592220,"Great food, great decor and great ambiance","Hi Ramchanphy S,   

Thank you for visiting Shiro Lagos and for taking the time to write about your recent experience with us. We hope you enjoyed your overall experience. We look forward to serving you again, soon and will pass on your compliments to Sarika...More",40,Mar-18,4.5,Shiro Restaurant
kolade o,Food and service,"Food, ambience, view, people, workers, customer satisfaction are all top notch. Yes, pricey but lovely all the way. Great place for birthdays also...I've seen cakes and cakes. Lovely decor also.More",50,Oct-18,4.5,Shiro Restaurant
Suresh C,Family dinner,"Hi Kofon,   

Thank you for visiting Shiro Lagos and for taking the time to write about your recent experience with us. We hope you enjoyed your overall experience. We look forward to serving you again, soon and will pass on your compliments to Sarika  Let...More",50,Oct-18,4.5,Shiro Restaurant
opusjao,Amazing Brunch,Fancy restaurant with amazing beach view.food is nice and we service very friendly.Thank you for the lovely arrangement Sarika.More,50,Oct-18,4.5,Shiro Restaurant
fwonyenwe12,My favourite restaurant,"Hi Compas,   

Thank you for visiting Shiro Lagos and for taking the time to write about your recent experience with us. We hope you enjoyed your overall experience. We look forward to serving you again, soon and will pass on your compliments to Sarika

Let...More",50,Oct-18,4.5,Shiro Restaurant
obotgodslove01,Live cooking,apparently it is the same owner than hard rock cafe. i can say our experience was great on all levels. the decor is awesome! the service very professional. the terrasse very nicely done. and on the food side we did not go wrong on any...More,50,Oct-18,4.5,Shiro Restaurant
SmallBizLady,Great food great fun,"Hi Grand Tour,   

Thank you for visiting Shiro Lagos and for taking the time to write about your recent experience with us. We hope you enjoyed your overall experience.  We look forward to serving you again, soon. 

Let us know if we can recommend any...More",50,Sep-18,4.5,Shiro Restaurant
351nealea,Great,"It’s a really nice place. Good ambience, amazing music, customer service and really good food. You should actually check it out if you are ever in Lagos.More",50,Oct-18,4.5,Shiro Restaurant
301nealea,Great,"Hi Kolade,   

Thank you for visiting Shiro Lagos and for taking the time to write about your recent experience with us. We hope you enjoyed your overall experience.   

We look forward to serving you again, soon. Let us know if we can recommend any items...More",50,Oct-18,4.5,Shiro Restaurant
johne999a,First time as couple,"I was in Shiro with my family last week for diner. Excellent food, very courteous wait staff and an elegant decor that amazed each one of us, felt like we were in another corner of the globe!More",50,Sep-18,4.5,Shiro Restaurant
nikkybash1,Hangout,Shiro Lagos is a wonderful Japanese restaurant in Lagos Nigeria to explore..have a taste of it's such rollsMore,45,Sep-18,4.5,Shiro Restaurant
OmoJege,Hip venue for getting together with friends,"Hi Nikky, 

Thank you for visiting Shiro Lagos and for taking the time to write about your recent experience with us. We’re delighted to know that we were able to offer a pleasant experience. We look forward to serving you again, soon. 

Let us know...More",45,May-18,4.5,Shiro Restaurant
Nathaniel A,Great Ambiance,"Great cocktails and dumplings but not cheap. Very helpful, knowledgeable staff that do their best to ensure you’re comfortable.More",45,Sep-18,4.5,Shiro Restaurant
Matthew O,Good Remark,"Hi OmoJege

Thank you for visiting Shiro Lagos and for taking the time to write about your recent experience with us. We’re delighted to know that we were able to offer a pleasant experience. We look forward to serving you again, soon. Let us know...More",40,Oct-18,4.5,Shiro Restaurant
Raw S,I like the cocktail 🍹 Everything here was very okay i really love there things here ❤️,My friends and I came during Friday happy hour. It was a good experience. You'll enjoy your time here. I particularly like atmosphere.,50,Oct-18,4.5,Shiro Restaurant
NonemekCreativity,Shiro is a wonder - Japanese world of Good food,"Hi GokeNathaniel,

Thank you for visiting us and taking the time to share your feedback with us. We are glad you enjoyed your overall experience and we look forward to welcoming you back in the near future. 

Warm Regards, 
Shiro Managment",40,Sep-18,4.5,Shiro Restaurant
vasug35,Nice Veg Maaki rolls and Crackling prawns!,"Shiro is a nice and serene place to be, it calms you and makes you forget the stress of Lagos,its buzz and all, what I love most is the food, simply awesome .More",50,Oct-18,4.5,Shiro Restaurant
afolabi o,SNF party,"Hello Matthew O,

We're always here to offer you the best experience. Definitely a place to relax, enjoy and have a great time. Thank you for taking the time to share your valuable feedback with us.

We look forward to serving you again soon.

Warm...More",40,Sep-18,4.5,Shiro Restaurant
Miggro,Escape from Lagos,"I came with my friends and it’s very cool we really had fun. Great ambience, service is nice. Food is already great...........................",50,Sep-18,4.5,Shiro Restaurant
Aziz K,One of the best!!,"Hi Raw S, 

Thank you for dining with us! We look forward to welcoming you back again soon.

We appreciate your valuable feedback and have shared the same with our team. 

Warm Regards, 
Shiro Management",40,Sep-18,4.5,Shiro Restaurant
Roger S,Fantastic Sarika @ Shiro,"I like it out there! Pan-Asian restaurant sited at Landmark Centre, V.I, Lagos. It offers Japanese, Korean, Thai, Mediterranean cuisines. Great bar and lounging experience with beautiful ambience, sweet for late night dining. Shiro has an outdoor dining and is known for its ocean view....More",50,Sep-18,4.5,Shiro Restaurant
Christian A,Good food and service,"Hi Nonemek,   

We hope you had an amazing first visit! Thank you for taking the time out to share your feedback with us. We are glad you enjoyed your overall experience and we look forward to welcoming you back in the near future.   

We appreciate...More",40,Sep-18,4.5,Shiro Restaurant
brianspiller2018,My first visit at Shiro Lagos 😁,"Nice Veg Maaki rolls and Crackling prawns! Ambience is good and it’s spacious with high ceiling 

Undoubtedly one of the best places to visit in LagosMore",50,Sep-18,4.5,Shiro Restaurant
Ade703,Love it,"Hi Vasug,   

We hope you had an amazing first visit! Thank you for taking the time out to share your feedback with us. We are glad you enjoyed your overall experience and we look forward to welcoming you back in the near future.   

We appreciate...More",50,Dec-17,4.5,Shiro Restaurant
Freja A,Never amazed,Nice ambience. Very large and accomodated at least 350 persons  easily. Food and drinks was also on point and the dj played all the popular tunes we wanted to hear.More,50,Sep-18,4.5,Shiro Restaurant
Sam E,5 Star Dining In Ocean Front,"By margins, the most exotic place to dine in the Islands. Ambience was spectacular, staff was very cordial. Most importantly, the food was not only finger licking delicious, it came on time!!! Be prepared to pay for it though. I’m coming back for sure.More",45,Sep-18,4.5,Shiro Restaurant
sureshp99,Relaxing atmosphere and great service,"Hi Sam E,

We hope you enjoyed your finger licking delicious food.  Thank you for taking the time to share your feedback with us. We are glad you enjoyed your overall experience and we look forward to welcoming you back in the near future. 

Warm...More",45,Sep-18,4.5,Shiro Restaurant
325sivap,Best Restaurant in lagos,Shiro is nice Cosy place with wow ambience. I always love to sit outside and have my lunch viewing the sea. Its just a wow feelingMore,45,Sep-18,4.5,Shiro Restaurant
Traveler A,Great food and ambience,"Hi Suresh,  

Thank you for taking the time out to share your feedback with us. We are glad you enjoyed your overall experience and we look forward to welcoming you back in the near future. 

We appreciate your valuable feedback and have shared the same...More",40,Sep-18,4.5,Shiro Restaurant
derrickj0nes,Most outstanding service,"Shiro is always my favourite place to be, Good food/great service and relaxing atmosphere. Staff's are very friendly.large selection of pan Asian food.More",50,Sep-18,4.5,Shiro Restaurant
marioluigip2017,business lunch,"Hi Siva,  

Thank you for taking the time out to share your feedback with us. We are glad you enjoyed your overall experience and we look forward to welcoming you back in the near future. 

We appreciate your valuable feedback and have shared the same...More",50,Jul-18,4.5,Shiro Restaurant
ruth b,Best beach view restaurant,Amazing ambience once you enter and great food quiet good varieties of vegetarian and non vegetarian options and best cocktail good to relax on Friday night music brings back old times. Overall excellent food and service.More,50,Sep-18,4.5,Shiro Restaurant
Okaforanthonyf,Wow Wednesday night,"Hi Traveler A,

Thank you for taking the time out to share your feedback with us. We are glad you enjoyed your overall experience and we look forward to welcoming you back in the near future. We appreciate your valuable feedback and have shared the...More",50,Sep-18,4.5,Shiro Restaurant
Ishan I,Good food,Its a thing of great joy to witness a restaurant with these calibre of A-list service here in Nigeria. I enjoyed the lamb chops and the salmon fish. I will always recommend Shiro to anyone anytime. Thank you Shiro.More,50,Sep-18,4.5,Shiro Restaurant
maurodedios601,Mr.mao,"Hi Derrickj0nes, 

We are pleased to hear about your recent experience at Shiro. Thank you for visiting and taking the time to share your experience. We look forward to welcoming you back again soon.

We look forward to serving you again, soon. 

Warm Regards! 
Shiro...More",40,Sep-18,4.5,Shiro Restaurant
nwakaegou2018,Awesome panasian Cuisine,"This is one of the best place in Lagos. It has a beautiful sea view and wide space inside and outside
Staff is really professional.
Menù is mainly japanese and chinese.",50,Sep-18,4.5,Shiro Restaurant
Adaezeu7,Fantastic sushi masterclass!,"Hi Mario Luigi P, 

Thank you for visiting and taking the time to share your experience. Check out our special 'Let's Lunch' lunch menu next time!

We look forward to welcoming you back again soon.

Warm Regards! 
Shiro Management",50,Sep-18,4.5,Shiro Restaurant
Ade2566,Just OK.. But you Pay High,Good food/best service with wow ambience. I heard a lot about Shiro and it doesn’t disappoint my expectations. U can enjoy your meal sitting outside viewing sea as well.More,40,Aug-18,4.5,Shiro Restaurant
Tobi A,Best dinner night ever,"Hi Anthony,   

We love having you back each time! Shiro is definitely a place for all occasions. Thank you for visiting Shiro Lagos and for taking the time to write about your recent experience with us.   We’re delighted to know that we were able to...More",50,Sep-18,4.5,Shiro Restaurant
1girl_1passport,Favourite restaurant in Lagos!,"I called Shiro line for the enquiries, it was on Wednesday luckily the lady on the phone  told me that they are having ladies night every Wednesday's.where we can get another drinks for free if we buy one so i decided to book the table...More",50,Sep-18,4.5,Shiro Restaurant
415victoryj,Good environment,Nice food and quiet environment. One of my favorite on the island. Thanks for the services. I recommend shiro to everyone out there.More,45,Sep-18,4.5,Shiro Restaurant
segunopeke,Nice treat,"Hi Victory,   

Thank you for visiting Shiro Lagos and for taking the time to write about your recent experience with us. We’re delighted to know that we were able to offer a pleasant experience. We look forward to serving you again, soon.   

Warm Regards!  
Shiro...More",45,Jul-18,4.5,Shiro Restaurant
Zinny's C,Shiro review,Food is good. Ambience is fantastic service is quite nice and efficient. Staff appear well trained and friendly.More,45,Sep-18,4.5,Shiro Restaurant
Onos Moses A,Tasty Asian food,"Hi Segun,   

Thank you for visiting Shiro Lagos and for taking the time to write about your recent experience with us. We’re delighted to know that we were able to offer a pleasant experience. We look forward to serving you again, soon.   

Warm Regards!  
Shiro...More",40,Aug-18,4.5,Shiro Restaurant
detolalaw22,"Quality service, nice ambiance","Great taste of food, lovely ambiance to feel yourself.  But food not soo much in quantity so go preparedMore",50,Aug-18,4.5,Shiro Restaurant
Omelebele N,nice china  or japanis resturant,"Hi Zinny,   

Thank you for visiting Shiro Lagos and for taking the time to write about your recent experience with us. We’re delighted to know that we were able to offer a pleasant experience. We look forward to serving you again, soon.   

Warm Regards!  
Shiro...More",40,Jun-18,4.5,Shiro Restaurant
Kayode O,Amazing place to relax and great service,One of my Friend brought me here.in my first time visit I was amazed by the ambiance. They have got nice outdoor sitting as well with sea view. Food and service was great.nice meeting beautiful Lady sarika from Nepal.will comeback againMore,50,Aug-18,4.5,Shiro Restaurant
839fatimau,Great Ambiance! Great Food!,"Hi Moses,   

Thank you for visiting Shiro Lagos and for taking the time to write about your recent experience with us. We’re delighted to know that we were able to offer a pleasant experience. We look forward to serving you again, soon.   

Warm Regards!  
Shiro...More",50,Jun-18,4.5,Shiro Restaurant
OpeyemiAO,"AH-MAZING food, good service & good ambience",Amazing service. I had complains about my drink because there was too much ice in it and I got another one complimentary on the house. The food was great as well.More,50,Feb-18,4.5,Shiro Restaurant
Folarin A,Amazing gastronomic experience,"Hi Denola,  

Thank you for visiting Shiro Lagos and for taking the time to write about your recent experience with us. We’re delighted to know that we were able to offer a pleasant experience. We look forward to serving you again, soon.   

Warm Regards!  
Shiro...More",40,Aug-18,4.5,Shiro Restaurant
Renua,Lovely Dim Sum,"if you are in here you wont belive you are in nigeria the art work , the service the enviroment is so asian and real , good food and nice verities to chose fromMore",50,Aug-18,4.5,Shiro Restaurant
jeffobodo2222,Shiro restaurant is superb,"Hi Omelebele,   

Thank you for visiting Shiro Lagos and for taking the time to write about your recent experience with us. We’re delighted to know that we were able to offer a pleasant experience. We look forward to serving you again, soon.   

Warm Regards!  
Shiro...More",50,Aug-18,4.5,Shiro Restaurant
Mohammad R,A wonderful mistake!,I visited the place with my friends and the place was really cool. I had a mehthani chicken recommended by Sarika & i love it.More,40,Aug-18,4.5,Shiro Restaurant
Wole K,Shiro Experience,"Hi Kayode,   

Thank you for visiting Shiro Lagos and for taking the time to write about your recent experience with us. We’re delighted to know that we were able to offer a pleasant experience. We look forward to serving you again, soon.   

Warm Regards!  
Shiro...More",40,Aug-18,4.5,Shiro Restaurant
keitangnao,Best Sushi in town,"The food is always great, music too. Plus the ambiance, I'll definitely visit more whenever I'm in Lagos.More",50,Aug-18,4.5,Shiro Restaurant
stephranson,Fabulous!,"Really delicious food.... great menu with lots of choices, food simply fabulous, attractive restaurant with interesting decor, great ambiance and service . 
Quite expensive but worth it. Ideal for a special occasion, in our opinion it’s one of the best restaurants in Lagos. 
We will...More",45,Aug-18,4.5,Shiro Restaurant
nm57,"Good food but expensive, good for special occasion","Hi Stephranson,   

Thank you for visiting Shiro Lagos and for taking the time to write about your recent experience with us. We’re delighted to know that we were able to offer a pleasant experience. We look forward to serving you again, soon.   

Warm Regards!  
Shiro...More",45,Aug-18,4.5,Shiro Restaurant
Onzagz,Live Tepanyaki,"We had a late lunch, the food was good but expensive. We had Sushi.
The setting of the restaurant is good and the service stands out.More",45,Aug-18,4.5,Shiro Restaurant
Egede D,Exquisite,"Hi NM57,   

Thank you for visiting Shiro Lagos and for taking the time to write about your recent experience with us. We’re delighted to know that we were able to offer a pleasant experience. We look forward to serving you again, soon.   

Warm Regards!  
Shiro...More",40,Jul-18,4.5,Shiro Restaurant
KabirT19,So Delicious ! Friendly Service ~,"Quick summary below of my family visit to Shiro
1. Got a reservation on very short notice; I guess they had to move things around to accommodate us.
2. The live tepanyaki shoe was beautiful and the chef kept my son engaged, entertained and excited...More",50,Jul-18,4.5,Shiro Restaurant
Christian A,Special lunch menu,"Hi Onzagz,  

Thank you for visiting Shiro Lagos and for taking the time to write about your recent experience with us. We’re delighted to know that we were able to offer a pleasant experience. We look forward to serving you again, soon.   

Warm Regards!  
Shiro...More",50,Jul-18,4.5,Shiro Restaurant
Binanjay T,Fantastic place for good time by the Cabana,Very exquisite and unique.. Gives great options for different cozy ambience with great music selection  my meal was soo small thou..More,50,Jul-18,4.5,Shiro Restaurant
Alvin B,Amazing ambiance and great food,"Hi Egede, 

Thank you for visiting Shiro Lagos and for taking the time to write about your recent experience with us. We’re delighted to know that we were able to offer a pleasant experience. We look forward to serving you again, soon.   

Also would like...More",40,Jul-18,4.5,Shiro Restaurant
yeaon l,Best place to celebrate special occasions,"One of the best places I have ever been in Lagos. The ambience, the food and service, all aspects truly satisfies you. Must try their Lamb Chops and spicy prawns(not sure about the name but it was yum and spicy). They have an exclusive dimsum...More",50,Jul-18,4.5,Shiro Restaurant
Christine M,Miss,"Hi Kabir,

Thank you for visiting Shiro Lagos and for taking the time to write about your recent experience with us. We’re delighted to know that we were able to offer a pleasant experience. We look forward to serving you again, soon.   

Warm Regards!  
Shiro...More",50,Jun-18,4.5,Shiro Restaurant
Manisha S,Sushi masterclass,"I and my friends where on vacation during that period I heard about Shiro Lagos so we decided to try out the restaurants special lunch menu 3 and 4 course meals. It was awesome we had soups, salad, main course and desert. I remember the...More",50,Jul-18,4.5,Shiro Restaurant
325sivap,Stunning Ambience,"Hi Christian,   

Thank you for visiting Shiro Lagos and for taking the time to write about your recent experience with us. We’re delighted to know that we were able to offer a pleasant experience. We look forward to serving you again, soon.   

Warm Regards!  
Shiro...More",50,Jul-18,4.5,Shiro Restaurant
nikkybash1,Amazing,"I visit Shiro very often indoor and outdoor sometime for lunch or dinner.

Last Sunday I decided to go to shiro for lunch, when I reach Shiro the manager suggested to go for Cabana by the beach since I'm with kids and family. It was...More",50,Jul-18,4.5,Shiro Restaurant
Nadejda O,Sushi Masterclass,"Hi Binanjay,   

Thank you for visiting Shiro Lagos and for taking the time to write about your recent experience with us. We’re delighted to know that we were able to offer a pleasant experience. We look forward to serving you again, soon.   

Warm Regards!  
Shiro...More",50,Jul-18,4.5,Shiro Restaurant
Sam A,Throwback Thurs,"Shiro is the best place to be on every wednesday as they have special ladies night. Me and my wife had amazing time aslo they offered my wife buy one and get one drink free.

The ambiance was awsome with beach frint view.More",40,Jul-18,4.5,Shiro Restaurant
Ayodeji S,Peach Iced Tea is to Die for,"Went over to Shiro for drinks after work and ordered the peach iced tea. I can say this is one of the best mocktails I've had in Lagos. Very refreshing and tasty. If you're looking for a non-alcoholic drink, I'd definitely recommend this.More",45,Jul-18,4.5,Shiro Restaurant
848riazh,Great Tepanyaki,"Hi Ayodeji,   

Thank you for visiting Shiro Lagos and for taking the time to write about your recent experience with us. We’re delighted to know that we were able to offer a pleasant experience. We look forward to serving you again, soon.   

Warm Regards!  
Shiro...More",45,Jul-18,4.5,Shiro Restaurant
Sajith007,Top Notch,Meet for a business over a Tepanyaki dinner. Was entertaining and delicious. Our chef was experienced and the venue is top class. Great atmosphere inside and outside where we finished the night with desert.More,45,May-18,4.5,Shiro Restaurant
Tito A,One of my best restaurant experiences,"Hi Riazh,   

Thank you for visiting Shiro Lagos and for taking the time to write about your recent experience with us. We’re delighted to know that we were able to offer a pleasant experience. We look forward to serving you again, soon.   

Warm Regards!  
Shiro...More",40,Jul-18,4.5,Shiro Restaurant
suman d,Excellent Service +Amazing dining Experience+Delicious Food,"Great-ambiance,food,staff.....dont miss to try them if you are near here... 

Loved it... 

They have tepanyaki... Love his flair

Loved the taste

Super duperMore",50,Feb-18,4.5,Shiro Restaurant
Emile A,Tapanyaki with Alvin,"Hi Sajith,   

Thank you for visiting Shiro Lagos and for taking the time to write about your recent experience with us. We’re delighted to know that we were able to offer a pleasant experience. We look forward to serving you again, soon.   

Warm Regards!  
Shiro...More",50,Jul-18,4.5,Shiro Restaurant
Adesh D,Been to Shiro Lagos one of the best experience of lifetime,"Spent my birthday.. July 10th at the restaurant, we had some complaints but the Manager and Chef were immediately available to proffer solutions. I will definitely be visiting with family againMore",50,Jul-18,4.5,Shiro Restaurant
Experience806771,Amazing food and ambiance.,"Hi Tito, 

Thank you for visiting Shiro Lagos and for taking the time to write about your recent experience with us. We’re delighted to know that we were able to offer a pleasant experience. We look forward to serving you again, soon. 

Warm Regards! 
Shiro...More",50,Jul-18,4.5,Shiro Restaurant
richard d,Must try place in Lagos,"The meals were meticulously prepared and beautifully presented. 
Service: The service was the very best we had experienced in Lagos. This was our last night in Lagos so we had a lot to compare to. The staffs were attentive Overall: Definitely the best dining experience,...More",50,Jun-18,4.5,Shiro Restaurant
pradeepn405,Our family meet,"Hi Emile,   

Thank you for visiting Shiro Lagos and for taking the time to write about your recent experience with us. We’re delighted to know that you enjoyed your time with us. We look forward to serving you again, soon.   

Warm Regards!  
Shiro Management",40,Jul-18,4.5,Shiro Restaurant
vivekp944,Not to be missed !,"Shiro is one of the best restaurants in Lagos. The music, Decor, service and the food are excellent. The Tapanyaki is excellent and Chef Alvin is amazing.",50,Jul-18,4.5,Shiro Restaurant
barkha2013,Barkha,"Hi Emile,   

Thank you for visiting Shiro Lagos and for taking the time to write about your recent experience with us. We’re delighted to know that you enjoyed your time with us. We look forward to serving you again, soon.  

Warm Regards!  
Shiro Management",50,Jul-18,4.5,Shiro Restaurant
Deepali P,Amazing food & ambience,If you are looking forward to have great dining experience with some authentic Thai and Japanese food then Shiro Lagos is the correct pick. I was there with my friends and all of us were really happy after the experience for selecting this restaurant. Loved...More,50,Jul-18,4.5,Shiro Restaurant
kinggbenga1,Cool Wednesday night. Lagos not usually busy till friday,"Hi Adesh,   

Thank you for visiting Shiro Lagos and for taking the time to write about your recent experience with us. We’re delighted to know that you enjoyed your time with us. We look forward to serving you again, soon.  

Warm Regards!  
Shiro Management",50,Jul-18,4.5,Shiro Restaurant
missberry20,Best Place,"Been here with some friends and just loved it, if you want to taste some yummy sushis and Japanese cuisine then this the place for you. A must visit.",50,Jul-18,4.5,Shiro Restaurant
gladdibetso,Excellent for Sunday Sundowners,Great food and well presented. I particularly like the dim sums. The restaurant has beautiful sea views and awesome breeze. The music is always great.,45,Jul-18,4.5,Shiro Restaurant
AOAD,Fantastic experience... just like in nyc or Singapore !!!,"Hi, 

Thank you for visiting Shiro Lagos and for taking the time to write about your recent experience with us. We’re delighted to know that you enjoyed your time with us. We look forward to serving you again, soon. 

Warm Regards! 
Shiro Management",45,Jul-18,4.5,Shiro Restaurant
