author_name,review_title,review_text,author_rating,visit_date,overall_rating,restaurant_name
AuldSoul,The best place by far in Lagos!,"Cool place to chill. Excellent personalized service. Great food and cocktails.
Brelliant setup and energy.
A must visit for everyone interested in Asian food and beverages.More",40,Dec-19,4.5,Shiro Restaurant
Thomaskunle,Best place .,"Hi ,

Thank you for taking the time out to share your feedback with us. We are glad you enjoyed your overall experience , We appreciate your valuable feedback and have shared the same with our team , we look forward to welcoming you back...More",50,Dec-19,4.5,Shiro Restaurant
Matthew8991,Good restaurant.,"Beautiful classy ambience. Great service. Great place to enjoy music dance and drinks.
Definitely be back soon .More",50,Dec-19,4.5,Shiro Restaurant
ratokhana,All time favourite place.,"Hi ,

Thank you for taking the time out to share your feedback with us. We are glad you enjoyed your overall experience , We appreciate your valuable feedback and have shared the same with our team , we look forward to welcoming you back...More",50,Nov-19,4.5,Shiro Restaurant
Jeremiahtu,Fabulous!,It is the best place in Lagos for Japanese food. The other is bonsai but I like this because of the ambience and the outdoor sitting which gets better by the evening. The place is absolutely of international standard.More,50,Nov-19,4.5,Shiro Restaurant
JaySethia,"wonderful decor, great food, one of the best restaurant in Lagos currently.","Hi ,   

Thank you for taking the time out to share your feedback with us. We are glad you enjoyed your overall experience , We appreciate your valuable feedback and have shared the same with our team , we look forward to welcoming you back...More",50,Nov-19,4.5,Shiro Restaurant
Osman T,"Great food, great decor","Best place for brunch' date night or just to hangout with friends. 
Loved just the way it looks and service is great. 
Shiro is love.❤❤More",50,Feb-19,4.5,Shiro Restaurant
FrankKs1981,A lunch to remember.,"Hi ,   

Thank you for taking the time out to share your feedback with us. We are glad you enjoyed your overall experience , We appreciate your valuable feedback and have shared the same with our team , we look forward to welcoming you back...More",50,Nov-19,4.5,Shiro Restaurant
vinayb,Good place,"Gorgeous ambience, love everything we ordered. Good place to experience something different. Best place to chill. One of the best meals I had in quite some time.
The staff is courteous and professional. And also a place for business partners and lover to here to...More",50,Nov-19,4.5,Shiro Restaurant
Dicksonsimon,High end restaurant. One can feel Luxury.,"Hi ,  

Thank you for taking the time out to share your feedback with us. We are glad you enjoyed your overall experience , We appreciate your valuable feedback and have shared the same with our team , we look forward to welcoming you back...More",50,Nov-19,4.5,Shiro Restaurant
Patricia P,Great dining experience,"A nice place to spend time with your friends, family. Good is amazing. Visiting here for almost every month.
Excellent ambiance with great service.More",40,Nov-19,4.5,Shiro Restaurant
Iniobo,Brilliant!,"Lunch with family , colleagues, good food great ambience nice soft music too. Extremely helpful staff.
You have a choice ot Teppanyaki table or the outdoor terrace area where you can raise a toast to fine wine from around the world.
Japanese, Chinese and thai...More",45,Oct-19,4.5,Shiro Restaurant
boyowaf,All time favorite.,"Hi ,

Thank you for taking the time out to share your feedback with us. We are glad you enjoyed your overall experience and we look forward to welcoming you back in the near future. We appreciate your valuable feedback and have shared the same...More",45,Oct-19,4.5,Shiro Restaurant
NGACHANPHY,Awesome place,"Well, the restaurant itself is great.
Food -,well ,they can't afford to go wrong with sushi 🍣 and they didn't. Good ambience and polite staff , service neat and clean . Would love to visit again and again. This is our 3 visit to shiro....More",45,Sep-19,4.5,Shiro Restaurant
bluelatte0801,Best in food and servicing,"Hi boyowaf,  

Thank you for taking the time out to share your feedback with us. We are glad you enjoyed your overall experience and we look forward to welcoming you back in the near future. We appreciate your valuable feedback and have shared the same...More",40,Oct-19,4.5,Shiro Restaurant
davidlollipop,One of the finest restaurant.,"Awesome place, really wonderful to spend good time in a good ambience. Amazing food and service.Will definitely be back again!!! Keep up the good work👍🏼.More",50,Oct-19,4.5,Shiro Restaurant
Emanuell13,Great restaurant,"Hi Ngachanphy,

Thank you for taking the time out to share your feedback with us. We are glad you enjoyed your overall experience and we look forward to welcoming you back in the near future. We appreciate your valuable feedback and have shared the same...More",50,Oct-19,4.5,Shiro Restaurant
Bidemi1,Good hospitality,"Good ambience, good food specially the sushi plus the service. The staffs are very helpful in recommending new food items who is trying it for the first timeMore",50,Oct-19,4.5,Shiro Restaurant
Solomon1992,A great restaurant,"Hi bluelatte0801,  

Thank you for taking the time out to share your feedback with us. We are glad you enjoyed your overall experience and we look forward to welcoming you back in the near future. We appreciate your valuable feedback and have shared the same...More",50,Oct-19,4.5,Shiro Restaurant
susannew689,Not only the food....,"One of the finest restaurant in Lagos.Great place to enjoy music,dance and drinks. Love the view  from terrace .The place also has a dinning area for those who would prefer a quieter meal. My experience at Shiro was nothing less than magical.

Perfect place to...More",50,Oct-19,4.5,Shiro Restaurant
lulu22019,Lovely Sunday buffet,"Hi davidlollipop,  

Thank you for taking the time out to share your feedback with us. We are glad you enjoyed your overall experience and we look forward to welcoming you back in the near future. We appreciate your valuable feedback and have shared the same...More",50,Oct-19,4.5,Shiro Restaurant
Helen A,Shiro Restaurant,Had an amazing lunch. The outside Ocean View are breath taking. Good food and great staffs. Much recommended.More,50,Oct-19,4.5,Shiro Restaurant
Femiogun,Good food.,"Hi Emanuell13,  

Thank you for taking the time out to share your feedback with us. We are glad you enjoyed your overall experience and we look forward to welcoming you back in the near future. We appreciate your valuable feedback and have shared the same...More",50,Oct-19,4.5,Shiro Restaurant
Carly M,Review,"I really like the shiro staffs.great hospitality and customer service.Good ambience ,amazing experience. Really enjoyed our visit.More",50,Oct-19,4.5,Shiro Restaurant
margaretolele,"Food is Great, the Staff Need to Know a bit More What they Serve","Hi Bidemi1,  

Thank you for taking the time out to share your feedback with us. We are glad you enjoyed your overall experience and we look forward to welcoming you back in the near future. We appreciate your valuable feedback and have shared the same...More",50,Aug-19,4.5,Shiro Restaurant
PitiI,Great Asian food in Lagos,"We had a great lunch today. Great food ,ambience , drink and service . Great decor, temperature and music. Loved it...worth visit.More",40,Sep-19,4.5,Shiro Restaurant
Melahassan,Good experience!,"Very good experience today, will go again. Food and service equally great. Amazing hospitality. Great ambience. Prime location. Thank you shiro team.More",45,Sep-19,4.5,Shiro Restaurant
DUMEJE O,Shiro the best place to be,"Hi Melahassan,  

Thank you for taking the time out to share your feedback with us. We are glad you enjoyed your overall experience and we look forward to welcoming you back in the near future. We appreciate your valuable feedback and have shared the same...More",45,Sep-19,4.5,Shiro Restaurant
Emmanuelpaulll,Lunch to remember,"Shiro Lagos  is a popularly known and accepted Asian restaurant in Lagos. It offers a good experience in terms of lifestyle and entertainment and of course, offer great meals.More",45,Sep-19,4.5,Shiro Restaurant
mokosmith,Best place.,"Hi,   

Thank you for taking the time out to share your feedback with us. We are glad you enjoyed your overall experience and we look forward to welcoming you back in the near future. We appreciate your valuable feedback and have shared the same with...More",40,Sep-19,4.5,Shiro Restaurant
Shimray123,Best Restaurant,"Service, ambience,, music, food - a lunch to remember. We had a good time here. Salmon sushi was my favorite.More",50,Sep-19,4.5,Shiro Restaurant
Philipsfathi,Excellent ambiance,"Hi Emmanuelpaulll,   

Thank you for taking the time out to share your feedback with us. We are glad you enjoyed your overall experience and we look forward to welcoming you back in the near future. We appreciate your valuable feedback and have shared the same...More",50,Sep-19,4.5,Shiro Restaurant
ChuiIndia,Home away from home,Best place to visit so far.Great vibes.Had a lots of fun.Definitely be back soon for an event. Thank youMore,50,Jun-19,4.5,Shiro Restaurant
Jatemichrllr,Good food.,"Hi,  

Thank you for taking the time out to share your feedback with us. We are glad you enjoyed your overall experience and we look forward to welcoming you back in the near future. We appreciate your valuable feedback and have shared the same with...More",50,Sep-19,4.5,Shiro Restaurant
Yodele,Excellent!,"Amazing place love the good food and service. Ambience Is awesome . Weekends are full, better reserve before going.More",50,Sep-19,4.5,Shiro Restaurant
KennyBlve,"Best sushi, best cocktails, tropic parties","Hi,

Thank you for taking the time out to share your feedback with us. We are glad you enjoyed your overall experience and we look forward to welcoming you back in the near future. We appreciate your valuable feedback and have shared the same with...More",50,Sep-19,4.5,Shiro Restaurant
Kelechi1121,Memorable experience.,"Been here for a visit with my friends, fabulous food ,great service,a calm music and delicious food,  sushi must try for, I recommend this placeMore",50,Sep-19,4.5,Shiro Restaurant
abrahamiyang1991,Best Sushi.,"Hi,

Thank you for taking the time out to share your feedback with us. We are glad you enjoyed your overall experience and we look forward to welcoming you back in the near future. We appreciate your valuable feedback and have shared the same with...More",50,Sep-19,4.5,Shiro Restaurant
Q9899STclaireg,The best place in Lagos,"Beautiful ambiance,love Lily's selfless hospitality,feels like home away from home. Congratulations @Shiro, you have a great staff.More",50,Aug-19,4.5,Shiro Restaurant
Kaknancy,Perfect grill @ Shiro,"Hi,

Thank you for taking the time out to share your feedback with us. We are glad you enjoyed your overall experience and we look forward to welcoming you back in the near future. We appreciate your valuable feedback and have shared the same with...More",50,Aug-19,4.5,Shiro Restaurant
gamboolman,Shiros for Dumplings and Good Main Courses,"Had their lambchop which was amazingly perfect. The presentation in terms of food was amazing. overall ,tasty food,good ambience and service .will keep going back for yummy food.More",50,Aug-19,4.5,Shiro Restaurant
Remi F,"First time, will be back!!","My son and I visited Shiro Lagos on August 22nd and we had the chili basil dumplings & Thai chicken spring rolls LOVED!!! 
My son has the lamb chops ... best he’s had in a while. Only complaint was it wasn’t a lot , he...More",45,Aug-19,4.5,Shiro Restaurant
Godlove1,Great place,"Hi,   

Thank you for taking the time out to share your feedback with us. We are glad you enjoyed your overall experience and we look forward to welcoming you back in the near future. We appreciate your valuable feedback and have shared the same with...More",45,Aug-19,4.5,Shiro Restaurant
mercym356,Amazing Restaurant,Awesome place to hangout. Spectacular ambience . Cocktails are really good and worth the price. Absolutely love the place.Amazing hospitality.More,45,Aug-19,4.5,Shiro Restaurant
innocent89,Great Brunch.,"Hi, 

Thank you for taking the time out to share your feedback with us. We are glad you enjoyed your overall experience and we look forward to welcoming you back in the near future. We appreciate your valuable feedback and have shared the same with...More",40,Aug-19,4.5,Shiro Restaurant
laurel_s1717,Tasty take out,Had dinner with a friend and the food was super amazing. Starters were superb though i feel edamame beans should be served with sea salt.  Black Cod was out of this world and the chicken curry was awesome. Service was a miss in the beginning...More,50,Aug-19,4.5,Shiro Restaurant
Josephmorgan12,Love the service.,"Hi,

Thank you for taking the time out to share your feedback with us. We are glad you enjoyed your overall experience and we look forward to welcoming you back in the near future. We appreciate your valuable feedback and have shared the same with...More",50,Aug-19,4.5,Shiro Restaurant
moyos2015,Chika’s birthday,"Wow! We went there for Sunday afternoon , they have a brunch for both alcoholic and non alcoholic option. We opted for alcoholic brunch which was great. The cocktails was really good and the food was so delicious.We really enjoyed their brunch . Definitely be...More",40,Aug-19,4.5,Shiro Restaurant
Kishor K,Great Location !!,"Hi,

Thank you for taking the time out to share your feedback with us. We are glad you enjoyed your overall experience and we look forward to welcoming you back in the near future. We appreciate your valuable feedback and have shared the same with...More",50,Apr-19,4.5,Shiro Restaurant
Solomon121,Best cocktails collection,"I can't speak to the restaurant experience itself, as I have only ordered takeout from here. However, the food that I ordered was delicious! I got a curry, and my friend got soup, and both were very good. We also enjoyed the lettuce wraps. The...More",40,Jul-19,4.5,Shiro Restaurant
mild r,Great places for Vegetarians/Vegans,"Hi,

Thank you for taking the time out to share your feedback with us. We are glad you enjoyed your overall experience and we look forward to welcoming you back in the near future. We appreciate your valuable feedback and have shared the same with...More",50,Jul-19,4.5,Shiro Restaurant
capetownluver,Great food and quick service!,"Had a good time with my friends at shiro.The service was really good. It was an amazing experience.Love the ambiance ,the food and the sea view .More",50,Jul-19,4.5,Shiro Restaurant
SW1X,Best Restaurant in Lagos,"Hi,

Thank you for taking the time out to share your feedback with us. We are glad you enjoyed your overall experience and we look forward to welcoming you back in the near future. We appreciate your valuable feedback and have shared the same with...More",50,Jul-19,4.5,Shiro Restaurant
aishak450,AMAZING,"Turn up with Chika on her birthday! We celebrate an amazing person today having Indonesian steak skewers and chicken spring rolls, prawns etc She has an awesome day and we are about to go party with her to end the nightMore",50,Jul-19,4.5,Shiro Restaurant
Edwardik1991,Awesome place,"Hi moyos2015,   

Thank you for taking the time out to share your feedback with us. We are glad you enjoyed your overall experience and we look forward to welcoming you back in the near future. We appreciate your valuable feedback and have shared the same...More",50,Jul-19,4.5,Shiro Restaurant
Johhono,Brilliant,"# Nice Location  and ambience !!
# Great food !!. 
# Staff very helpful and well groomed !!!

All the very best for future ..................................  :-)More",50,Jun-19,4.5,Shiro Restaurant
issypearl,Food,"This is one of the best places to dine! Their food is absolutely amazing! Very tasty. We kept eating even when we were stuffed.😊.
If you want to treat yourself and have a world class experience, then I recommend this place.. Staff are so courteous...More",45,Jul-19,4.5,Shiro Restaurant
winsta,Amazing dim sum and great service,"Hi,   

Thank you for taking the time out to share your feedback with us. We are glad you enjoyed your overall experience and we look forward to welcoming you back in the near future. We appreciate your valuable feedback and have shared the same with...More",45,Jul-19,4.5,Shiro Restaurant
Traveler A,Always the favorite place,This is the second time I’ve been here with a friend and we are massive fans of the dim sum as it’s pretty tough getting decent dim sum in Lagos. They have a really good selection and everything we’ve tried has been authentic and fresh....More,45,Jul-19,4.5,Shiro Restaurant
Tobi A,Favourite.,"Hi,   

Thank you for taking the time out to share your feedback with us. We are glad you enjoyed your overall experience and we look forward to welcoming you back in the near future. We appreciate your valuable feedback and have shared the same with...More",40,Jul-19,4.5,Shiro Restaurant
sureshm226,"fabulous restaurant, wicked vibe & cool bar with lovely people, highly recommended.","Shiro is always one of my favorite places. It has never failed to impress me with all its aspects whenever I visit. Love the consistency in food , drinks and specially the service which has always been implacable. The staff are very friendly, polite and...More",50,Jul-19,4.5,Shiro Restaurant
Okuboyejo A,Great Place,"Hi,   

Thank you for taking the time out to share your feedback with us. We are glad you enjoyed your overall experience and we look forward to welcoming you back in the near future. We appreciate your valuable feedback and have shared the same with...More",50,Jul-19,4.5,Shiro Restaurant
Renzoprime,Official Meeting,"Shiro is always one of our favourite restaurant in Lagos. Because of the ambience, the food and the service .Every visit never disappointed we 
 always had the best time . Thank you for everything.More",50,Jul-19,4.5,Shiro Restaurant
momodutunji,Dinner,"Hi Tobi A,   

Thank you for taking the time out to share your feedback with us. We are glad you enjoyed your overall experience and we look forward to welcoming you back in the near future. We appreciate your valuable feedback and have shared the...More",50,Jul-19,4.5,Shiro Restaurant
Kenosky,Just next door to Hard Rock Cafe,"Great atmosphere, Impeccable service and delicious food. Shiro Lagos is best restaurant I ever been in Lagos. Keep it up team Shiro. Can’t wait to come back again...More",50,Jun-19,4.5,Shiro Restaurant
Josephmorgan12,Awesome place.,"Hi sureshm226,   

Thank you for taking the time out to share your feedback with us. We are glad you enjoyed your overall experience and we look forward to welcoming you back in the near future. We appreciate your valuable feedback and have shared the same...More",50,Jun-19,4.5,Shiro Restaurant
Davidmckin,Love the experience,"Nice place... Nice environment, great  food, correct drinks, music..definitely coming back again and again.More",50,Jun-19,4.5,Shiro Restaurant
imsam,Great place to entertain Business & Friends,"Hi,   

Thank you for taking the time out to share your feedback with us. We are glad you enjoyed your overall experience and we look forward to welcoming you back in the near future. We appreciate your valuable feedback and have shared the same with...More",50,Jun-19,4.5,Shiro Restaurant
Star S,Teppanyaki is a must!,The ambience was amazing for starters and don't get me started on the food and service. First class.More,40,Jun-19,4.5,Shiro Restaurant
Walter R,Wonderful experience.,"Hi,   

Thank you for taking the time out to share your feedback with us. We are glad you enjoyed your overall experience and we look forward to welcoming you back in the near future. We appreciate your valuable feedback and have shared the same with...More",50,Jun-19,4.5,Shiro Restaurant
Anthonysebastianm,Unexpected experience.,Fantastic ambiance and was able to carry out a decent conversation over a lovely meal throughout the eveningMore,50,Jun-19,4.5,Shiro Restaurant
Gaya3Subramanian,Great food and ambience,"Awesome sushis with a good range of vegetarian options. Decent ambiance, outdoor seating especially. An amazing place for dinnerMore",45,Apr-19,4.5,Shiro Restaurant
10austin,Tasty,"Hi Gaya3Subramanian,   

Thank you for taking the time out to share your feedback with us. We are glad you enjoyed your overall experience and we look forward to welcoming you back in the near future. We appreciate your valuable feedback and have shared the same...More",45,Mar-19,4.5,Shiro Restaurant
Santosh J,Good food and great ambience,"It is a very nice place to relax, had a wonderful meal with friends and family, the atmosphere was electrifying. Keep it up...More",45,Jun-19,4.5,Shiro Restaurant
Kelechimo,Excellent service.,"Hi 10austin,   

Thank you for taking the time out to share your feedback with us. We are glad you enjoyed your overall experience and we look forward to welcoming you back in the near future. We appreciate your valuable feedback and have shared the same...More",40,Jun-19,4.5,Shiro Restaurant
Vinod K,Good food & good ambiance,"Very Nice food, specially the live kitchen, chef Krishna is great, Ambience is also very good. Outside in the evening is very goodMore",50,May-19,4.5,Shiro Restaurant
Rhoda1991,Wonderful Restaurant.,"Hi jaiswalinst,   

Thank you for taking the time out to share your feedback with us. We are glad you enjoyed your overall experience and we look forward to welcoming you back in the near future. We appreciate your valuable feedback and have shared the same...More",50,Jun-19,4.5,Shiro Restaurant
Waris K,Great tasteand Good Music,"Every time we visited, we leave satisfied. The food was really good, so the service. The staffs are very friendly, this is one of the place you will find top notch service. Can't wait to come back again.More",40,May-19,4.5,Shiro Restaurant
Rob19822891,Consistently good. Recommend for client entertainment,"Hi  Kelechimo,  

Thank you for taking the time out to share your feedback with us. We are glad you enjoyed your overall experience and we look forward to welcoming you back in the near future. We appreciate your valuable feedback and have shared the same...More",50,May-19,4.5,Shiro Restaurant
Badru3,Awesome experience.,Food was good and so was service. Drinks were tasty too. No complains. Only issue we had was with the attitude of the hostesses. I request management to train them on customer service so that they can be more polite and courteous.More,40,May-19,4.5,Shiro Restaurant
Ladi G,Excellent Service And Honesty,"Hi vino04ster,

Thank you for taking the time out to share your feedback with us. We are glad you enjoyed your overall experience and we look forward to welcoming you back in the near future. We apologize for the lack of service encountered with our...More",50,May-19,4.5,Shiro Restaurant
Sreeresh P,Lovely place,"One of the best restaurant in Lagos. The restaurant is so beautiful .The staffs are courteous, polite and very helpful. The selection of the wine is perfect. Their cocktails is one of the best cocktails I have tried. Overall good experience.More",50,Mar-19,4.5,Shiro Restaurant
Liglossmaffia,Pricey but worth it,"Hi Rhoda1991,

Thank you for taking the time out to share your feedback with us. We are glad you enjoyed your overall experience and we look forward to welcoming you back in the near future. We appreciate your valuable feedback and have shared the same...More",50,Mar-19,4.5,Shiro Restaurant
EmmanueL239,Loved the experience.,"Really perfect taste, we try many different varieties of Asian food over the world, this one is really excellent! The music was so good, Friendly staff and the cabana close to beach ,high recommended!More",50,May-19,4.5,Shiro Restaurant
David O,Great place.,"Hi Waris K,

Thank you for taking the time out to share your feedback with us. We are glad you enjoyed your overall experience and we look forward to welcoming you back in the near future. We appreciate your valuable feedback and have shared the...More",40,May-19,4.5,Shiro Restaurant
461rajivs,"Absolutely awesome!!!
Memorable & caring with wholesome food!!!","I must have visited 10 times or more in the past 12 months.

Shiro is consistently very, very good. Setting and ambiance are excellent. Food is very good (cocktails, sushi, sashimi, dumplings and lobster special main course are especially good). Well chosen music played at...More",50,May-19,4.5,Shiro Restaurant
Pius1129,It's perfect!,"Shiro is just what you might have been looking for in Lagos if you are particular about great service, good food and nice atmosphere.

The place is located right in front of the sea that gives an add on to its atmosphere. The outdoor is...More",45,May-19,4.5,Shiro Restaurant
RaviRH,Shiro Family Lunch,"Hi Pius1129,  

Thank you for taking the time out to share your feedback with us. We are glad you enjoyed your overall experience and we look forward to welcoming you back in the near future. We appreciate your valuable feedback and have shared the same...More",45,Jun-18,4.5,Shiro Restaurant
sean h,Excellent food and service,Would highly rate the teppanyaki! Took the family and the chef made the kids laugh and the food was delicious!More,45,May-19,4.5,Shiro Restaurant
Zealstill,Great experience.,"Hi RaviRH,  

Thank you for taking the time out to share your feedback with us. We are glad you enjoyed your overall experience and we look forward to welcoming you back in the near future. We appreciate your valuable feedback and have shared the same...More",40,May-19,4.5,Shiro Restaurant
Drealthing,Great place to be!,"Great variety of Asian fusion, music and atmosphere. Would recommend for anyone looking to impress their guests for a night out.More",50,Nov-18,4.5,Shiro Restaurant
