author_name,review_title,review_text,author_rating,visit_date,overall_rating
Sunday O,Remarkable,"Trendy and Cozy ambience, variety of Asian cuisine, impressive collection of Japanese Whisky and Sake and other liquor, must visit to spend a couple of hours, as we went on Sunday with booking in advance, the place was extremely busy as they also have a...Sunday brunches. Food especially starters are excellent. Staff are very polite and helpful.More",45,November 2023,4.5
James A,Great experience at Shiro Lagos,"Hi,

Thank you for taking the time out to share your feedback with us. We are glad you enjoyed your overall experience and we look forward to welcoming you back in the near future and look into the service. We appreciate your valuable feedback and...More",45,November 2023,4.5
Esho R,Excellent customer service,"We had a awesome experience in Shiro (Landmark village). This was there always in our bucket list. We tried the Teppanyaki set menu, it covered good variety; soup, salad, salmon and vegetables, yaki udon noodles and the fried rice. Desserts and service was top notch...thanks to Lily, chef Aries for looking after us.More",45,November 2023,4.5
Stephen I,Best Brunch I have experienced,"Hi,

Thank you for taking the time out to share your feedback with us. We are glad you enjoyed your overall experience and we look forward to welcoming you back in the near future and look into the service. We appreciate your valuable feedback and...More",40,October 2023,4.5
Chisom Titus N,Sublime food and Cocktails with Great ambiance!,We Recently visited Shiro with my friend where I got splendid food & fabulous service. Food was great too. It was more than our expectations.More,50,October 2023,4.5
Gloriauchechi,Donner Outing,"Hi,

Thank you for taking the time out to share your feedback with us. We are glad you enjoyed your overall experience and we look forward to welcoming you back in the near future and look into the service. We appreciate your valuable feedback and...More",50,October 2023,4.5
Smile C,Excellent and wonderful,"I have literally tried some good brunch in Lagos but I'd rate Shiro Sunday brunch as best. There was so much to eat our, the grills were mouthwatering. I would definitely go back again. I strongly recommend.",50,October 2023,4.5
Williams m,Best in class restaurant,"We went to Shiro for our anniversary dinner and I have to say it is one of the best Asian restaurants we have ever been! The Crispy Spicy Avocado Maki, assorted sashimi platter - all of them was top class and extremely fresh. The Chocolate...Tiramisu and the volcano cake something we had never had before. Can’t forget to mention the hospitality and service was top draw, special mention to Kachi who ensured our first wedding anniversary dinner was memorable! Absolute delight! 5 out of 5 to Shiro and the team!More",50,October 2023,4.5
aabhishekr,Must visit when in Lagos,"Hi,

Thank you for taking the time out to share your feedback with us. We are glad you enjoyed your overall experience and we look forward to welcoming you back in the near future and look into the service. We appreciate your valuable feedback and...More",50,October 2023,4.5
Philip V,J'adore,"An authentic Japanese food and wide range of premium sake wine.
The appitizers are really good. It is a good place to experience sushi and sake wine, the dessert are also good especially the chocolate  volcano and yuzu semifreddo.More",50,September 2023,4.5
Khan E,Nice,"Hi,

Thank you for taking the time out to share your feedback with us. We are glad you enjoyed your overall experience and we look forward to welcoming you back in the near future and look into the service. We appreciate your valuable feedback and...More",50,September 2023,4.5
Jet44098398615,Nice,The service there is 1000 % great and I like to come over there again and again because of Bobby he is the man to make a drink please try to always go there and enjoy yourself and thank me later loveMore,50,September 2023,4.5
hope a,Scrumptious Teppanyaki Food And Exquisite Crafted cocktails,"Hi,

Thank you for taking the time out to share your feedback with us. We are glad you enjoyed your overall experience and we look forward to welcoming you back in the near future and look into the service. We appreciate your valuable feedback and...More",50,September 2023,4.5
reckless a,A very enjoyable meal experience,"Being one of our special day, we wanted to make it a most memorable day with a dinner at Shiro Lagos. Thanks to Shiro team for not disappointing us as always, infact they were way beyond our expectations.More",50,September 2023,4.5
Emmanuel A,Delicious veggie Japanese experience,"Hi,

Thank you for taking the time out to share your feedback with us. We are glad you enjoyed your overall experience and we look forward to welcoming you back in the near future and look into the service. We appreciate your valuable feedback and...More",50,September 2023,4.5
Omiyale S,Sushi tastes insanely fresh,"One thing I can say is The hospitality is bespoke. Shiro Lagos is indeed my new Asian favorite. The chef "" Yam"" ensured my culinary palette was satiated by whipping out incredibly personalized dishes that can leave you spell bound. Really a great high in...More",45,August 2023,4.5
Deepali P,Date Night Shiro !!,"Hi,

Thank you for taking the time out to share your feedback with us, we are glad you enjoyed your overall experience and we look forward to welcoming you back in the near future.

Warm Regards,
Shiro Management",45,July 2023,4.5
Journey66963757949,Delightful Asian experience,"Always love this place such a cool vibe and best date night spot , shuroo never fails to impress 

Staff are super attentive and is vey service oriented and well versed with food menu and make some good recommendations

Great job guys",45,August 2023,4.5
Stephen I,It was really an unexpected feast,"Hi,

Thank you for taking the time out to share your feedback with us, we are glad you enjoyed your overall experience and we look forward to welcoming you back in the near future.

Warm Regards,
Shiro Management",40,August 2023,4.5
Philip V,Excellent Service and Great Sunday Brunch,"Wonderful place to spend quality time. Great food and good in service. I enjoyed food and atmosphere! It was my first time trying the Yuzu semi frozen ice cream, we really enjoyed the taste and the texture. We will definitely back soon. Im so impressed...More",50,July 2023,4.5
sunday p,Shiro Lagos is my gateway,"Hi,

Thank you for taking the time out to share your feedback with us, we are glad you enjoyed your overall experience and we look forward to welcoming you back in the near future.

Warm Regards,
Shiro Management",50,July 2023,4.5
Hope N,Irresistible experience,"I popped in unexpectedly while I was staying at the Eko signature, I heard there was a special evening for the Ladies on Wednesday. All Ladies gets to buy one and gets another drink free of charge . Lily and the rest of team treated...More",50,July 2023,4.5
Omiyale S,WoW!!! The best Asian Cuisine I ever ate in my life,"Hi,

Thank you for taking the time out to share your feedback with us, we are glad you enjoyed your overall experience and we look forward to welcoming you back in the near future.

Warm Regards,
Shiro Management",50,July 2023,4.5
Philip V,Impressive satisfaction,"I had the brunch buffet at Shiro last week, the Japanese restaurant.the ambience is always fascinating to me whenever I visit. peaceful and cozy and great vibe, The DJ at Shiro was one the best, he played all my favorite 80’s and 90's music.  The...More",50,May 2023,4.5
florence t,DO SHIRO,"Hi,

Thank you for taking the time out to share your feedback with us. We are glad you enjoyed your overall experience and we look forward to welcoming you back in the near future. We appreciate your valuable feedback and have shared the same with...More",50,May 2023,4.5
Rhianna S,Perfect Anniversary Dinner,Great food and signature cocktails. The entire staff there was so welcoming and very helpful. Loved the music and ambience of the restaurantMore,50,April 2023,4.5
Anthony F,One of it kind,"Hi,

Thank you for taking the time out to share your feedback with us. We are glad you enjoyed your overall experience and we look forward to welcoming you back in the near future. We appreciate your valuable feedback and have shared the same with...More",50,May 2023,4.5
Sunday O,Would 100% recommend.,"To be frankly, we are not a big fan of Asian cuisine. But after visiting Shiro restaurant. We must say, we are going to visit this place again very soon. 
Quality of food and sashimi carpaccio are so good and so fresh. I can still...More",50,May 2023,4.5
Nsidibe A,Excellent food and great service!!!,"Hi,

Thank you for taking the time out to share your feedback with us. We are glad you enjoyed your overall experience and we look forward to welcoming you back in the near future. We appreciate your valuable feedback and have shared the same with...More",50,May 2023,4.5
Yinka A,Teppanyaki at Shiro,"We arrived at the restaurant after reading here the reviews, and honestly everything that has been written here, is understatement. We had 3 sushi varieties, which were so fusion with flavors! The chilly pork donburi was so good and two desserts. 
The waiter gave us...More",50,May 2023,4.5
411Hemaa,*Impeccable Service and good food *,"We had recently been to Shiro for a Birthday celebration and we had a lovely time there. The food, the ambience and the music was great and the service (by Saviour) was the highlight. Right from the reservation, to the arrangements, we had requested for...More",45,April 2023,4.5
Kunjana21,No value for customers,"Hi,

Thank you for taking the time out to share your feedback with us. We are glad you enjoyed your overall experience and we look forward to welcoming you back in the near future. We appreciate your valuable feedback and have shared the same with...More",45,April 2023,4.5
419rajeevy,Insanely good Sushi with bespoke hospitality*,"Me and my husband have been going to this place since more than a decade.

It was a business dinner which we planned and the venue was already communicated to all.

Today when we called for a booking for 9 people to Mr. Hemanth, he...More",45,April 2023,4.5
Kobolly K,Delightful lunch.,"Hi  Kunjana,   

We are sad to hear about this. It is inconsistent with our values and we apologize sincerely for the unfortunate experience at our restaurant. We assure you that your opinion matters to us and we are hoping you give us a chance to...More",40,March 2023,4.5
Probhashish,*Best cocktails in town*,Shiro is my new asian favourite in Lagos. Chef Alvin and Yam ensure your culinary palette is satiated by whipping out incredibly personalized dishes that can leave you spell bound. It’s the best high in hospitality in Lagos!More,50,March 2023,4.5
Mody F,*Best Fusion Food Ever*,"Hi,

Thank you for taking the time out to share your feedback with us. We are glad you enjoyed your overall experience and we look forward to welcoming you back in the near future and look into the service. We appreciate your valuable feedback and...More",10,March 2023,4.5
Saviour E,*Best food with Best Cocktails*,"You will be greeted at this cozy and delightful Asian Restaurant b the Manager who assist his colleague, who is the executive chef. The dishes were full of fresh vegetables and just the right portion.
For dessert, each of us had a different cake which...More",50,March 2023,4.5
Farrellfoster F,*Best brunch in town*,"Hi,

Thank you for taking the time out to share your feedback with us. We are glad you enjoyed your overall experience and we look forward to welcoming you back in the near future and look into the service. We appreciate your valuable feedback and...More",50,March 2023,4.5
Gloriauchechi,Great opportunity to try different plates,"We like the food and amazing fresh fruit cocktails , so we try to go there often. The steak is amazing, as well as the pomelo salad, the deserts! One of the tastiest places in Abu Dhabi.More",50,March 2023,4.5
32yamt,*Simply outstanding!!!*,"Hi,

Thank you for taking the time out to share your feedback with us. We are glad you enjoyed your overall experience and we look forward to welcoming you back in the near future and look into the service. We appreciate your valuable feedback and...More",50,March 2023,4.5
chandraket s,Incredible,One of my favorite restaurants in Lagos. We loved the food . I highly recommend it - especially if you are a shopaholic as it abuts the boulevard around which has really fabulous shops.More,50,March 2023,4.5
clazzyb,The Ariel Dance was astonishing,"Hi,

Thank you for taking the time out to share your feedback with us. We are glad you enjoyed your overall experience and we look forward to welcoming you back in the near future and look into the service. We appreciate your valuable feedback and...More",50,January 2023,4.5
823babub,Hidden fusion Gem,"I had one of the good experience in Shiro. I had tempura prawns. 2 different cocktails. Staffs are very friendly, well knowledge. They explain each cocktails and story along with the food. Welldone guys.More",50,February 2023,4.5
487olac,Family times,"Hi,

Thank you for taking the time out to share your feedback with us. We are glad you enjoyed your overall experience and we look forward to welcoming you back in the near future and look into the service. We appreciate your valuable feedback and...More",50,February 2023,4.5
Nganaothei M,Good food and clean restaurant,"We Have been several to the Shiro Lagos brunch and it is consistently amazing. Fantastic food and service, great variety, freshly prepared and just a great experience. Love the little goodies they are sending to the table like the Fresh oysters. Top class!More",50,February 2023,4.5
austind513,Great food and beautiful ambience,"Nice ambiance. Very much Asian taste, responsive staffs. Weather it's with office colleagues or friends I always had a great time coming here. Food and cocktails are always memorable. It's always packed on weekend, reservations recommended. Must visited place in LagosMore",45,January 2023,4.5
awnib2017,Friends gathering,"Hi ,

Thank you for taking the time out to share your feedback with us. We are glad you enjoyed your overall experience and we look forward to welcoming you back in the near future. We appreciate your valuable feedback and have shared the same...More",45,January 2023,4.5
ibrahimi839,Dinner with buddies at Shiro Lagos!,"*Consistently Excellent *

We've been celebrating our special occasions at Shiro for years now and the place has never disappointed us, be it the food, the ambiance or the service. A special shout out to Chef Alvin and Chef Roderick who've taken such good care...More",45,January 2023,4.5
Yosoreoluwa,Hang out,"Hi ,

Thank you for taking the time out to share your feedback with us. We are glad you enjoyed your overall experience and we look forward to welcoming you back in the near future. We appreciate your valuable feedback and have shared the same...More",40,January 2023,4.5
emmanuelaC3025LV,Shiro experience !,"Enjoyed the food at Shiro….the ambience and the service was excellent,  Saviour were polite and efficient in what they did and made it a comfortable evening for us. Tasted the different varieties of appetizers and desserts made by Chef Rhodedick… pretty impressive… thank you again....More",50,January 2023,4.5
cynthiacL3062QD,Christmas Eve was remarkably wonderful,"Hi ,

Thank you for taking the time out to share your feedback with us. We are glad you enjoyed your overall experience and we look forward to welcoming you back in the near future. We appreciate your valuable feedback and have shared the same...More",50,December 2022,4.5
181sannit,My honest review,"Very dark. We literally used torchlights, like a mini phone camcorder light to take pictures 
The woman at the entrance literally said no pictures in an attitude tone without buying food first 
We were ready then. Got everything we wanted and the waiter comes and...More",50,November 2022,4.5
459alvinp,The most INSANE restaurant in Lagos!,"Hi Yosoreoluwa,

We are sad to hear about this. We assure you that your opinion matters to us and we are hoping you give us a chance to make this right. Please share your details at dhiren.pawar@jsmcorp.in.com so we may reach out to so we...More",10,October 2022,4.5
imeldai265,Superb,"Our trip to Shiro for a Sunday Brunch was a wonderful experience - the food, service and the ambience was memorable and definitely worth repeating. The Japanese speciality eatery is worth the hype, topped off with great service from Kelechi and Okafor. Dish favorites -...More",50,October 2022,4.5
juwjuwlina,Beef suya sushi was so tasty,"Hi,   

Thank you so much for taking the time out to share your oh so detailed feedback with us and your positive review. We are glad you enjoyed your overall experience and we look forward to welcoming you back in the near future. We appreciate...More",50,September 2022,4.5
329bhaveshm,"Beautiful ambience, great food and service","So apparently I have been on some interesting dates around Lagos, so far the best ever has to be our Christmas dinner at Shiro restaurant . My BF wanted  us to come again everytime we celebrated something 😂. We had chicken skewers and prawn dumplings...More",50,September 2022,4.5
francisaP9905VK,Pleasing to see. Fun to have. Sublime to taste.,"Hi,   

Thank you so much for taking the time out to share your oh so detailed feedback with us and your positive review. We are glad you enjoyed your overall experience and we look forward to welcoming you back in the near future. We appreciate...More",50,September 2022,4.5
A4537OTalberta,Great experience!,"This restaurant is the best have been to in Lagos (101/100)
Best services and meal ❤️✔️
Definitely coming back ❤️More",50,September 2022,4.5
josephjO7074PJ,Shiro never disappoint.,"Hi,   

Thank you so much for taking the time out to share your oh so detailed feedback with us and your positive review. We are glad you enjoyed your overall experience and we look forward to welcoming you back in the near future. We appreciate...More",40,September 2022,4.5
449tessyh,"Incredible food, amazing service!","Shiro Lagos the most insane food and cocktsils! Definitely  try the sushi and the seafood soup. ...TO DIE FOR! The service couldn't have been better and the atmosphere was sleek and sexy, definitely a night for friends & couples! Will 100% be visiting again.More",40,August 2022,4.5
392unnik,Loved this place...Sushi Paradise 🥰🥰🥰,"Sushi top! We spent our work holiday party at Shiro. We tried the tasting menu and the food was absolutely delicious. Service is fast and the stuff is very attentive to details. Overall, great experience.More",45,August 2022,4.5
Un10976,A Very Memorable 31st Birthday,"Hi 392unnik,   

Thank you so much for taking the time out to share your oh so detailed feedback with us and your positive review. We are glad you enjoyed your overall experience and we look forward to welcoming you back in the near future. We...More",45,August 2022,4.5
615olayinkaa,Not so good as advertised,The ambiance takes you to urban Japan with amazing music.The salmon sashimi feels fresh down your tongue. The thin sliced A5 Angus steak melts in your mouth. Our favorite was the seven spiced pork belly. I was so surprised by the unique birthday greeting orchested...More,45,July 2022,4.5
432semmih,"If you want the best of service in Lagos, drive down to Shiro Lagos.","Hi  Un10976,   

Thank you so much for taking the time out to share your oh so detailed feedback with us and your positive review. We are glad you enjoyed your overall experience and we look forward to welcoming you back in the near future. We...More",40,July 2022,4.5
195salius,Visited this place for the first time with my friends and believe me the best place I like in lagos in terms of food & service b,"I heard much about this restaurant, So my friend who I hadn’t seen for awhile decided to treat ourselves. It was quiet, that’s good, as it would mean quick service.
We ordered a simple meal, soup and chicken spring rolls, Nice and well received.
Then...More",50,July 2022,4.5
Zemmanuela,Amazing Dinning Experience,"Hi  615olayinkaa,   

We are sad to hear about this. It is inconsistent with our values and we apologize sincerely for the unfortunate experience at our restaurant. We assure you that your opinion matters to us and we are hoping you give us a chance to...More",50,June 2022,4.5
JusticeJoyce,New Desserts Added to Menu. Same DJ PLAYLIST,Never have I had such an impeccable service in a long time. My spouse and I really had a great time during our last visit. Restaurant in Lagos needs to start learning from Shiro. I’d rate them a six if possible.More,20,May 2022,4.5
Saurabh K,Great hospitality!!,"Hi 432semmih,   

Thank you so much for taking the time out to share your oh so detailed feedback with us and your positive review. We are glad you enjoyed your overall experience and we look forward to welcoming you back in the near future. We...More",50,June 2022,4.5
jeetinder k,I have been here with few of my office mates and we all had a great quality time over here .My all time favorite place for the A,Amazing place for the dining experience. The place the food &  drinks and ambience is just amazing. The cocktails are just mouth watering.More,50,June 2022,4.5
ogbonnak2020,Never tired of dining in Shiro.,"Hi 195salius,   

Thank you so much for taking the time out to share your oh so detailed feedback with us and your positive review. We are glad you enjoyed your overall experience and we look forward to welcoming you back in the near future. We...More",50,May 2022,4.5
princei2021,Awesome Cocktail Experience,"Amazing experience! If you thought Shiro will leave you hungry, think again. You should skip several meals before visiting this amazing restaurant. Atmosphere is chill and cool and the staff is also really friendly. They know what they’re doing and what they’re talking about, and...More",30,May 2022,4.5
Dapo L,fab evening,"Hi Zemmanuela,  

Thank you so much for taking the time out to share your oh so detailed feedback with us and your positive review. We are glad you enjoyed your overall experience and we look forward to welcoming you back in the near future. We...More",50,April 2022,4.5
AviZakai,Must visit in lagos,"Y'all can track all my reviews and see I used to dine often. Like, I made others sick of the food but I love a good value. 

What Must Improve:
1) consistency for alcoholic drinks (e.g. margarita is good on occasions Bartender/Mixologist Emmanuel is around....More",50,April 2022,4.5
justicee409,Tasty food,"Hi JusticeJoyce,

Thank you so much for taking the time out to share your oh so detailed feedback with us and your positive review. We are glad you enjoyed your overall experience and we look forward to welcoming you back in the near future. We...More",50,April 2022,4.5
albertpP265HF,Refreshing Varieties of Cocktails,"Excellent hospitality. Nicely taking by staff specially Mr. Sashi, great time spend with friends. Value for money delicious food, mouth watering drinks. 
Thanku for yours hospitality see you guys soon cheers!!!More",50,March 2022,4.5
decembao,Great experience,"Awesome place with great ambience. 
Perfect place to go on a date.
Amazing staffs, their staff's were very welcoming and very professional and polite. Loved the way they treated us.
Once again thank you. Will be back soon again with more friends.More",45,March 2022,4.5
635melah,Business Dinner,"Hi decembao,   

Thank you so much for taking the time out to share your oh so detailed feedback with us and your constant and positive review. We are glad you enjoyed your overall experience and we look forward to welcoming you back in the near...More",45,March 2022,4.5
Emmanuelllzz,Family Dinner,"Had been there couple of times for business dinner. The output is really good which suits the ambience.
Very impressed with the service everytime we visited Shiro.
planning to visit soon for a romantic dinner.More",45,February 2022,4.5
Deepali P,Ladies Nights !!,"Hi 635melah, 

Thank you so much for taking the time out to share your oh so detailed feedback with us and your constant and positive review. We are glad you enjoyed your overall experience and we look forward to welcoming you back in the near...More",40,January 2022,4.5
Abhi_Barmafia,A fun experience at Tepanyaki only at shiro,"This is our 2nd visit to Shiro and this is one of the best Asian restaurant in Lagos.
Great service. 
Utterly delicious food and a great set up and ambience.
The drinks are fancy and amazing. 
Hope to be back soon.More",50,January 2022,4.5
JusticeJoyce,Nov. 2021 visit - MGMT addressed my review as professionals. Dec 2021 visit STRONGER COVID Protocols in place.,"Hi  Emmanuelllzz,  

Thank you so much for taking the time out to share your oh so detailed feedback with us and your constant and positive review. We are glad you enjoyed your overall experience and we look forward to welcoming you back in the near...More",50,December 2021,4.5
MChipalo,Constructive criticism,Went on a random Wednesday with some of my girls…and from the time we entered and attended to everything was super awesome…Unni the GM came over to check on us and also let us know it was Her Nights a version of a ladies night...More,50,December 2021,4.5
JusticeJoyce,Review Menu Beforehand + Call to Confirm,"Hi Deepali,

Thank you so much for taking the time out to share your oh so detailed feedback with us and your constant and positive review. We are glad you enjoyed your overall experience and we look forward to welcoming you back in the near...More",50,October 2021,4.5
