author_name,review_title,review_text,author_rating,visit_date,overall_rating,restaurant_name
Ferenji12,Excellent West African and Western dishes.,"We had a group of 30, and they were very accommodating, even though we were late for our reservation. Food was good and service was prompt.",30,May-18,4,Yellow Chilli Restaurant
OyinOni,Delivers all the time,Stopped by for peppered snail and fried yam....that’s usually my go to meal at this particular restaurant....we were offered some peanuts while we waited for my meal...great service in all.,40,Mar-18,4,Yellow Chilli Restaurant
nwaotam,Good Food,"The food here is always good. Well made good, and highly recommended for their legendary sea food Okro soup, and regular Okro soup. All other meals ate also well made. 

It is also a good environment for business meetings and networking. Well located, but has...More",30,Apr-18,4,Yellow Chilli Restaurant
Mafolayomi,Lunch at Yellow Chilli,"Had lunch at Yellow Chilli, Ikeja on a Sunday afternoon. 
I typically eat the Seafood Okro as I believe that’s their best dish. The other time I tried something else, I didn’t enjoy it one bit. 
I recommend the Seafood Okro anytime, they always get...More",40,Apr-18,4,Yellow Chilli Restaurant
_sosakwe_so,Lacking Variety,"Great ambiance and large enough space to accommodate a large number of customers, however, the menu isn't diverse enough and none of the meals I tried was exceptional. It's regular Nigerian food on a regular budget.",45,Feb-18,4,Yellow Chilli Restaurant
Hardeymijuh,Nice restaurant,"I went to Yellow chili with a friend, nice restaurant, easily located ... the food is wonderful, I had a nice time",35,Nov-17,4,Yellow Chilli Restaurant
bimsdiva,Time conscious service,"Was stuck in bad traffic and called in to order food praying and hoping they would take us serious. When we finally arrived, the food was ready, piping hot and delicious. Kudos to the timely service. Saved a life. Lol.",40,Mar-18,4,Yellow Chilli Restaurant
123mustafaisb,Not great place to eat,Food was fresh but not able to cater tourist requirements. As local nigerian food was freshly prepared but waiters were not able to assist u in taking orders,40,Mar-18,4,Yellow Chilli Restaurant
473maryamj,Best traditional dishes served the right way!,Yellow chilli offers the best african dishes in a modern restaurant. I would recommend for anyone looking for something different...,40,Mar-18,4,Yellow Chilli Restaurant
Viveeee,NICE EATS,"The food is always nice and fresh however the service isn't wonderful but the food is worth the wait, not a place to visit if your are extremely hungry or impatient.
One of my favorite restaurants in Lagos till date and my favorite meal is...More",30,Nov-17,4,Yellow Chilli Restaurant
Olumide K,Great Restaurant,"Great restaurant the major challenge is getting a place to park. The staffs were quite courteous and polite. 
They can do a great job by reducing the wait time for each meal. The food was good and quite flavorful.",50,Mar-18,4,Yellow Chilli Restaurant
Awesome2210,Review,The food is made of fresh ingredients and the waiters are very friendly. Nicely spiced food. I will always go back,50,Mar-18,4,Yellow Chilli Restaurant
holjones,Love it,"Service isn't wonderful and the food can be delayed but food is very consistent and the fried rice fiesta is worth the wait!  

My husband and I had fish pepper soup and chicken wings to start and then split a jollof rice fiesta and a...More",30,Mar-18,4,Yellow Chilli Restaurant
TosinOyenusi,Lovely experience,The environment is quite welcoming. Courteous staff. Good place for solo dinning or group dinning. Excellent Efo Riro:),40,Apr-17,4,Yellow Chilli Restaurant
LagosKathy,Not bad!,"The food is quite good, but a bit expensive. The layout is lovely, and very roomy, and airy.
Great African artwork.",40,Mar-18,4,Yellow Chilli Restaurant
Bimbo A,Horrible service,"They're service is horribly poor in their Ikeja outlet. No hot towel before eating, you wait at least 50 minutes to be served... Guess it's a reflection of us because people keep quiet at such irresponsibility! Will never bring my family here again!",40,Mar-18,4,Yellow Chilli Restaurant
Adaiah S,Excellent local food,Very good place for local Naija food. Good environment and nice staff. Also very good for group outings.,40,Jan-18,4,Yellow Chilli Restaurant
cwjweller,A taste of Nija.,If you are in town on business and want a taste of Nigeria that is authentic and agrees with a Western palate then this restaurant is the one to try. Authentic Nija food from cows foot to snails in a reasonable surround. For the less...More,40,Aug-17,4,Yellow Chilli Restaurant
Midibabe,I love their seafood Okra!,"They have lovely Nigerian meals, soups. The Fisherman pepper soup is lovely too!
The ambience is nice but the killer is the service time! You might have to wait 1 hour plus for your meal, hopefully you wont pass out if your very hungry!
But...More",40,Dec-17,4,Yellow Chilli Restaurant
sagmekzie,Pleasant experience...,"Visited the Ikeja restaurant and it was a pleasant experience overall. 

The security men were quite helpful with getting a good parking spot despite the fact that the place was packed.

Waiters were attentive, got us a spot at the upstairs lounge overlooking Joel Ogunnaike....More",45,Feb-18,4,Yellow Chilli Restaurant
YASMIN B,Food was delicious!,"The food was delicious. I tried some traditional Nigerian dishes that I’ve never tried before including nkobi and it was so delicious! If you want to try traditional Nigerian food in a lovely restaurant setting, this is the place to go!",35,Jan-18,4,Yellow Chilli Restaurant
Justice D,Don Jay,"Hearing so much about them got me interested to see things myself 

On teaching there, parking my car was a big issue as the security men were not very helpful but rather looking to assist flashy cars to get some kick backs 

I struggled to...More",40,Dec-17,4,Yellow Chilli Restaurant
Willy O,Ideal place to eat out!,"I had lunch on my last birthday with friends and we were thoroughly entertained with spicy home made dishes. Customer service was excellent, as the staff were very warm and hospitable. They provided us with so many options and food combinations.",40,May-17,4,Yellow Chilli Restaurant
oogunlana,Your body will thank you...,"From the moment you place that order, your expectation begins to peak. Just when your meal is placed before you and you start you eat, you wish you can eat forever...its such a pleasant experience at The Yellow Chilli",50,Oct-17,4,Yellow Chilli Restaurant
bunmilaw,TGIF,Casual relaxed atmosphere good food value for money too. Could be a bit noisy esp on a match day. If you like African food place to go.,40,Jan-18,4,Yellow Chilli Restaurant
David A,The Older the better,"Talking about Yellow Chilli Restaurant reminds me of the last meal I had there at the tail end of 2017. It is my first time actually to eat ""seafood okra"" and swallow. My American client really enjoyed the meal. No doubt about it, these guys...More",50,Nov-17,4,Yellow Chilli Restaurant
Dati3514,Food is good,The food is good. Love the sea food okra and their yam pottage. It can get very busy in the evenings. The service is also quite slow.,30,Jan-18,4,Yellow Chilli Restaurant
Fred C,Good for local dishes,"Good for local dishes. Courteous staff. Clean environment. Location is easily assessible and near the city centre. It's secured, too.",40,Nov-17,4,Yellow Chilli Restaurant
Kwesi S,Sunday Lunch @ Ikeja,"Great to return to Yellow Chilli after a while with a friend.
On New Year’s eve the restaurant was quite full with a significant flow-over to the street.
Fortunately a few minutes of my arrival and whilst awaiting my guest, the restaurant emptied out and...More",40,Jan-18,4,Yellow Chilli Restaurant
675killiank,Dinner at The Yellow Chilli,This is an affordable place for Nigerian dishes in Victoria Island. It tends to get busy in the evenings so be prepared to wait for a whole half hour for your meal.,40,Jan-18,4,Yellow Chilli Restaurant
frantz05,Good Place to have Nigerian Food!,"My first day in Lagos this time around, my colleagues took me to Yellow Chilli for dinner.  It's not too far from our office and it's a good place to have a taste of the local fare.  There were exactly 20 of us from many...More",30,Dec-17,4,Yellow Chilli Restaurant
taio877,Sumptuous meals,"Excellent local cuisine, served in an inviting Nigerian environment. The food is authentic - the fried rice fiesta is a winner every time; and the seafood okro soup 🍲 really looks sumptuous. I don’t eat okro but will strongly recommend it if you do. Can’t...More",30,Dec-17,4,Yellow Chilli Restaurant
viceroyKen,Yellow chili Scholi Babe,Great African dishes especially the okro and Afang cold beer spacious sitting arrangements in the restaurant recommended to visit in Victoria island and Ikeja,30,Dec-17,4,Yellow Chilli Restaurant
BOO259,AMAZING,"A nice restaurant to have a blend of continental and locally produced dishes. With a very courteous staff and a serene ambience, a balance will surely be struck with dishes on offer. All the meals are freshly produced. And this is a warning that you...More",40,Feb-17,4,Yellow Chilli Restaurant
mrfixit747400,Outstanding !!!,We had a family dinner for 9 people last evening (21 Dec 2017) and I want to give our profound thanks to the Yellow Chilli team. Gabriel (manager) and Younana (auditor) both introduced themselves and confirmed our requirements for the evening. Their staff were super-attentive....More,45,Dec-17,4,Yellow Chilli Restaurant
rowreal,hang out for Dinner,"If you like to have some kind of coded place to hang out for dinner or you have a date and you are close to VI, Yellow Chilli is a place to think off. The food is good with different variety. The services are good...More",35,Nov-17,4,Yellow Chilli Restaurant
olivierm363,Safe guess for nigerian cooking,"I have known Yellow Chilli since 2007.  The menu hasn't changed. It's a safe value in Lagos. I recommend their pepper soups and the jollof rice. Generally, you can trust what you eat there.",40,Nov-17,4,Yellow Chilli Restaurant
Priscilla A,Quite Nice,"Yellow chili serves home cooking, and who doesn't like some quality home cooking. It can be pricey though, depending on what you're having. 
I hear they serve great seafood, too. I don't like seafood, so I wouldn't know :)",40,Jul-17,4,Yellow Chilli Restaurant
iyanuoluwa o,Just Ok,I had visited cos my friends and colleagues spoke high of it but was left disappointed after spending my wedding anniversary there. WHILE some of the menu was great a few others were overrated,40,Jan-17,4,Yellow Chilli Restaurant
Brian N,"Great restaurant, great food","The restaurant is in a nice location, very famous and always has people more so between 7.30 -9pm . Excellent customer service and great food too. Chicken breast in pepper sauce with rice was great.",50,Nov-17,4,Yellow Chilli Restaurant
Seike I,food,"Nkwobi is lit, plantain: heavenly, okro seafood: great... dinner with colleagues: awesome.

In all, it always a great food experience when i go to yellow chilli.",40,Sep-17,4,Yellow Chilli Restaurant
Constance W,Yellow Chilli Seafood Jollof Rice,"Looking for a very tasty and spicy rice meal that you cannot but enjoy? Then find your way to Yellow Chilli on Victoria Island, Lagos. You will not regret it.",30,Oct-17,4,Yellow Chilli Restaurant
melvin d a,the ambiance could use a little uplift,"Meal was ok, atmosphere mediocre and service awful.  not value for money.  To experience a tasty Nigerian cuisine, I will reluctantly visit this restaurant in the future.",40,Oct-17,4,Yellow Chilli Restaurant
Obichuks,Amazing meals ........ anyday!,This restaurant is a place to be anyday ......... always offering amazing meals. Can't wait to be back soonest!,30,Oct-17,4,Yellow Chilli Restaurant
ayodelefm,Good,"I once ordered their fisherman soup, it was very nice. It took a while to be ready though and parking is a bit of a challenge. But in all, if you like good food, a place to visit.",50,Nov-17,4,Yellow Chilli Restaurant
nneejima,Lovely,"Great local dishes. The ambience was good, prices were at par with the location. The service and the decor was also nice.",40,Dec-16,4,Yellow Chilli Restaurant
Kgb0718,Great Place for Tasty Local Food!,I was here on a Saturday afternoon to eat lunch. For those looking to sample local cuisine at its finest look no further. I had the Fisherman Okro stew ( a local seafood delicacy teeming with fresh fish and vegetables) and Pounded yam. I advise...More,40,Jan-17,4,Yellow Chilli Restaurant
Ruby D,Fun family oriented,"Authentic Nigerian and other African dishes. Served in a stylish, rustic seeming environment. 
Good service, despite the heavy patronage.",30,Nov-17,4,Yellow Chilli Restaurant
akintayoc,Mr,"Nice place and the food is filling and tasty good place to have family eat out lunch on a Sunday , although the parking area in the Victoria island location is truly limited and could be frustrating when called while having your meal to come...More",40,Dec-16,4,Yellow Chilli Restaurant
itsemeka,Good food,Great local food in a serene environment. The whole menu is on point! The dishes are very tasty and the portions are well sized,45,Oct-17,4,Yellow Chilli Restaurant
benheredonethat,Good Local Food. Decent Service. Cold Beer.,"I was there for lunch on a Saturday afternoon during a business trip from the US and I must say that while this is a pretty low key spot with very functional hospitality, it far exceeded my expectations on the food front. Although a little...More",35,Aug-17,4,Yellow Chilli Restaurant
Osayomore O,The food,The food is lovely. Especially the soups i.e. the fishermans okro. The meals served are actually sizeable. The waiters can be non nonchalant though. Overall the experience was nice.,40,Sep-17,4,Yellow Chilli Restaurant
Christophernd,The Yellow chilli Victoria Island,"Clean environment,courteous staff and good food.I have come here several times and the standards are still kept in terms of service. convenient for lunch and dinner meet up or date in the Victoria island area.",40,Jul-17,4,Yellow Chilli Restaurant
Keishey00,Okay,"Came here... I ordered the seafood okra with pounded yam which was nice (prep time
Lists 25 minutes) My pounded yam felt like it had been sitting there for a while.. The pictures got me here. My friend had jollof and beef stew. Her portion...More",30,Oct-17,4,Yellow Chilli Restaurant
485cheryla,Delicious food and service,This was my second visit to this restaurant. Once again they did not disappoint. The peppered snails were delectable. The okra soup with the seafood was delicious filled with juicy jumbo prawns. The service was excellent. They help with parking and had an umbrella to...More,50,Oct-17,4,Yellow Chilli Restaurant
idowu a,Local cuisine,"It's a nice place to eat natural, freshly made, moderately hot spices, and tasty African best food. Several visits showed consistency in quality of food. Waiting time is fair but could be better. It's a destination to enjoying local meals with great tastes",50,Sep-17,4,Yellow Chilli Restaurant
damola a,Great fried rice and fresh jumbo shrimps,I stop over en-route to Murtala Muhammad Airport and this has become my comfort food.  I enjoy the big bay windows upstairs and the quiet isolation that gives you the impression that you are not in Lagos.  The food is quite decent and the service...More,50,Nov-16,4,Yellow Chilli Restaurant
Ifeoma A,Service on point in Yellow Chilli,I visited the restaurant and I was welcomed by a waiter who immediately took my order. The food was served right on time. Iwas impressed with timing and the quality of the sea food Okro which I ordered. I have been back several times after,30,Aug-17,4,Yellow Chilli Restaurant
Onome O,Good food + it's affordable,"Ambience 4/5
Food 4/5
Price 5/5
Service 3/5
Menu & Variety 3/5

Yellow Chilli is a cool spot for having lunch/dinner with friends and family.",30,Aug-17,4,Yellow Chilli Restaurant
regina u,Best healthy local food in Lagos,"Splendid restaurant with well prepared, healthy and delicious local Nigerian meals. I will recommend everyone to try their meals.",50,Nov-16,4,Yellow Chilli Restaurant
Demolani,Great tasting Nigerian dishes,"Great tasting food, nice ambience. So if you are looking for good Nigerian dishes at a price that wont dent your pocket, yellow chili is the place to be.",40,Nov-16,4,Yellow Chilli Restaurant
760victoro,Great Nigerian Foods,"The mix of food types taste really great and tucked in a cool, calm and safe environment at Ikeja GRA, Lagos",40,Aug-17,4,Yellow Chilli Restaurant
Ade2566,Good Food!,If you're looking for good local and continental cuisine at an affordable price then Yellow Chili is the place! Two locations in Lagos at Victoria Island and Ikeja GRA which is a larger facility than Victoria Island. Pleasant staff always.,40,Sep-17,4,Yellow Chilli Restaurant
GEN2K4,Could be better,"Hmmm ok.. i like yellow chilli, the ambience and their food is amazing but i feel they can do better with their menu, its so limited..",40,Sep-17,4,Yellow Chilli Restaurant
Lorretta A,Mrs,"Is just a place to be!,cool n calm, well behaved staff,best treat so ever,truly, a wonderful place to be.",45,Sep-17,4,Yellow Chilli Restaurant
Hilda D,Yummy meals😂,"Lovely meals. Good location. We ordered the fisherman pepper soup , seafood Okra and jollof fiesta rice. Well presented and tasty.",35,Sep-17,4,Yellow Chilli Restaurant
Theresa E,i was well welcomed and the staff very friendly,"the atmosphere was okay, music on the background and i was served on time and the food was quite fresh and delicious",40,Mar-17,4,Yellow Chilli Restaurant
Adebayo O,Sweet,The meals are really tasty and good. i like the sea food menu. the local delicacies are very nice as well. I didn't have to travel as i stay in Lagos and place orders for the food.,40,Oct-16,4,Yellow Chilli Restaurant
Chinma A,Best seafood okra,"The food is generally quite good. It is hardly fine dining but if you want great tasting meals, this is where to go. They've managed to remain consistent through the years too.",30,Dec-16,4,Yellow Chilli Restaurant
Lex N,Great place to eat,My bridal shower was posted at Yellow Chilli. He food was great and the service providers were polite. Great place,50,Oct-16,4,Yellow Chilli Restaurant
Felixo37,"Good Food, nice location","My friends and I had lunch here on the 22nd of August,2017 and it was an amazing experience. The food was very delicious although it took a while in coming. The environment is also perfect for such occasion.

I regard it as a home away...More",50,Aug-17,4,Yellow Chilli Restaurant
shayeeboy,Enjoyed the food,I would say this Restaurant is quite good for dates and small groups. I had a delicious meal of pounded yam and also had their pepper-soup which was very nice,40,Apr-17,4,Yellow Chilli Restaurant
Abipharm,Culinary Artistry,"Yellow Chilli offers variety of a-la-carte offerings ranging from domestic to intercontinental, as well as a blend of the two. I particularly love their Seafood Okra soup with pounded yam!",40,Aug-17,4,Yellow Chilli Restaurant
Ocukomadu,Another family lunch,Went to the restaurant with a family group of 8 including 4 children. Service was good. The food was great. There are many shades of Nigerian food and drinks. Restaurant is spacious and we had a table that sat all 8 of us. They had...More,40,Aug-17,4,Yellow Chilli Restaurant
770remia,Solid four star restaurant,Visited in May 2017 for a business lunch. Service was good with a robust menu offering. Though a little slow on food service. Food and drinks were delicious and tasteful. Would return.,50,May-17,4,Yellow Chilli Restaurant
Ademola O,Nice Restaurant,Yellow Chilli is a very nice restaurant off the popular street of Adeola Odeku Victoria Island Lagos. Very comfortable and pocket friendly.,50,Dec-16,4,Yellow Chilli Restaurant
TayoZubair,Great atmosphere and excellent menu list,"I always look towards giving myself some good treat when i visit the restaurant. The foods are wonderful. The staffs are great, too.",40,Aug-17,4,Yellow Chilli Restaurant
Andrea Chika C,Fabulous food with great service,"I go to Yellow Chill as often as i can when i am in Lagos, Nigeria (whether on the Island or Mainland). The Igbo soups served here are a definite always have for me. i recommend you try the ''Seafood Okro'', ''Ugba'',  ''Jellof rice mix''...More",40,Jul-17,4,Yellow Chilli Restaurant
Labattuta,Tasty dishes and Great service,"Went as a group of four with my Co- workers. The menu was rich with lots of tasty optioms. Service was quick and courteous. The food was amazing. We thoroughly enjoyed our orders.

Cons:
The internal decor and furnishings are a bit tired and need...More",40,Aug-17,4,Yellow Chilli Restaurant
Subomi P,Great Place to Sample Nigerian Food,The original Yellow Chilli on the Island is a cosy place to sample Nigerian food. (There's a newer avant-garde outlet in GRA Ikeja.) The Island location looks a bit tired. The food is good but be prepared to wait 45 minutes for your meal. The...More,45,Jan-17,4,Yellow Chilli Restaurant
eoo1,Wholesome Nigerian food,"I've been coming here for years now. Good wholesome Nigerian food, tastefully served. Friendly environment",35,Jun-17,4,Yellow Chilli Restaurant
LoveToTravelBoston,Excellent local cooking in Ikeja,"We had a wonderful dinner at the Ikeja branch of the Yellow Chilli.
The environment is very pleasant - plenty of space between tables, good lighting and comfortable seating.
A good bar provided cocktails, beer and wine.
All food is cooked fresh, so it takes...More",40,Aug-17,4,Yellow Chilli Restaurant
Chibuikemr,Nice African dishes,"A place to feel at home with nice African dishes when away from home.
Access to the restaurant is good.

Timing is suitable for personal and business need. Friendly staff and good service delivery.",40,Jun-17,4,Yellow Chilli Restaurant
yink342,Nice Restaurant,Excellent Restaurant. Recommend Yellow chilli restaurant both in Victoria Island & Ikeja to Traveller.,40,Jun-17,4,Yellow Chilli Restaurant
OLUFEMI J,Lovely lunch with wifey!,The Yellow Chillies is an upscale restaurant and bar located in the business area of Victoria Island. The Nigerian menu is loaded with many delicacies. My favourite is the Seafood Okro with Pounded yam!,40,Jun-17,4,Yellow Chilli Restaurant
Jerome O,Not As U Think It Is!,"From the name: ""Yellow Chilli"" you might think you will be greeted with a menu of yellow dishes spiced up with ""Chilli"". Nope!

They serve a variety of dishes like any restaurant in its category.

Though the building is painted yellow inside out.

One little...More",40,Sep-16,4,Yellow Chilli Restaurant
sylkismoothe,Girls hangout,"Nice cosy place. Friendly staff. Some of our orders took a while to come but food was tasty. I recommend for hangout with family, friends or colleagues",50,Oct-16,4,Yellow Chilli Restaurant
nanayaw_ok,Their delivery takes too long,Eaten twice from yellow chili. They're food is great and they offer a wide variety. Only problem is their delivery takes too long. Both times it took 2 hrs for my order to get to me and I was less than a 10 min drive...More,40,Jul-17,4,Yellow Chilli Restaurant
chriseyo1,Okay,I was at the Ikeja branch of Yellow Chilli on Joel Ogunaike Street to have lunch with a friend. The ambiance was cool and the staff were friendly. I had the chef combo plata with snail sauce and it was delicious. I have been going...More,50,Jun-17,4,Yellow Chilli Restaurant
365ifunanyaa,SUnday Lunch with My Family at Yellow Chilli,"Lovely environment, good service and tasty food. There is a wide variety of food and drinks and the prices are quite reasonable.",50,Apr-17,4,Yellow Chilli Restaurant
en5thg,best jollof rice,One of my favorite spots. The food here is delicious. The triangular molds of pounded yam with Afang soup is a wonderful delight. I also enjoyed the ogbono soup here. I enjoyed the gastronomic experience. Please keep it up!!,30,Jun-17,4,Yellow Chilli Restaurant
magieware,A delicious lunch experience,"I love the atmosphere in yellow chili. The staff are warm and welcoming, my favorite dish is the seafood okra. Always a delight. I must warn you though if you are very hungry call ahead to order as the food takes a bit of time...More",40,Mar-17,4,Yellow Chilli Restaurant
Oge O,Yellow Chilli,Cool environment. I love the sea food okro soup. I still relish it. Another visit or order is a must!,40,May-17,4,Yellow Chilli Restaurant
Trillionaire1,Koop chilli,"Good food, well prepared. Nice ambient.  Polite staffs .  Really had a nice time. Highly recommended. Will surely be back.",40,Mar-17,4,Yellow Chilli Restaurant
507esthers,Yummy,Very yummy hearty food.... I recommend the seafood okra with pounded yam... got a flat screen for entertainment. Calm chilled restaurant,45,Jun-16,4,Yellow Chilli Restaurant
Adeyemi O,Awesome food,"Lovely and very tasty continental dishes with a vast African spread on variety. 
Nice bar stock and suitable for evening out with friends.",35,Apr-16,4,Yellow Chilli Restaurant
Elizabeth O,Very tasty food,"If you are looking for good food nigerian style.... letting you all then that  they serve the real jollof rice fiesta... very nice.
Portions were good. They need to work on the Turn around time though...",40,May-17,4,Yellow Chilli Restaurant
Abere N,Drop in Standard,"Before my last visit, last time I visited this joint was in 2010 and my experience then was really good. I was however surprised at how stuffy the whole restaurant was when I stepped in. I didn't have that sweet smell that greets you when...More",40,Oct-16,4,Yellow Chilli Restaurant
