author_name,review_title,review_text,author_rating,visit_date,overall_rating,restaurant_name
hopej702,Amazing Restaurant (Must Go Here Every Time On Any Occasion),"This food is amazing. It reminds me of what I was eating when I was little. I love the rice and shrimp and the soup and beef, etc. It was delicious.  1000/10. More people should come and visit this place.",40,Dec-22,4,Yellow Chilli Restaurant
Amah88,Terrible,The girl at the counter literally chucked the paid cash to her under the counter table then came back to say the funds were not complete. So she literally stole some right in front of us and I counted this cash before handing it over.,45,Nov-22,4,Yellow Chilli Restaurant
chiomai593,Review on Yellow Chilli Restaurant,Yellow Chilli Restaurant is situated on the Island in Lagos. They boast of the finest cuisines in seafood and pepper soups. Their oxtail pepper soup was so savoury and nicely prepared with pepper to taste. What I enjoyed most about the oxtail is the softness...and tenderness. I really enjoyed each bite with the well blended spices that made my day worthwhile. It is a place to be and one of the best places to spend your money as far you are looking for well prepared dishes that are not the regulars.More,35,Mar-23,4,Yellow Chilli Restaurant
yemio976,Great African food at decent prices,A party of 6 went there for dinner - we had a French visitor who wanted to try African food. My efo-riro was simply delicious. Our french visitor had the seafood okra and snail. The snail was tasty (and spicy!). My colleague had Afang soup...and he was also raving about his. The service was great - the waiter made one error and promptly corrected it. I will go back this week for the afang soup to see what the fuss was about.More,40,Feb-23,4,Yellow Chilli Restaurant
Sam G,Can do better,Great food. Service slower than before and portions have gotten much smaller. Food is still great; one of the best in Lagos.,40,Nov-22,4,Yellow Chilli Restaurant
Amah88,"The girl at the counter is a thief, mannerless and hateful, and her manager does not mind the behaviour","So I went in with my family as we just came in from the UK, first it was the hostile welcome, then the thieving, I gave her cash for my food and she slipped the cash right under the counter while at the same time...acting like she was talking to a colleague, all to come back up and say the money was short a good deal amount, which is impossible for me to miss out on my end, I didn’t argue I just topped up the money but my husband saw her move the money and her manager was right there!,More",50,May-22,4,Yellow Chilli Restaurant
TemiOA,Yellow Chilli Ikeja branch - Good food and staff,"Good afternoon,

Please accept our sincere apologies for the negative experience you had with us. We set a high standard for customer service delivery and we are sorry this was not met in your interaction with our business. 

We appreciate you taking the time to...More",10,Feb-22,4,Yellow Chilli Restaurant
SAN-ENTINES,GENERALLY  EXCELLENT SERVICE & FOOD,"I was in Ikeja for about two and a half weeks and went to this restaurant 7 times for dinner. It is within walking distance from Ikeja Marriot hotel where we were staying so we went back many times because we enjoyed the food and...the staff were very professional.
It took many minutes (45 minutes to 1 hour) between ordering the food and when it is served, but I think this might be because of preparing the food fresh for each order.More",40,Jan-22,4,Yellow Chilli Restaurant
Lovejenxx,Waited almost 3 hours for my food,"I have visited several times,  alone and with company. The meals [for a fussy eater like me], has always been top notch. The 1 or 2 occasions I had a complaint [one on an order made by my daughter whilst I was out of the...country] to the supervisor, was dealt with professionally and a replacement given. Albeit this is for Ikeja. Atimes I order over the phone or send a text message and collection is.seamless.More",50,Jan-22,4,Yellow Chilli Restaurant
adamso2019,Awesomeness,"The worst service I have ever received in Lagos! It took three hours for us to all get our food on a Sunday, plus they served us warm Chapman because they had no ice. Honestly it was actually the worst experience the food was okay...but not worth a three hour wait. 

Would definitely not be going back there againMore",40,Feb-22,4,Yellow Chilli Restaurant
paulpQ4592WT,TERRIBLE,I had a fantastic time wining and dining with my co-volunteers. The experience was awesome. A serene environment and the food service was top-notch.,10,Jan-22,4,Yellow Chilli Restaurant
_abisheart,Standards have fallen .. disappointing,"I was not attended to by the staff for close to an hour of sitting with my foreign partner. I called the attention of a senior staff and i was not attended to still.

These guys don't just care .",50,Dec-21,4,Yellow Chilli Restaurant
Ayotola J,Total Customer Service Disaster!,"Ordered the seafood okro which is normally really good. The big prawns were not fresh and one of them actually smelled as if it had gone off. I couldn’t eat it . 
Brought it to their notice and they simply apologized but didn’t offer to...replace or even give a discount. 
Soup itself has fallen in qualify. Totally disappointing and won’t be going there againMore",40,Oct-21,4,Yellow Chilli Restaurant
George K,Dated Menu. Past Glory,Lousy lousy service!!!! What a disappointment!  Called the VI restaurant to place an order and then called back a minute later to confirm order and pick up for VI only to get to the restaurant 30 minutes later and the order had not been put...through the system.  This will be the last time I will be ordering anything from Yellow Chilli.More,10,Mar-21,4,Yellow Chilli Restaurant
olanikek2021,Food!,The Menu is dated. I’ve been coming here for years and at this point I’ll stop as they haven’t really seen the need to upgrade and are surviving on a strong brand and loyal client. They are taking those two factors for granted.,50,Jul-21,4,Yellow Chilli Restaurant
DamYoung,Freshly made and healthy food,"The food was so good I went multiple times during my visit to Lagos . They make the food freshly after being ordered and it didn’t take too much time. The edikainko was so fresh, I could taste all the flavours without it being soaked...More",40,Jun-21,4,Yellow Chilli Restaurant
coffff,My favorite,"They are 2 yellow chilli restaurants and both are nice with good food and reasonable prices compared to others.
Very good staff, cook, and location.",45,Nov-20,4,Yellow Chilli Restaurant
176cynthiai,Poorly prepared food,"They gave us a poorly cooked edikang Kong, with so much oil empty with no Stockfish or fish, the worst is it was not freshly cooked , then we where charged N3150, the pounded yam was worst 1250 for a poorly prepared pounded yam with...More",35,Mar-20,4,Yellow Chilli Restaurant
DidiDidz,Lovely food and atmosphere,"I came here to eat while on holiday in Nigeria. The atmosphere was lovely and so was the food! It’s a bit on the expensive side but well worth it. I had beans, hubby had jollof rice and the others had amala with seafood okra...More",40,Mar-20,4,Yellow Chilli Restaurant
emaded0r,Local delicacy,"My wife and i decided to go somewhere classy with a nice ambience but caters local delicacies. Yellow Chilli was it. My wife and I ate Pounded yam and vegetable soup, my daughter and son ate Amala and draw soup. Very tasty meals and good...More",40,Dec-19,4,Yellow Chilli Restaurant
popeourfriend,A lovely meal,Had some oriental rice with stewed fish for lunch yesterday when out with colleagues. The meal was so nicely prepared that I overeat. The staff very courteous and the atmosphere was relaxed... would likely go visit again ...,50,Mar-20,4,Yellow Chilli Restaurant
76winifreda,Horrible Customer Relations,"If there's a way to give a negative rating, I would. The customer service representatives are just outright rude. I ordered a meal from there and they sent a dispatch without a phone! They called me and told me to wait outside for the dispatch...More",50,Feb-20,4,Yellow Chilli Restaurant
458dee,"Oh my gosh.
The food is delish!","Oh my gosh.
The food is delish!
The portion sizes were great, the food tasty and the service of a very good standard
The facilities were also very good quality
I shall definitely visit again and would recommend to those of you who visit Nigeria...More",10,Feb-20,4,Yellow Chilli Restaurant
TayoZubair,Family lunch,"We always enjoy visiting Yellow Chilli. Great menu with good local varieties on offer. Good atmosphere. The cocktails menu is good too. Varieties to choose from.

One of my favorites in Lagos.",50,Dec-19,4,Yellow Chilli Restaurant
Sekinah O,"Great service, good food","The decor was good, quality of service was great and the food itself was fabulous. It was my son’s birthday and the service guys made it special for him with a wonderful rendition of happy birthday 🥳",40,Jan-20,4,Yellow Chilli Restaurant
KayOlu,Ok visit,"Had Sunday lunch here with family, food was good when it arrived, took forever for it to be served and twas happening to lots of us, they need to serve faster and ensure food is served once its ready.",40,Jan-20,4,Yellow Chilli Restaurant
Travelphile2009,Awesome Food,"Food is awesome.  Located in Victoria Island, so good access from hotels.  Good is downright best to date I have had in Lagos.   Downside:   Foreign credit cards not accepted.  So bring cash.",10,Dec-19,4,Yellow Chilli Restaurant
olutoyina758,Terrible service,Terrible service. Kept me wautinh for a plate of jollof rice fiesta for 1 hour 20 mins. I left when they could not produce the food.,50,Dec-19,4,Yellow Chilli Restaurant
Beswindler8867,Fine African food,I love the fresh food every time we order it’s always fresh n good .and clean  Thanks wonderful place to eat at also waiters are friendly and welcoming.atmosphire,40,Nov-19,4,Yellow Chilli Restaurant
394uchen,Yummy,"Really good restaurant experience. I had ofe nsala and peppered snails. My other half had their fiesta jollof rice. All dishes came out to around N14,000. It was really rich and filling. And cooked fresh as ordered.",50,Nov-19,4,Yellow Chilli Restaurant
Kingtobbie,Best place to have local dishes,"Great food local Nigerian dishes, resealable priced.
Just a long wait as meals are prepared freshly, I’ll recommend you call and make your order before getting there",40,Nov-19,4,Yellow Chilli Restaurant
Odeyemi A,Best time with my friends,Yellow chilli was actually the best i ever visited...food is 💯...I will love to come all time😍❤️🙏,45,Nov-19,4,Yellow Chilli Restaurant
anjaliviren,First try at Nigerian Cuisine,"This was my first try for Nigerian Cuisine, very pleasantly full of flavors, The Restaurant has the very upmarket feel to it. We tried 4 dishes among us and they were all very nice. Seafood Okro, Jollof rice with shrimps, Combo platter with snails and...More",35,Oct-19,4,Yellow Chilli Restaurant
Dealoceans,YELLOW CHILLI IKEJA,"Well well well, I have been to both V.I and Ikeja outlets and I must confess that I enjoyed Ikeja more. The environment, services, taste of meals and CHAPMAN is awesome.
They seem more professional and friendly while VI atmosphere is best ONLY at night....More",40,Oct-19,4,Yellow Chilli Restaurant
TingSiong,Local foods,"I heard from my local friends that I should give it a try. Which I did but probably not the place for me as I slept in toilet that night. I had jollof rice which were tasty though. My local friends had other dishes. However,...More",40,Aug-19,4,Yellow Chilli Restaurant
LancasterTee,Maintained Good Food,One of the few places in Lagos that has been able to maintain its quality over the years. I have been coming here for over 10 years and I’ll keep coming.,30,Jul-19,4,Yellow Chilli Restaurant
dwealth,Eat here if want to spend next few days in the toilet,"We had a night out here - those who had anything with fish felt really bad - my friend had fish pepper soup  - ill next day, me I had seafood okro which was cold - now on antibiotics and still barely able to eat...More",50,Oct-19,4,Yellow Chilli Restaurant
DoubleTCatering,My Go-To Seafood Okra Stew Spot,"I'm at a part of life where my body really prefers veggies and seafood, to carbs, sugar, and red meat. So, it was nice after a lot of the rice, bread, and beef I'd been eating, to have a hearty okra stew packed with jumbo...More",40,Sep-19,4,Yellow Chilli Restaurant
Lischen_Mueller32,Authentic and delicious!,We've already been there twice during our stay - and everything has been nothing short of mouthwatering (espc. Egusi soup and Jollof Rice Fiesta). The service is so friendly (especially Darlington!) and good at giving tips on what to eat. They have some nice background...More,40,Oct-19,4,Yellow Chilli Restaurant
David A,Great feedbacks from my Japanese clients,I recently visited the GRA Ikeja outlet with a Japanese couple visiting Nigeria for the 1st time. They enjoyed the seafood okra with pounded yam and fried rice fiester. They really enjoyed the meal.,30,Oct-19,4,Yellow Chilli Restaurant
nkslolo,A quaint location,"The food was quite decent, enjoyed it. Not sure if I will return for a second visit though, as it didn't have any stand-out meal for me anyways",40,Sep-19,4,Yellow Chilli Restaurant
BusinessGuy101777,Excellent,Great food and service. Really great. Food made with thought and catered to locals as well as foreigners. Highly recommend !,10,Sep-19,4,Yellow Chilli Restaurant
omamuzoe,Neat and Cute Place,"This restaurant came to me as surprise. I was on the Island and needed to eat. I googled and up came this restaurant. 

Service was prompt and the general ambiance was superb. The restaurant was neat and above all their efo riro was great. Food...More",50,Aug-19,4,Yellow Chilli Restaurant
T10ks,Top Nigerian cuisine,You have to be patience but the wait was worth it  we all left satisfied and with a full belly and raving about paying another visit whenever we are in top,50,Aug-19,4,Yellow Chilli Restaurant
Ishan_Johri,Excellent,"Yellow chilli restaurant and bar is located in great location, staff is friendly, dishes is very different.",40,Aug-19,4,Yellow Chilli Restaurant
Damian U,STILL THE BEST LOCAL DELICACY BERTH IN LAGOS BUT..........,Visited the Ikeja Branch. Food still Wow but quantity now so small that you may end up ordering for a top up. Ambiance still good and inviting. Good location,40,Aug-19,4,Yellow Chilli Restaurant
duduyemo,Mrs,"Yellow chili is gone!!! It needs a revamp, it’s sad, thought the one in ikeja was bad but both are sad , won’t go back , ambiance is gloomy.",45,Aug-19,4,Yellow Chilli Restaurant
Segun A,YESTERDAY AT OJU OLOBUN RESTAURANT,"I visited the Oju Olobun Branch for the second time ever, yesterday, and had my usual choice, Seafood Okro. For whatever the reason might be, something was obviously beggining to be missing/ It was not as delicious as it used to be. I have observed...More",35,Aug-19,4,Yellow Chilli Restaurant
Mdm_Belle,"Seafood okro, stuff of dreams","We ordered take out book ending our family visit to Nigeria. My children who do not eat spicy food could not get enough of the rice, which is spicy. 

A nice touch at the Ikeja restaurant was the Manager introduced himself to us. 

I am...More",40,Jul-19,4,Yellow Chilli Restaurant
TaofickO,Rich Nigerian/African Food,"Yellow Chilli I believe has been around for quite a while now. The serve both Nigerian and African cuisine. 
The set up is fairly upscale for a Nigerian restaurant but dated. It comprises of a lower and upper eating area. Adequate staffing, they sometimes forget...More",40,Jun-19,4,Yellow Chilli Restaurant
Vinod K,Good African Food,Small cozy joint which serves variety of African food. I ate here two times and both times food was good. Service is so so so slow. Staff is lovely.,40,May-19,4,Yellow Chilli Restaurant
Kingsley A,Very tasty,This is one of the best places to eat and socialize with friends. The food is tasty and the staff is very courteous. I'd call again.,20,Apr-19,4,Yellow Chilli Restaurant
DamYoung,Good Food and Dining...,"My friend had hyped up the place so we went to the one in ikeja, It was good but more average than spectacular.  The Seafood okro was good and tasty. portions were small and drink menu was limited, server was not attentive on the day....More",30,May-19,4,Yellow Chilli Restaurant
inayellowsari,Great for local food but a bit limited if you are veggie/vegetarian/vegan,"Went here with a Nigerian colleague and we had a fab lunch. It is a very meat/fish focused menu but we found some veggie options and the staff were happy to adapt dishes where they could.
It was clean and had a nice vibe but...More",50,May-19,4,Yellow Chilli Restaurant
foluke2016,Traditional food,"The restaurant was recommended by a family member some time back but never went there. Was very hungry and needed to taste some home cooking. Good choice - an array of typical Nigerian cuisine. 
Decor basic, Nigerian atmosphere whatever that may mean to you. Clean,...More",30,Apr-19,4,Yellow Chilli Restaurant
Ollie_girlie,Family lunch,This came recommended...the food was ok..it was a bit dark on the inside which could be the look they were going for..we had a good service from the staff and my family enjoyed the meal ☺. We will probably visit again and maybe I will...More,40,Apr-19,4,Yellow Chilli Restaurant
Ossama S,Disappointing,"The servers were so unprofessional, I arrived 10.15 pm and they said we are closed for the day in a very disappointing way despite the information online says they close by 11 and when I asked to speak to a manager they just left me...More",50,Apr-19,4,Yellow Chilli Restaurant
chineduu2016,A place for Nigerian Soups,"If you want to try Nigerian soups in all its glory, come here. They have a wide variety of swallow. We had the seafood okra and the egusi soup with goat meat. 

We were there around in the early evening around 7 . The service...More",40,Apr-19,4,Yellow Chilli Restaurant
bunmiOdez,Banga soup was a banger!!!,"Great service, great money for value and authentic local dish.
I enjoyed the banga seafood soup. It was really great.",50,Dec-18,4,Yellow Chilli Restaurant
ooobabatunde,Authentic food,"Haven't had local food outside in a while. I was very impressed with the quality. Real good pounded yam with palm wine to wash it down. 

Only thing is where we sat was a bit hot. Guys AC! AC! AC!",30,Mar-19,4,Yellow Chilli Restaurant
sammysam2019,The seafood okro is the bomb,My wife and I eat only two things when we come here and that's the jollof fiesta and the seafood okro. I must say that the seafood okro has stolen my heart. It's simply the best.,40,Feb-19,4,Yellow Chilli Restaurant
Rachieade,Just sweet!,"I came here with my friends for Sunday lunch and it was the best local food that I have tasted.
The atmosphere and ambiemce of the restaurant itself was calm and definitely a vibe
Our waiter was so kind and attentive. My cousin ordered a...More",45,Feb-19,4,Yellow Chilli Restaurant
allanwells,Disappointing,"I was told this place was 'Hot as a Chilli' however It did not live up to its reputation.

Beers were ICE COLD great, Crispy Shrimp even better and that is where it ends. I ordered Goat Curry and 80% of the meat was fat....More",35,Jan-19,4,Yellow Chilli Restaurant
Tony B,Nigerian food at Yellow Chilli,"When it comes to having local Nigerian food, I hit Yellow Chilli. For my foreign friends from across the world coming into Nigeria for the first time, I always treat them to a taste of the local food here with no fear. Lovely atmosphere, interesting...More",40,Oct-18,4,Yellow Chilli Restaurant
Adegboyega,"I visit regularly with my family, or sometimes alone or in the company of businees associates. My most recent visit was",Best place to eat Nigerian meals in an ambient setting. Customer service receives pertinent attention,40,Oct-18,4,Yellow Chilli Restaurant
treaze,Not bad,The Giant prawns were superb. It's a good place for family en the food doesn't take long tho our waitress was too serious. There was no background music but heck it gave us time to talk,50,Dec-18,4,Yellow Chilli Restaurant
samagbeyi o,Delicious meals all day,"So i had some pounded yam for lunch here sometime last month, it was absolutely delicious. I frowned at the bill though, LOL.",50,Oct-18,4,Yellow Chilli Restaurant
Virgil S,For an authentic African experience,"Too often in visiting far-off and exotic locales, as tourists we want to stay with the familiar restaurants, hotels, foods from our native countries; but we need to embrace adventure. Fortunately at the Yellow Chili, you can embrace those foods that are ""foreign"" to us...More",20,Nov-18,4,Yellow Chilli Restaurant
MOI2015304,Nice and cozy environment,The environment was ok. I had the white rice and Ofada stew which was not as tasty as my cooking. I would say it was average but a lot of people like the place so you can give it a try. Mine might be because...More,40,Oct-18,4,Yellow Chilli Restaurant
annmajek,Seafood Okra Soup,I missed going to the Yellow Chili in 2017 but not this time!  We went on the afternoon on two occasions and were seated immediately.  Our server was Salomi.  This was the Ikeja location.  I ordered the Seafood Okra soup and my companions had Ogbono...More,50,Nov-18,4,Yellow Chilli Restaurant
Ikemokeke,That chilli is not yellow!,"They serve most regular Nigerian delicacies,
With a passion innovative twist....a good example..
Okro soup is a popular delicacy in Nigeria, but at the chilli
They serve it with lovely fresh shrimps!
It's an ideal place for an informal business lunch.
A good first introduction...More",30,Mar-18,4,Yellow Chilli Restaurant
NonemekCreativity,I really like it at Yellow Chilli,"I LOVE it at Yellow Chilli V.I. for the ambience. 
The Ikeja place is a bit of more upscale in service and menu, I got the value... for a modest dining.",50,Feb-18,4,Yellow Chilli Restaurant
Onyinye C,Great food. Long wait times,"Cannot beat Yellow Chilli food but it is best to call ahead so they have your meal ready, otherwise, next ready to wait up to 20 minutes. Nigeria food takes time!",30,Mar-18,4,Yellow Chilli Restaurant
Johnny-be-Good17,The usual Nigerian food for a high price,The yellow chilli serves the food you will get all over Nigeria. I had the jollof rice with chicken while my friend took the pounded yam with egusi soup. The food was okay but not better or more sophisticated than in any other Nigerian restaurant...More,30,Sep-18,4,Yellow Chilli Restaurant
daniellordis,Lunch Time,"I'm a fan of Yellow Chilli Ikeja. The Island outlet is a bit of a disappointment as I didn't quite get value... quite overpriced.

I ordered Edikaikong soup but didn't quite understand what soup I got. Pointed the attention of the waiter to it.. to...More",50,Aug-18,4,Yellow Chilli Restaurant
janmuysken,Great Nigerian Food - the real deal !,"We have been Yellow Chilli regulars for years, both on VI and the mainland, also home delivery. We go there for both lunch and dinner and we have never been disappointed.
The menus are the same at both restaurants and has a number of favorites...More",40,May-18,4,Yellow Chilli Restaurant
Abraham A,Alex,"Poor quality service
My food was to oily
My breaded prawn wasn’t washed properly
Took so long to bring a bottle of water
Not a place I’ll visit again",45,Aug-18,4,Yellow Chilli Restaurant
530clemens,Awesome Nigerian food,"Perfect place to get a good taste of Nigerian kitchen. Prompt service and  reasonable 
prices. Get ready to est your meal on traditional way with your hands.",35,Jul-18,4,Yellow Chilli Restaurant
adeshols,Disappointing,Yellow chilli was always a favourite of mine when I needed good quality Nigerian food. Last few visits on the island and mainland have been disappointing. Food has been bland and service has been poor. I hope something gets done fast.,40,Sep-17,4,Yellow Chilli Restaurant
belloayo,The Seafood....,"The seafood okra ehn.... Really lovely environment, service is prompt, the food is great and alot cheaper than i expected. Parking is the only issue",40,Jun-18,4,Yellow Chilli Restaurant
lewah_explora,Birthday,"I went to yellow chili ikeja for my birthday and they sure made it a memorable one for me
The atmosphere was great
Their service was top notch 
Food was amazing 
All my friends had a nice time and I was pleased",50,Jul-17,4,Yellow Chilli Restaurant
missdeola,Prefer the Ikeja restaurant to the V.I. restaurant,"What's not to love about Yellow chilli? The food, the decor and the ambience. I also think the foods prepared at the Ikeja outlet tastes better than the one on the island.",10,Sep-17,4,Yellow Chilli Restaurant
LordBodeOjuri,Dinner with friends,"Dinner after work with friends, atmosphere was ok, and food was delicious. Customer service needs a little improvement and it offers parking. Food cost was reasonable and loved that seafood okra.",50,Jun-18,4,Yellow Chilli Restaurant
Justina A,"Lagos, Nigeria","The ambience was great 👍🏼, quite spacious too. However, the food did not meet my taste expectations. Overall I’d give a score of 7/10 for the experience.",20,Apr-18,4,Yellow Chilli Restaurant
dadachu,"Food and service were ""just okay"" -",Nigerian cuisine - okay standard.  Basic decor and ambience.  Food is well prepared - nothing special.,40,May-18,4,Yellow Chilli Restaurant
ceotiffygroup,Group Party,"Had my department end of the year party there.
Yellow Chilli is a cozy restaurant where you can enjoy a quiet time with friends and families.",50,Dec-17,4,Yellow Chilli Restaurant
Titilola C,YUMMY,"We started the meal with me ordering Nkwobi and my cousin ordered fresh fish peppersoup. The pepersoup was nice and came with a bread basket.The Nkwobi tasted nice but was mostly just ponmo and some of them too hard to eat, tasty anyway. The chapman...More",40,May-18,4,Yellow Chilli Restaurant
