author_name,review_title,review_text,author_rating,visit_date,overall_rating,restaurant_name
496marvid,Not a bad word to say!!,"The food is fabulous and the service is even better. Very reasonable prices and portion sizes are very big. The cocktails taste great ( some are very strong, definitely not like the weak cocktails from England)! For someone who doesn't like a lot of spice...More",40,May-17,4,Yellow Chilli Restaurant
Damian U,Exquisite African Taste,"food is great. A mixture of Nigerian and continental cuisine. The Nigerian foods are excellently prepared and the tastes are out of this world. They also have a variety of dishes tailored to their culinary experience; when you taste them, GOSH! they are out of...More",50,Dec-16,4,Yellow Chilli Restaurant
882lucu,full belly,"The food at the yellow chilli was very fresh and delicious, the decor was modern and clean and there was a nice ambience. the African menu was reasonably priced and good value for money. we enjoyed our visit here.",40,Apr-17,4,Yellow Chilli Restaurant
toyino746,The restaurant is very neat with nice hospitality and good right on time service,"I had a very warm welcome,I enjoyed my assorted seafood okro with amala. The restaurant is very neat and the service was right on time.I recommend the restaurant to all. The atmosphere is serene . I saw their bar from afar and could see its...More",40,Oct-16,4,Yellow Chilli Restaurant
Lola O,Mrs,"Yellow Chilli Restaurant in Ikeja is beautiful & clean with a lovely ambience. I was there with friends & we all enjoyed our meal. I had seafood okro soup popularly known as fisherman soup & it was hmmm, excellent. I look forward to going there...More",20,Oct-16,4,Yellow Chilli Restaurant
bola2017,Authentic Nigerian cuisine,"Clean good food , always an experience to eat here. And they open late  till 10pm . 
Great place to hang out and meet friend s",50,Apr-17,4,Yellow Chilli Restaurant
funlove,Disappointing,"In the last couple of years, I had heard so much about Yellow Chilli that I made a firm mental note to visit when next I was in Nigeria. And so here I was on the afternoon of Wednesday 5th April with my sister, her...More",40,Apr-17,4,Yellow Chilli Restaurant
137erica,Chic,"I love this restaurant set in residential area of Ikeja GRA in the mainland part of Lagos. The area itself is 'upmarket' by lagos mainland standards.
The restaurant has both outdoor and indoor dining facilities with nice family round table seating arrangement  as well as...More",40,Mar-17,4,Yellow Chilli Restaurant
godsonu,"Good Food, on the regular.","Yellow Chilli's good. Food is authentic, especially for local cuisine. If you're visiting Nigeria and wish to experience the local dishes, YC will give you the full-on, authoritative experience. This is a fact. And for good measure, I'll recommend their seafood Okra. It's their star...More",40,Mar-17,4,Yellow Chilli Restaurant
funmil0lab,Classic restaurant,"I always love going to Yellow Chiili. I particularly love the Ikeja restaurant. The truth is the food takes forever to come but it is always value for money. The staff are courteous, not very friendly anyway.

I love the fried yam and fresh fish...More",40,Feb-17,4,Yellow Chilli Restaurant
780zainaby,Didn't get the hype,Very basic looking restaurant and quite expensive for what you get. I was quite disappointed by the seafood okra after all the hype I had heard. Chapman was also very meehr!,40,Jan-17,4,Yellow Chilli Restaurant
A_Jols,Seafood okro soup is THE TRUTH!,"My friend and I went to The Yellow Chilli to have lunch the other day. It's not our first time there. The seafood okro soup is THE TRUTH! If you haven't tried it, you're carrying last. That's all!",45,Mar-17,4,Yellow Chilli Restaurant
omohunola,Amazing seafood okro!,"For someone who isn't such a big fan of seafood, I thoroughly enjoyed their seafood okro! It was fresh and more than enough in a plate. I was at the Ikeja branch which had a lot of space and very impressive service. It was raining...More",35,Mar-17,4,Yellow Chilli Restaurant
Kingsley Ugo. M,Good place to eat,"Good place to eat, I like the atmosphere.. It's a cool place to eat relax get to spend time with family..",40,Dec-16,4,Yellow Chilli Restaurant
jideog,Great African dishes,"The food is awesome, especially the sea food Okro with any swallow (pounded yam, wheat or semovita). The staff are also very friendly. If you visit the place frequently, try and get their number so you can place your order ahead before getting there. This...More",40,Feb-17,4,Yellow Chilli Restaurant
Ian L,Decent Nigerian Food,"Yellow Chilli used to be a lot better. The standards have slipped somewhat in the last couple of years. Still, remains a decent enough place to grab some authentic Naija grub.",30,Feb-17,4,Yellow Chilli Restaurant
mayowao675,Pleasant,Three of us visited yellow chili in January - one of us resident in but visiting from Sierra Leone. I had a fish pepper soup while my wife had the fisherman's pepper soup. We convinced our guest to have pounded yam and afang soup. He...More,40,Jan-17,4,Yellow Chilli Restaurant
Chinchin09,The Lunch place,"This is a great place to have Lunch. It offers an assortment of Nigerian dishes, soups, pepper soup, rice, beans etc. Decor is African theme and quite nice.",40,Dec-16,4,Yellow Chilli Restaurant
Warren K,Very local very authentic not bad,"Nice place on VI to sample the interesting and tasty local fare. It seemed that the standards (jollof rice, chilli chicken) were better than the more exotic stuff (Nigerian soups, seafood etc) but all in all not bad.",40,Feb-17,4,Yellow Chilli Restaurant
mjacob007,Expections let down,"We went to yellow chilli and hopes were high. have to say, we were disappointed. décor falling apart. service was almost non-existing on a day that was not busy. not sure if it was the effect of recession. .",40,Feb-17,4,Yellow Chilli Restaurant
Piedrarip,Seafood okro soup,"This restaurant was recommended to us as a place where we can have a seafood okro soup. And it was delicious! 
We fell in love with this delicacy during trip to Akwa Ibom state and couldn't find any place in Lagos where  they prepare it....More",30,Feb-17,4,Yellow Chilli Restaurant
kevodo,Average,"My husband and I went to have lunch at the Ikeja outlet of Yellow chilli. It was an average experience. The security and other staff were quite polite, parking space is quite big. However, we waited for nearly an hour for our food, a d...More",40,Feb-17,4,Yellow Chilli Restaurant
Eugene A,"The lead and consistent formal restaurant for Nigeria cuisines on Victoria Island, Lagos","It is a proper restaurant that have been in existence for over a decade. It specializes in Nigeria cuisines , It has a bar for hanging out in the evening but elitist in its clientele.It is located in the business district of Victoria island in...More",40,Aug-16,4,Yellow Chilli Restaurant
ShineRrajan,Great Place!,"Best place to visit with friends for an authentic taste of Nigerian delicacies. Good and lovely dishes on menu. A wonderful experience for a first timer! 
Preferred the Ikeja branch to Ikoyi though!",30,Jun-16,4,Yellow Chilli Restaurant
adey_naija,Favourite Eatery on the Island,"Yellow Chilli has been a favourite for about a decade on the island. It is the place for Nigerian cuisine done with a twist. The chef is creative without compromising the authenticity of local dish experience.

It is located on a quiet street and so...More",20,Mar-16,4,Yellow Chilli Restaurant
dakcee,Lunch,Lots of quality varieties of food available to choose from. The service was also good with a neat environment,40,Mar-16,4,Yellow Chilli Restaurant
Izuwa A,Good Place to relax,"We had a dinner here with members of my department. Definitely have been to better places with better meals. 

Their chicken wings are spicy like most Nigerian meals. If you're not chilli pepper friendly, stay off the chicken wings.

Aside the chicken wings, which i...More",45,Nov-16,4,Yellow Chilli Restaurant
Agb0mma,Love it!,Thanks for your review. Please if you know a better place that offers our kind of menu in Lagos notify us so that we can improve. Thank you!,35,Feb-16,4,Yellow Chilli Restaurant
midew,Overated (Ikeja branch),"Yellow Chilli is the place to go for authentic Nigerian cuisine! Lovely food, pleasant staff and great ambiance. The seafood okro soup is a real winner!",40,Dec-16,4,Yellow Chilli Restaurant
outdoorCocoon,Brilliant,"Restaurant is overated,  parking might be a problem depending on what time of the day you go,  furniture is looking worn out and needs a change. 30 minute meals take almost 2 hours to be served with waiters watching TV and couldn't be bothered about...More",40,Nov-16,4,Yellow Chilli Restaurant
Menbachlou,Sumptuous,"Loved the authentic wall presented Nigerian dishes and the restaurant itself. I preceded the Ikeja branch tI the more popular and older Victoria Island branch.

A great experience. Brilliant staff. Affordable food. Great cuisine.

Lots to try out.",40,Sep-16,4,Yellow Chilli Restaurant
AmusaA,Good lunch,"The yellow chili restaurant provide a wide variety of local cuisine.

The ugba (locust bean) dish prepared with stock fish and the ISI egwu is so succulent.

The soups with swallow and other rice dishes are also worth munching.

Service is on point with courteous...More",30,Dec-16,4,Yellow Chilli Restaurant
saxxin-,Unimpressive...,"Best , to my own choice it's no 1 in lagos non can be compared to it, best of lagos ,as far as am concerned .",50,Nov-16,4,Yellow Chilli Restaurant
tdmac,"Doing well, then bombed!","'Had previously dined here on a couple of occasions with friends, but took the family here for a Sunday luncheon.[V.I. outlet]
Turned out to be their undoing as my wife a veritable foodie/critic tore the day's offerings apart as all the issues I previously ignored...More",20,Nov-16,4,Yellow Chilli Restaurant
bhumie,Nigerian Cuisine,"I've been to both locations. Once to the one in VI and several times to the one in Ikeja. I think the one in VI serves larger portions, the one in Ikeja has a nicer atmosphere. I am very fond of the seafood okro and...More",50,May-16,4,Yellow Chilli Restaurant
1onechance,Business lunch,Thank you. Please can you help us state specifically the branch in which you had this experience and the date. Thank you once again.,40,Nov-16,4,Yellow Chilli Restaurant
AnitaMunetsi,Great Local Cuisine,"One of the best restaurants in Lagos with mouth watering Nigeria cuisine. I would recommend jollof rice fiesta, seafood okro soup with eba.",50,Oct-16,4,Yellow Chilli Restaurant
obayeni,LUNCH,"We were invited to a meeting here and it turned out to be a nice surprise.  It's probably the most affordable decent place in VI.  Food was good.  It caters more to a Nigerian pallette,  but there are some options that would appeal to non...More",30,Nov-16,4,Yellow Chilli Restaurant
Jazzkuffy,Mouth Watering Nigerian Cuisine,"If you are looking for local cuisine, this is the the best place to be. Good food, value for money.  A must visit when one is in Lagos.",30,May-16,4,Yellow Chilli Restaurant
Bukola O,Seafood Okro ..... Yummy !👍😜,Love their hollow rice fiesta and the environment.Food is well made and affordable.You can also watch the EPL while having your meal.,50,Nov-16,4,Yellow Chilli Restaurant
676badea,Authentic Nigerian cuisines,If you travelling via Lagos Nigeria and you want to have a good local Nigeria delicacies in a relatively good environment then you need to visit Yellow chilli. Best time for lunch is 12noon to 1pm before the place of crowed. Try their okra soup...More,40,Nov-16,4,Yellow Chilli Restaurant
876steve2016,Great African food served for a international audiance,The food was good and not over hot.  The effort went into providing a pleasant atmosphere  and the friendlty staff made all worth while,45,Oct-16,4,Yellow Chilli Restaurant
bodunrinbs12,Sumptuous Dishes,I was there some days ago...the meal was sumptuous! most especially the fried rice and locally prepared goat meat. It was Wow!. It only took about 20 mins before the main meal was served. The could improve in that area.,35,Oct-16,4,Yellow Chilli Restaurant
Aminubaba,Yellow chili no joke,Yellow chili has its swag and locations are all well centralized in lagos. Try the sea food okro and then come back for their white soup you can't go wrong😊,40,Jul-16,4,Yellow Chilli Restaurant
Onlyoneodini,meals are nice,I have been there a number of times and the experience has been great. the food is tasty but it does take some time before you are served. I think the wait is worth it though. Sadly i doubt  that they deliver unless they do...More,40,Jan-16,4,Yellow Chilli Restaurant
ayoadeb2016,Yam Pottage,"GREAT yam pottage, it has assorted meat and it's of a good consistency, I'd recommend this with a side of plantain.",40,Dec-15,4,Yellow Chilli Restaurant
77beni,Locally Nice,Afdordable and classy place for lunch. Not mid friendly.  Good selection of local dishes. Try their snail you will not regret. Staff are friendly but could be in your face sometimes.,40,Sep-16,4,Yellow Chilli Restaurant
TaofickO,Local Nigerian delicacies,"Yellow Chilli is a nice Nigerian food restaurant. The portion of the food is good and taste beautiful. It opens even on Sundays,which is great as most food places are closed. They have a wide variety of Nigerian food served in decent appealing presentation. Price...More",40,Sep-16,4,Yellow Chilli Restaurant
Theodora C,Delicious Nigerian Meals,"I am such a foodie and when I want traditional nigerian foods, Yellow Chilli satisfiesmy cravings well.

You should try their sea food okra with pounded yam.",50,Oct-15,4,Yellow Chilli Restaurant
holidayfan09,Just so-so,"I visited this restaurant again after 3 years. Decided to order the famous seafood okra. It was okay. To be honest the best part of my meal was the stewed goat meat I ordered as an additional side. 

The portions are really large and good...More",40,Sep-16,4,Yellow Chilli Restaurant
Freeman G,Delicious Nigerian dishes,"Yellow Chilli offers delicious Nigerian meals, freshly prepared and excitingly presented. Their seafood okro is fantastic!",40,Aug-16,4,Yellow Chilli Restaurant
portly_monk,Great Food,Yellow Chilli Restaurant.....absolutely brilliant dining.  Whether on the Island or in Ikeja the prospect of a meal at Yellow Chilli is one that I look forward to every time i have the opportunity.  The Otong Soup or Seafood Okro or the Seafood Jollof with Plantain.......More,40,Sep-16,4,Yellow Chilli Restaurant
ESTHER E,Require Lunch?,Very nice food. They have very nice rice likened to Jamaican or jerking rice. Their okro soup is superb. Place is always crowded at lunch time but you can order your food and have it delivered to you.,40,Sep-16,4,Yellow Chilli Restaurant
Michael N,A Foodie's Delight,"Sumptuous meals, cool environment.

We were a party of Six and had separate orders. Chef's combo platter with prawns, Beans with fresh fish, obe dindin with white rice, yam pottage, an assortment of soups for those who wanted ""swallow"". Everyone loved their meal.

We either...More",40,Aug-16,4,Yellow Chilli Restaurant
Jydeoo,Good ambience & taste.,"I was looking for where to find good Nigerian meals, for a visiting friend and prospective business partner. Someone suggested Yellow Chilli, so we went there. We had a sumptuous dinner, well presented, delicious and attended to by attentive staff.
The decor of the dining...More",30,Sep-16,4,Yellow Chilli Restaurant
luvjaydee,Still remains outstanding......,"I wrote a review on this restaurant way back in 2013 which was my first time of eating here. My impression then, despite several visits afterwards, remains the same. It remains for me the best restaurant in Lagos if you want to eat local major...More",40,Sep-16,4,Yellow Chilli Restaurant
ANTHEASMITH,Nigerian fare,This is a very nice restaurant in the heart of Ikeja GRA. The menu includes a wide variety of dishes but focus is mainly the local flavours which are tasty and spicy. The restaurant is big with a bar the feature downstairs and the restaurant...More,45,Jun-16,4,Yellow Chilli Restaurant
Discoverlagosonline,Classic Nigerian cuisine with a twist,"Yellow Chilli is one of my 'must eat' places whenever I am in Lagos. The restaurant  has a cool, calm demeanour so it's a very chilled back atmosphere. 

The food is the average price for the type of restaurants you find on the island. You...More",35,Aug-16,4,Yellow Chilli Restaurant
Subomi P,Good place to sample Nigerian food,Try the restaurant's specialty - the seafood okro with pounded yam. There's a non-smoking section downstairs and a smoking section/bar upstairs where you can also watch football games on TV in the evening.,40,Feb-16,4,Yellow Chilli Restaurant
margaretolele,Fresh Home Cooking,"Yellow Chili remain those who ins the ideal place for people with very selective palate and those who see cooking as an art. The sea food okro soup, fisherman's pepper soup, the well seasoned snails as well as the unique tasty Jollof rice are irresistible...More",40,Aug-16,4,Yellow Chilli Restaurant
247Alexana,Finger-licking delights!,"I had the seafood Okro soup here and it was absolutely mind-blowing!!
I would recommend this for good home cooking...the price leaves a bit to be desired though",40,Aug-16,4,Yellow Chilli Restaurant
Uchay25,Exquisite,Clean and spacious environment. Good food. Variety. Healthy options. Traditional cuisine. Good service.,30,Jun-16,4,Yellow Chilli Restaurant
emadedor,Night out,Have dinner with friends or sit by the bar drinking your beer or spirit while watching the premier league,40,Nov-15,4,Yellow Chilli Restaurant
Joyeden88,Seafood okra just average,I have friends who swear by this seafood okra and I was really looking forward to trying it but it was just OK.,40,May-16,4,Yellow Chilli Restaurant
Rachel K,"Nice decor, average food",The food was honestly just average. Thebdecor inside is quite nice but the food disappointed me. Its fine if you're looking for traditional dishes as my bf seemed to enjoy his dish. I ordered meat with veggies and the meat was mostly that rubbery part...More,40,May-16,4,Yellow Chilli Restaurant
LiciaMerry,Good food. Service could use improvement,"Food is good. They don't deliver (at least that's what I was told when I called).
Service is average and needs improvement. The place could use a facelift and more lights.",50,Nov-15,4,Yellow Chilli Restaurant
wanded2016,Dinner date,"They have really nice continental and intercontinental dishes.
Their white soup and seafood okra are really nice.
The ambience is really relaxing.
It's a nice place for a brunch or dinner or even small gatherings e.g. a bridal shower.",40,Mar-16,4,Yellow Chilli Restaurant
Alfred A,To hang out with friends.,They have a wide variety of cuisine The food is excellent and the staff are friendly and cautious. The location is excellent.,40,Jul-15,4,Yellow Chilli Restaurant
Phyxssius,The food was okay,"The environment was good, good view too. The food was also nice but not outstanding. A bit pricey for what we ordered.",30,Jul-15,4,Yellow Chilli Restaurant
EnnovyLondon,Adore the food.,We ordered the seafood okra which was sublime. It could do with more pepper but that was easily rectified with more spicy sauce. Would definitely return to try other delicacies I could see and smell. Yum.,30,Dec-15,4,Yellow Chilli Restaurant
Thomas D,Place for Nigeria meal,"Here you get the real Nigeria meals, really delicious. Interior looks like a typical African place, Service is good but not outstanding. Bring cash when you go there or you have a local credit card.",40,Jun-16,4,Yellow Chilli Restaurant
Deb0laS,Classic Nigerian Restaurant,This is the best place to get authentic Nigerian cuisine. I love the fact they have been able to maintain standards for almost 20 year or more. Fantastic food with a take away option. Please try it when visiting Lagos.,45,Jun-16,4,Yellow Chilli Restaurant
bthoms,Go Nigerian!,"Yellow Chilli, a simple small restaurant serving authentic Nigerian food, seems to be a favorite among locals. This place was almost full when I visited for dinner. We had Jollof rice, spicy snails, breaded prawns, and chapman drink. Jollof rice was too good, so was...More",35,Jun-16,4,Yellow Chilli Restaurant
Ibadanboy,Excellent!,The yellow Chilli Restaurant & Bar is definitely one of my favorite places in Lagos to eat Nigerian food. Excellent!,40,May-16,4,Yellow Chilli Restaurant
TAGBA,Nice place to visit with friends,Decent place. Good food. Lots of varieties. Reasonably priced. Nothing posh though. A simple restaurant. Good place to visit with friends because you can let loose and have fun while waiting for your meal to be served. Certainly not a place to take a love...More,40,Oct-15,4,Yellow Chilli Restaurant
ELHERFI,favorite restaurant is Lagos,"This is my favorite restaurant in Lagos.
Offers a great variety of meals and also delivers quite efficiently.
the staff is very friendly.
My best meal is the Fisherman Pepper soup which I like  with extra chilli.
Memorable experience, will definitely come back whenever I...More",50,May-16,4,Yellow Chilli Restaurant
theglobalempress,Good ambiance!,Visited this place with a few friends for drinks. Nice ambiance. I'd like to return and try out the food next time! Good for group dinners and grabbing drink with friends. I'd recommend going to the third floor.,50,May-16,4,Yellow Chilli Restaurant
kevodo,Nice,Nice and home made meals. Food is affordable and well prepared. However the waiting time for the food can be improved and reduced.,50,Dec-15,4,Yellow Chilli Restaurant
bilqeeso,Try their Seafood Okra,"I have been to two branches in Lagos - Ikeja and Victoria Island

Service wise - i prefer the one in Ikeja . 

But there Seafood Okra is on point",40,Feb-16,4,Yellow Chilli Restaurant
Travellingsav,"Great local food, good prices, service wasn't amazing",The local food was delicious and the portions were big. Service wasn't great and there seemed to be a lot of arguing between the staff which slowed everything down. Definitely recommend visiting though. Also recommended to book in advance at weekends as it was busy...More,30,Apr-16,4,Yellow Chilli Restaurant
Feigne,Great place to eat nigerian!,The food is always good. Same taste and delivery.Clean.Parking is always a challenge though!Try the local dishes if you really want a taste of Nigerian cuisine.,50,Jan-16,4,Yellow Chilli Restaurant
bodeo2014,Pretty Good,"It has a nice interior, the food was also delicious and more than enough, which is good. I recommend it.",40,Aug-15,4,Yellow Chilli Restaurant
ositao2016,Exceptional in African dishes,"When am feeling African like real African cuisine, Yellow Chili  is the natural option and you can't go wrong any day",40,Apr-16,4,Yellow Chilli Restaurant
TK0123,Food to go,"Was going out of town so decided to take a piece of home with me. . The fisherman jollof rice remains no1 in my books. Also love the seafood Okra👌👌👌

Service was good. The order desk was quite efficient too.",40,Apr-16,4,Yellow Chilli Restaurant
TukeMorgan,Seafood Okra,"I don't go to Yellow Chilli often but I absolutely enjoy my food whenever I do go there.Their seafood okra is delicious, their portions are large, the food is affordable and it's authentic NIgerian cuisine, what's not to love. For pictures and a more comprehensive...More",40,Feb-16,4,Yellow Chilli Restaurant
12345gold,Yummy,The food is well prepared and fresh.The portion is more that enough for onr person so a goos place t go if you are really hungry,40,Mar-16,4,Yellow Chilli Restaurant
Bimbo A,Nice at Yellow Chilli,"Nice hot meals, Real African design and arty restaurant. Interstingly it's owner simply wishes to be addressed as d Chief Steward.  Ever Regretted a visit.
Bimbo Ayuba",45,Feb-16,4,Yellow Chilli Restaurant
ZurielKiru,"The Yellow Chili, V/Island, Lagos","Nice ethnic restaurant & bar located in the heart of Lagos and has served its teeming customers for close to two decades. Yellow chili sure knows how to work the palate, no matter the number of visits.  You may have to wait a bit longer...More",35,Apr-15,4,Yellow Chilli Restaurant
TyKukoyi,Good place for local food,"Would have rated them 5 stars but for the fact that you'll have to almost drop dead waiting for your food to come (they make the food from scratch). All the same, very good place if you want local cuisine.",40,Dec-15,4,Yellow Chilli Restaurant
nonzicock,Best restaurant for Seafood Okro Soup Worldwide,"You don't have to Nigerian, nor African to get converted to the world acclaimed Seafood Okro soup from Yellow Chilli.One of the reasons why YC will remain one of Africa's finest cuisine restaurant right in the heart of Lagos.",40,Feb-16,4,Yellow Chilli Restaurant
Jerry G,Good Local Restaurant,"I the opportunity to try the Yellow ""Chilli Restauran"", and was a great experience. 

The Yellow Chilli Restaurant is a good place to eat local & variety of food with good interior and look.",40,Mar-16,4,Yellow Chilli Restaurant
HolgerMM,Upmarket....for Lagos,"Typical local restaurant in the upmarket suburb of Ikeja. 
Mainly frequented by high flying locals. 
Safe parking off the street. Friendly staff. Kitchen offers mainly local food which is well prepared with good service. Pricing is on the upper side but the quality of the...More",40,Mar-16,4,Yellow Chilli Restaurant
bernnyfly,Best Nigerian resturant ever,"Looking for Nigerian dishes cooked just like home food, well served and decent portion..... You are definitely in the right place then. Their signature is sea food okro. Served fresh and havenly tasty! Sea food jollof rice. Peppered dry fish en all.... Thank you yellow...More",40,Mar-16,4,Yellow Chilli Restaurant
