author_name,review_title,review_text,author_rating,visit_date,overall_rating,restaurant_name
JusticeJoyce,"Out of Chips. Why, Lord?!","Out of Chips. How Sway?! 

Dined in on a Saturday night about 6pm.
Planned for this all week. Started to order chips and salsa + guac then asked,  ""or is it provided?""
Server: we're out madame. 
Me: for a few hours or until when? 
Server:...Tuesday 

Y'all! 

What works:
* Refried beans 
* Fajitas but not the bell peppers. They're bitter. 
* Live Band 
* Clean restroom 
* Outdoor patio 

What can improve:
* Separate the guac and sour cream for this price point they should arrive in their own ramekins. 
* More tortillas or make hand pressed flour tortillas instead of the store bought. It'd really elevate the fajitas.
* Prices. Although I recognize this is a hotel restaurant and they are catering to us travelers... TexMex is cost effective and accessible to all. The fine dining prices keep so many from enjoying the sabor desde TexMex. 

Quiero saber mas... hit me up: JusticeJoyceTV on YouTube.More",35,Aug-21,3.5,Crossroads Restaurant and Bar
Drew_Zinai,Staff was extremely rude,"The staff can really do better with their manners
They were really uncouth and ill-mannered.
It was appalling to say the least",40,Apr-21,3.5,Crossroads Restaurant and Bar
Maputo2016,Nice,"Excellent mexican restaurant. Went there twice and always up to the standard. Margaritas, tacos, nachos, burrito.... all very good",40,Jan-20,3.5,Crossroads Restaurant and Bar
241magdalenat,Expensive and no good burgers,"I had a burger at this place and I thought it would be a good one due to the price level. But no, it was cold, untasty and the the fries where cold and chewy with no salt. Go somewhere else is my recommendation!",35,Oct-19,3.5,Crossroads Restaurant and Bar
ElviK5,"Great music, good food!","I went for girls night out, such great vibes, food to match the music.  Great tastes of Mexican cuisine. I'll surely go again!",30,Sep-19,3.5,Crossroads Restaurant and Bar
Omelebele N,cross road,"very nice concept of both fine dinning and pub service with good music and large screen tv set to watch news, movies and sport",10,Apr-19,3.5,Crossroads Restaurant and Bar
Chris H,Really good Tex Mex Bar and Restaurant,"Dinner at Crossroads. I had the pork ribs which were tender, tasty and awesome. My colleague enjoyed tacos. Service was good, beer was cold and the prices are reasonable.",40,Mar-19,3.5,Crossroads Restaurant and Bar
joseagustina2015,Fish Tacos........ A JOKE!!!,"I order Grill Fish Tacos...??? Surprise I had a Salad with three little Tacos.... Not well done....!!!!
Forget this place, but may a say the Beer was cold!!!!
I'm glad I order some chips with Guacamole 🥑.
Definitely won't be here again.... Very Pricey for...what you get..... I warn you!!!!! ..... IF YOU decide to go this Pitfall.......!!!!! 
Huge Dissappoint.......!!!!More",10,Mar-19,3.5,Crossroads Restaurant and Bar
Mark H,Smoking allowed - disgusting,"Only one thing you need to know.  The restaurant tolerates people smoking at the tables despite the fact that it is illegal.  No matter the quality of the food or service, it is to be avoided like the plague.",50,Dec-18,3.5,Crossroads Restaurant and Bar
irishboy4,Flouting the ban on smoking law.,"There is total ban on smoking in bars and restaurants in Nigeria. This place actively encourages customers to smoke. Estimates say around 600,000 people die from inhaling second hand smoke each year, Crossroads was so smokey it was difficult to see. I asked the waitress...if there was a no smoking area and she said no. Likewise the manager said all were free to smoke. Nice music, nice food but expensive and chances are you will likely develop a lung condition or worse lung cancer.More",50,Oct-18,3.5,Crossroads Restaurant and Bar
OmanRob,Best meal of the trip,"Ate here one night and it was really really good

The chips and quesos were incredible and the other main courses were great too, beergueritas just finished it off. Service great too just sit well away from the band

Rob",40,May-18,3.5,Crossroads Restaurant and Bar
yassarh2016,Chill place,"I always go to cross roads while in lagos.
Their food is really tasty and they have a very big rectangular bar with all the drinks and mixes you would think about.

I always enjoyed my eves in cross roads.

Their food is excellent bit...their prices need to be reviewed. I paid Naira 30,000 for 2 mojito’s and 2 fajitas!! Around 85$More",10,Jul-18,3.5,Crossroads Restaurant and Bar
CSRam,First visit to cross roads,"Lot of parking available as this place is part of Eko Hotel., it has entrance from inside the hotel as well direct. Music is loud and nice just to make you swing.,took a high chair at the bar, good service by the barman, Draught beer...was nice and chilled and beer Glass looked large. ordered some fries along with it, which took some time and was not upto the mark.Better fries available in smaller places around this place.the ambiance , atmosphere was great ,was crowded like hell as it was a Friday Night. Great place to chill out for a couple of hours with no disturbance which we dont enjoy in other smaller joints.More",20,Jun-18,3.5,Crossroads Restaurant and Bar
KITTAPPA,worth going,"Food is nice , Cool & Hot ambience ( Full of girls on Friday night)  I like the Mexican  food  , very expensive compare to the same quality food served by other restaurants  in VI- Lagos",20,Apr-18,3.5,Crossroads Restaurant and Bar
wnbeirut2013,Nice ambience & food,"The food was very tasty with very nice presentation , it’s mainly Mexican food and like it much . It’s also a nice bar located in a vibrant busy Eko hotel . Much recommended .",50,Mar-18,3.5,Crossroads Restaurant and Bar
_kaiserrey,3.5 stars! Very cool ambience but beware of the loud music!,"Finally made it to Crossroads at Eko Hotel with some girlfriends. Immediately we walked in, you're greeted by lovely ladies. We had a table booked for 5 of us. A waiter showed us to our table. As a first time visitor, I really liked the...More",35,Feb-18,3.5,Crossroads Restaurant and Bar
outdoorCocoon,She wanted food and got humiliation instead.,"After what has now become a viral story of a lady called Toke Makinwa, being humiliated and bullied by another patron  (a chaperone to John Boyega and with the help of the waiting staff) Im kind of worried about this place.

I hope Cross Roads...More",40,Jan-18,3.5,Crossroads Restaurant and Bar
Philip M,Awful experience,"Was pretty excited to try this place out on Wednesday night as I heard there was a live band and a great vibe. Sadly, our night ended up being one to forget. Had made a reservation yet had to wait for a table, waiters whizzed...More",40,Nov-17,3.5,Crossroads Restaurant and Bar
jhwebbjr,Busy Night,"Met some friends here for drinks and food on a Wednesday, anticipating a lively atmosphere. It was lively, and the music was great. The food and service were not as great. Ordered chicken nachos and the chips on the top were soggy, as the plate...More",35,Oct-17,3.5,Crossroads Restaurant and Bar
4Abade,Vibey night spot,The cross roads is a vibey spot for anyone wishing to experience lagos by night ! Wednesday night seems to be the hit night so worth a visit if you looking for a lively pub,30,Sep-17,3.5,Crossroads Restaurant and Bar
KingOpe,Yummy,"The food here is the best... They do everything so right. Well cooked, delicious, divine!!! Overall good service and food",10,Dec-16,3.5,Crossroads Restaurant and Bar
380yemis,Wow!,"So We decided to do something new for food and We went Tex-Mex 🙄. Turned out to be tasty and very interesting. Loads of options. It was Sunday night, nice ambience, very upscale. Tacos were fantastic. We ended up having a mix and match of...More",10,Aug-17,3.5,Crossroads Restaurant and Bar
lizzielicious,Always good,"I've been here several times and different times of the week. Wednesdays Taco nights, Fridays and Saturdays with live bands and on a Monday. I've had birthdays, meetings and hang outs here  The service is always good and top notch, although sometimes, the waitresses can...More",30,Apr-17,3.5,Crossroads Restaurant and Bar
terrymlon,Fun,"Good service and food, fun atmosphere and open late at night. Shame about all the smoking and rather dubious clients...",40,Apr-17,3.5,Crossroads Restaurant and Bar
yassarh2016,Excellent food and ambiance,"Their food is perfect, very tasty and the presentation is just WAW.
The team and the Manager (Hisham) are soo cool and they play around and serve their guests perfectly.
Excellent food, live music, fine people, and all the drinks you imagine to have.
It...More",50,Apr-17,3.5,Crossroads Restaurant and Bar
Michael P,Nice food and ambiance,"I love Mexican food and crave authentic Tex Mex. I tried this at Crossroads and it was nice. Had the fish tacos and soup and... nice. Was it authentic Mexican? No. Having traveled multiple times to Mexico City, Puebla, Cuernavaca, TJ and Nogales, never had...More",40,Mar-17,3.5,Crossroads Restaurant and Bar
Fstate,A SHINING light in a hotel with bad service,"I were staying in the Eko Hotel, Lagos for a week and tried various of the restaurants.  My biggest regret is that I did not try Cross Roads on my first night as This mean I would have made it my every night restaurant.  The...More",40,Mar-17,3.5,Crossroads Restaurant and Bar
ChrisA90B92,"Tex-Mex, that's all","Staying at Eko Hotel I had dinner at Crossroads. Very convenient. Spacious place, friendly staff, long bar, trendy decor, relaxed atmosphere. 
I was served a cold Star beer and ordered classic Tex-Mex tapas like guacamole and quesadillas pluschicken fajitas. They were OK, not memorable.",40,Apr-16,3.5,Crossroads Restaurant and Bar
Madeira1964,Nice ambience - without being disrupted by girls,"I come to Crossroads with my wife once a week - usually on Saturdays.   Great band playing old school music, Nirvana, Oasis and Hendrix.    The atmosphere is relaxed and people generally enjoying the band.   By 11pm the music turn to DJ for a more dance...More",50,Mar-17,3.5,Crossroads Restaurant and Bar
douglasvh,Authentic Mexican Food,"Crossroads could have chosen a better name, but it may reflect their mix of food options. I've been there to get the Mexican food. Although they admit it's a Tex-Mex retaraunt, the have authentic dishes like sopa de fijoles, flautas and the such. There's live...More",30,Nov-16,3.5,Crossroads Restaurant and Bar
Preshie143,Cocktails and dancing,I'm not one who usually goes for cocktails but really enjoyed the ones I had here. I didn't have anything to eat as I met up with friends for drinks but a great place to start your evening.,35,Dec-16,3.5,Crossroads Restaurant and Bar
Ochonogorgabriel,Wonderful,"It was a cool place to dine.

Good music.
Well trained staffs 
Amazing environment

And finally,good food.

I recommend this place for anyone hoping to step out from their comfort zone.",40,Jul-16,3.5,Crossroads Restaurant and Bar
ReviewsByNS,Should have offered a different Cuisine,"It's Mexican... v nice ambience and setting , but the food leaves a unsatisfied urge to try something else.
I feel they should blend the offering here with say Italian rather than restricting it to just Mexican .",40,Jul-16,3.5,Crossroads Restaurant and Bar
cashwash,something new for a try,"Nice place, spacious and well organized seating, nice visual arts. It's Mexican food, but we understand that we are in Nigeria so we didn't expect a lot. Ordered 2 kinds of soup and fajitas, some snacks. Expensive for the quality of food.",35,Jun-16,3.5,Crossroads Restaurant and Bar
Nadim C,Nice place for drinks,"Great place for drinks and Mexican snacks. It's quite spacious, with a big bar and a great band that plays live music on weekends.

The drinks are good (go for the Margarita pitcher) and there's quite a variety of Mexican dishes (appetizers, main dishes...).",40,Sep-16,3.5,Crossroads Restaurant and Bar
Mark R,TexMex in Nigeria,Not bad by African standards for mexican food. I had the mixed fajitas and they were pretty good. The tortillas could use some work.,40,Sep-16,3.5,Crossroads Restaurant and Bar
Ianfung,VERY ORDINARY COOKING AND VERY EXPENSIVE,Went to the EKO with intention to try either their grill or Chinese but took a chance and try this TEX-MAX since I am not such a fan ( meaning try again and let see how good it is ). Tried their house specialty and...More,30,Sep-16,3.5,Crossroads Restaurant and Bar
Israel R,Get together dinner of friend,"our reservation was made  days before. We got there wit a good welcome from the waiters, after having drinks on bar we then move to the restaurant. Service from the waiter (Israel) was really outstanding cos he display a whole lot of  professionalism, from pouring...More",30,Jul-16,3.5,Crossroads Restaurant and Bar
JacksonLagos,Mexican food for expense accounts!,"Always keen to visit any new restaurant or bar opening in downtown Lagos, it took me a surprisingly long time to get around to visiting Crossroads. I am sure the irony of naming the joint after a long-forgotten English soap opera about a drab, midlands...More",40,Jun-16,3.5,Crossroads Restaurant and Bar
AkinO_13,A delightful Mexican Restaurant in Hotel setting,Was at this Restaurant when it opened for business last year and had since been repeating the patronage. it had remained consistent in the standard of food and level of courtesy of the staff. Cold drinks are served chilled and all food served authentically hot....More,40,May-16,3.5,Crossroads Restaurant and Bar
AirplaneLiving,Could be better,"Mexican tapas restaurant located on the property of Eko hotel. 
In my opinion it is overpriced for mediocre food and experience. I suspect the location keeps it in business because it is the closest restaurant to the hotel front entrance. 
The menu offers fresh guacamole...More",30,May-16,3.5,Crossroads Restaurant and Bar
ShaneR466,"Good food, good atmosphere",The first thing that I ordered was a Star beer. The beer arrived almost immediately and it was ICE cold. A great start to a very pleasant evening. The food was delicious and the service was first class. I will be back!,50,May-16,3.5,Crossroads Restaurant and Bar
arnoudm397,"Good vibe, atmosphere and food","Definately a good choice in the EKO hotel. Trendy interior and music. Also a great bar and good service (= rare). Prices of food did go up in April, which now makes it a really expensive place, also considering that portions are a bit small",40,Apr-16,3.5,Crossroads Restaurant and Bar
Israel R,Groovy,Great place to be....... Was really thrilled by their service food atmosphere and even the kind of people around,40,Apr-16,3.5,Crossroads Restaurant and Bar
Odeheba,"Great service, Good food","I was treated to a birthday dinner at Crossroads. The first stand-out is the layout of the place. Very spacious, with the lounge a step up from the dining floor. The lighting is dim enough for relaxation yet bright enough to appreciate the decor. And...More",30,Apr-16,3.5,Crossroads Restaurant and Bar
gamboolman,Good Mexican,"Our 1st time to Crossroads will not be our last.  Food and service was excellent.  The live band was very good and not too loud.  Prices were normal for Lagos.  The bar selection was good, mixed drinks we had were good
Wound not hesitate to...More",35,Apr-16,3.5,Crossroads Restaurant and Bar
dirkv278,Good vibe and nice Tex-mex food,"When you want to relax and enjoy food, music and a cocktail the crossroads is a nice place to visit. The menu is various with different fajitas, delicious salmon and nice appetisers. Every Saturday there's a live band playing and the bar serves various cocktails....More",40,Jan-16,3.5,Crossroads Restaurant and Bar
Frank E,"Very good food, nice atmosphere and good service.","The restaurant is one of several in the EKO hotel, being one of the recently renewed venues. It seems it is a bit difficult to find for locals as many tables are not occupied. 

The food and service is nearly excellent with high focus on...More",40,Dec-15,3.5,Crossroads Restaurant and Bar
FunmiFibbs,"Food, and Salsa, Fun trip to Mexico in Lagos....","Arrived to a quiet restaurant and watched it turn into a very exciting dance bar....
 The transition was not imposing. However the sound was a little off at first, but the host came to our table to explain that they were auditioning for a new...More",35,Oct-15,3.5,Crossroads Restaurant and Bar
whyzi,Does not live up to a Hotel restaurant,We arrived at the restaurant through the revolving doors and the doors suddenly stopped while we were inside the door basically trapping us.  I then waved to get someone's attention and the slim manager man waved to us to go out the small crack left...More,50,Nov-15,3.5,Crossroads Restaurant and Bar
esbech,Surprisingly good,"Had a wonderful dinner here during a stay in the hotel it is located.
The food is a kind of modern mexican, but with due consideration to the original tastes.
All in all a wonderful meal and service was very good.",40,Nov-15,3.5,Crossroads Restaurant and Bar
THOMASFROMDAMASCUS,Never in my wildest dreams did I ever expect to enjoy a terrific and authentic Mexican Meal in Lagos!!,"The Cross Roads Mexican Restaurant & Tapas Bar is located on the Lobby Floor of the Eko Hotel, in Lagos.
This restaurant has just opened and they had not yet celebrated their Grand Opening. 
We sat at the Bar as it looked inviting and there...More",50,Sep-15,3.5,Crossroads Restaurant and Bar
Mooncake1969,excellent tapas and bar,"came here last Thursday during the management cocktail. Margaritas were excellent as were the Mexican tapas. We dined on tortilla, nachos with homemade salsas and Quesadillas. We had the pleasure to meet their Mexican chef ""Fernando"" who explained all the dishes. The restaurant is going...More",40,Aug-15,3.5,Crossroads Restaurant and Bar
